play_id,play_title,section,act,scene,scene_index_in_play,unit_index_in_play,type,speaker_original,speaker_normalized,original_text,vader_score,dl_score,dl2_score
as-you-like-it,As You Like It,main,1,1,1,1,stage_direction,,,Enter ORLANDO and ADAM,0.0,0.98571,0.03775
as-you-like-it,As You Like It,main,1,1,1,2,speech,ORLANDO,ORLANDO,"As I remember, Adam, it was upon this fashion
bequeathed me by will but poor a thousand crowns, and,
as thou sayest, charged my brother on his blessing to
breed me well. And there begins my sadness. My brother
Jacques he keeps at school, and report speaks goldenly
of his profit. For my part, he keeps me rustically at
home or, to speak more properly, stays me here at home
unkept; for call you that “keeping” for a gentleman of
my birth that differs not from the stalling of an ox?
His horses are bred better, for, besides that they are
fair with their feeding, they are taught their manage
and, to that end, riders dearly hired. But I, his
brother, gain nothing under him but growth, for the
which his animals on his dunghills are as much bound to
him as I. Besides this nothing that he so plentifully
gives me, the something that nature gave me his
countenance seems to take from me. He lets me feed with
his hinds, bars me the place of a brother, and, as much
as in him lies, mines my gentility with my education.
This is it, Adam, that grieves me, and the spirit of my
father, which I think is within me, begins to mutiny
against this servitude. I will no longer endure it,
though yet I know no wise remedy how to avoid it.",0.8481,-0.99782,-0.7034
as-you-like-it,As You Like It,main,1,1,1,3,stage_direction,,,Enter OLIVER,0.0,0.96653,0.01496
as-you-like-it,As You Like It,main,1,1,1,4,speech,ADAM,ADAM,"Yonder comes my master, your brother.",0.0,-0.69643,0.76217
as-you-like-it,As You Like It,main,1,1,1,5,speech,ORLANDO,ORLANDO,"Go apart, Adam, and thou shalt hear how he will shake
me up.",-0.1779,-0.99691,-0.15085
as-you-like-it,As You Like It,main,1,1,1,6,speech,OLIVER,OLIVER,"Now, sir, what make you here?",0.0,-0.99829,0.00249
as-you-like-it,As You Like It,main,1,1,1,7,speech,ORLANDO,ORLANDO,Nothing. I am not taught to make anything.,0.0,-0.99892,-0.56875
as-you-like-it,As You Like It,main,1,1,1,8,speech,OLIVER,OLIVER,"What mar you then, sir?",0.0,-0.99603,-0.02549
as-you-like-it,As You Like It,main,1,1,1,9,speech,ORLANDO,ORLANDO,"Marry, sir, I am helping you to mar that which God
made, a poor unworthy brother of yours, with idleness.",-0.1779,-0.99758,0.6871
as-you-like-it,As You Like It,main,1,1,1,10,speech,OLIVER,OLIVER,"Marry, sir, be better employed, and be naught awhile.",0.6478,-0.99878,-0.31259
as-you-like-it,As You Like It,main,1,1,1,11,speech,ORLANDO,ORLANDO,"Shall I keep your hogs and eat husks with them? What
prodigal portion have I spent that I should come to such
penury?",-0.8201,-0.99855,-0.21104
as-you-like-it,As You Like It,main,1,1,1,12,speech,OLIVER,OLIVER,"Know you where you are, sir?",0.0,-0.99658,0.00015
as-you-like-it,As You Like It,main,1,1,1,13,speech,ORLANDO,ORLANDO,"O sir, very well: here in your orchard.",0.3384,0.97737,0.62415
as-you-like-it,As You Like It,main,1,1,1,14,speech,OLIVER,OLIVER,"Know you before whom, sir?",0.0,-0.99881,0.01099
as-you-like-it,As You Like It,main,1,1,1,15,speech,ORLANDO,ORLANDO,"Ay, better than him I am before knows me. I know you
are my eldest brother, and in the gentle condition of
blood you should so know me. The courtesy of nations
allows you my better, in that you are the first-born,
but the same tradition takes not away my blood, were
there twenty brothers betwixt us. I have as much of my
father in me as you, albeit, I confess, your coming
before me is nearer to his reverence.",0.8968,0.99486,0.46239
as-you-like-it,As You Like It,main,1,1,1,16,speech,OLIVER,OLIVER,"What, boy! [strikes him]",-0.4199,-0.99361,0.64399
as-you-like-it,As You Like It,main,1,1,1,17,speech,ORLANDO,ORLANDO,"Come, come, elder brother, you are too young in this.
[seizes him]",-0.4199,-0.99765,0.36069
as-you-like-it,As You Like It,main,1,1,1,18,speech,OLIVER,OLIVER,"Wilt thou lay hands on me, villain?",-0.5574,-0.98537,0.02442
as-you-like-it,As You Like It,main,1,1,1,19,speech,ORLANDO,ORLANDO,"I am no villain. I am the youngest son of Sir Rowland
de Boys. He was my father, and he is thrice a villain
that says such a father begot villains. Wert thou not my
brother, I would not take this hand from thy throat
till this other had pulled out thy tongue for saying so.
Thou hast railed on thyself.",-0.8547,-0.98465,-0.77514
as-you-like-it,As You Like It,main,1,1,1,20,speech,ADAM,ADAM,"Sweet masters, be patient. For your father’s
remembrance, be at accord.",0.8689,0.99586,0.46002
as-you-like-it,As You Like It,main,1,1,1,21,speech,OLIVER,OLIVER,"Let me go, I say.",0.0,-0.98503,0.26114
as-you-like-it,As You Like It,main,1,1,1,22,speech,ORLANDO,ORLANDO,"I will not till I please. You shall hear me. My father
charged you in his will to give me good education. You
have trained me like a peasant, obscuring and hiding
from me all gentlemanlike qualities. The spirit of my
father grows strong in me, and I will no longer endure
it. Therefore allow me such exercises as may become a
gentleman, or give me the poor allottery my father left
me by testament. With that I will go buy my fortunes.",0.9607,-0.92964,0.56522
as-you-like-it,As You Like It,main,1,1,1,23,speech,OLIVER,OLIVER,"And what wilt thou do—beg when that is spent? Well,
sir, get you in. I will not long be troubled with you.
You shall have some part of your will. I pray you leave
me.",0.7167,-0.99748,0.18012
as-you-like-it,As You Like It,main,1,1,1,24,speech,ORLANDO,ORLANDO,"I will no further offend you than becomes me for my
good.",0.5405,0.98955,-0.04829
as-you-like-it,As You Like It,main,1,1,1,25,speech,OLIVER,OLIVER,"Get you with him, you old dog.",0.0,-0.9959,0.32332
as-you-like-it,As You Like It,main,1,1,1,26,speech,ADAM,ADAM,"Is “old dog” my reward? Most true, I have lost my
teeth in your service. God be with my old master. He
would not have spoke such a word.",0.891,-0.99845,-0.75132
as-you-like-it,As You Like It,main,1,1,1,27,stage_direction,,,Exeunt ORLANDO and ADAM,0.0,-0.99355,0.00973
as-you-like-it,As You Like It,main,1,1,1,28,speech,OLIVER,OLIVER,"Is it even so? Begin you to grow upon me? I will physic
your rankness and yet give no thousand crowns
neither.—Holla, Dennis!",0.2387,-0.98128,-0.66487
as-you-like-it,As You Like It,main,1,1,1,29,stage_direction,,,Enter DENNIS,0.0,0.97592,0.00683
as-you-like-it,As You Like It,main,1,1,1,30,speech,DENNIS,DENNIS,Calls your Worship?,0.296,-0.48637,-0.24786
as-you-like-it,As You Like It,main,1,1,1,31,speech,OLIVER,OLIVER,"Was not Charles, the duke’s wrestler, here to speak
with me?",0.0,-0.99735,-0.02078
as-you-like-it,As You Like It,main,1,1,1,32,speech,DENNIS,DENNIS,"So please you, he is here at the door and importunes
access to you.",0.4019,0.98825,0.17968
as-you-like-it,As You Like It,main,1,1,1,33,speech,OLIVER,OLIVER,Call him in.,0.0,0.98507,0.22154
as-you-like-it,As You Like It,main,1,1,1,34,stage_direction,,,Exit DENNIS,0.0,-0.99621,-0.08587
as-you-like-it,As You Like It,main,1,1,1,35,speech,OLIVER,OLIVER,"'Twill be a good way, and tomorrow the wrestling is.",0.4404,0.99666,0.4494
as-you-like-it,As You Like It,main,1,1,1,36,stage_direction,,,Enter CHARLES,0.0,0.97164,0.02106
as-you-like-it,As You Like It,main,1,1,1,37,speech,CHARLES,CHARLES,Good morrow to your Worship.,0.6249,0.99745,0.19418
as-you-like-it,As You Like It,main,1,1,1,38,speech,OLIVER,OLIVER,"Good Monsieur Charles, what’s the new news at the new
court?",0.4404,0.99193,0.03872
as-you-like-it,As You Like It,main,1,1,1,39,speech,CHARLES,CHARLES,"There’s no news at the court, sir, but the old news.
That is, the old duke is banished by his younger brother
the new duke, and three or four loving lords have put
themselves into voluntary exile with him, whose lands
and revenues enrich the new duke. Therefore he gives
them good leave to wander.",0.8625,-0.99112,-0.4213
as-you-like-it,As You Like It,main,1,1,1,40,speech,OLIVER,OLIVER,"Can you tell if Rosalind, the duke’s daughter, be
banished with her father?",0.0,-0.98447,-0.49456
as-you-like-it,As You Like It,main,1,1,1,41,speech,CHARLES,CHARLES,"Oh, no, for the duke’s daughter her cousin so loves
her, being ever from their cradles bred together, that
she would have followed her exile or have died to stay
behind her. She is at the court, and no less beloved of
her uncle than his own daughter, and never two ladies
loved as they do.",0.8225,0.99645,0.58053
as-you-like-it,As You Like It,main,1,1,1,42,speech,OLIVER,OLIVER,Where will the old duke live?,0.0,-0.97832,-0.00606
as-you-like-it,As You Like It,main,1,1,1,43,speech,CHARLES,CHARLES,"They say he is already in the Forest of Arden, and a
many merry men with him; and there they live like the
old Robin Hood of England. They say many young gentlemen
flock to him every day and fleet the time carelessly,
as they did in the golden world.",0.678,0.99441,0.42127
as-you-like-it,As You Like It,main,1,1,1,44,speech,OLIVER,OLIVER,"What, you wrestle tomorrow before the new duke?",0.0,0.64938,0.00514
as-you-like-it,As You Like It,main,1,1,1,45,speech,CHARLES,CHARLES,"Marry, do I, sir, and I came to acquaint you with a
matter. I am given, sir, secretly to understand that
your younger brother Orlando hath a disposition to come
in disguised against me to try a fall. Tomorrow, sir, I
wrestle for my credit, and he that escapes me without
some broken limb shall acquit him well. Your brother is
but young and tender, and, for your love I would be
loath to foil him, as I must for my own honor if he come
in. Therefore, out of my love to you, I came hither to
acquaint you withal, that either you might stay him from
his intendment or brook such disgrace well as he shall
run into, in that it is a thing of his own search and
altogether against my will.",0.35,0.98749,0.61484
as-you-like-it,As You Like It,main,1,1,1,46,speech,OLIVER,OLIVER,"Charles, I thank thee for thy love to me, which thou
shalt find I will most kindly requite. I had myself
notice of my brother’s purpose herein and have by
underhand means labored to dissuade him from it; but he
is resolute. I’ll tell thee, Charles: it is the
stubbornest young fellow of France, full of ambition, an
envious emulator of every man’s good parts, a secret
and villainous contriver against me his natural brother.
Therefore use thy discretion. I had as lief thou didst
break his neck as his finger. And thou wert best look to
’t, for if thou dost him any slight disgrace or if he
do not mightily grace himself on thee, he will practice
against thee by poison, entrap thee by some treacherous
device and never leave thee till he hath ta'en thy life
by some indirect means or other. For I assure thee—and
almost with tears I speak it—there is not one so young
and so villainous this day living. I speak but brotherly
of him, but should I anatomize him to thee as he is, I
must blush and weep, and thou must look pale and wonder.",-0.9679,-0.37155,-0.15816
as-you-like-it,As You Like It,main,1,1,1,47,speech,CHARLES,CHARLES,"I am heartily glad I came hither to you. If he come
tomorrow, I’ll give him his payment. If ever he go alone
again, I’ll never wrestle for prize more. And so God
keep your Worship.",0.8553,0.99548,0.55583
as-you-like-it,As You Like It,main,1,1,1,48,speech,OLIVER,OLIVER,"Farewell, good Charles.",0.4404,0.99631,0.52047
as-you-like-it,As You Like It,main,1,1,1,49,stage_direction,,,Exit CHARLES,0.0,-0.99554,0.01026
as-you-like-it,As You Like It,main,1,1,1,50,speech,OLIVER,OLIVER,"Now will I stir this gamester. I hope I shall see an
end of him, for my soul—yet I know not why—hates nothing
more than he. Yet he’s gentle, never schooled and yet
learned, full of noble device, of all sorts enchantingly
beloved, and indeed so much in the heart of the world
and especially of my own people, who best know him, that
I am altogether misprized. But it shall not be so long;
this wrestler shall clear all. Nothing remains but that
I kindle the boy thither, which now I’ll go about.",0.9661,0.98506,0.24704
as-you-like-it,As You Like It,main,1,1,1,51,stage_direction,,,Exit,0.0,-0.99552,-0.01975
as-you-like-it,As You Like It,main,1,2,2,52,stage_direction,,,Enter CELIA and ROSALIND,0.0,0.98203,0.10925
as-you-like-it,As You Like It,main,1,2,2,53,speech,CELIA,CELIA,"I pray thee, Rosalind, sweet my coz, be merry.",0.8402,0.99763,0.50095
as-you-like-it,As You Like It,main,1,2,2,54,speech,ROSALIND,ROSALIND,"Dear Celia, I show more mirth than I am mistress of,
and would you yet I were merrier? Unless you could teach
me to forget a banished father, you must not learn me
how to remember any extraordinary pleasure.",0.9477,-0.99793,-0.72351
as-you-like-it,As You Like It,main,1,2,2,55,speech,CELIA,CELIA,"Herein I see thou lov’st me not with the full weight
that I love thee. If my uncle, thy banished father, had
banished thy uncle, the duke my father, so thou hadst
been still with me, I could have taught my love to take
thy father for mine. So wouldst thou, if the truth of
thy love to me were so righteously tempered as mine is
to thee.",0.9191,0.98404,-0.60691
as-you-like-it,As You Like It,main,1,2,2,56,speech,ROSALIND,ROSALIND,"Well, I will forget the condition of my estate to
rejoice in yours.",0.4767,0.99697,-0.4564
as-you-like-it,As You Like It,main,1,2,2,57,speech,CELIA,CELIA,"You know my father hath no child but I, nor none is
like to have, and, truly, when he dies, thou shalt be
his heir, for what he hath taken away from thy father
perforce, I will render thee again in affection. By mine
honor I will, and when I break that oath, let me turn
monster. Therefore, my sweet Rose, my dear Rose, be
merry.",0.9449,0.98816,0.8483
as-you-like-it,As You Like It,main,1,2,2,58,speech,ROSALIND,ROSALIND,"From henceforth I will, coz, and devise sports. Let me
see—what think you of falling in love?",0.7184,0.99257,0.43988
as-you-like-it,As You Like It,main,1,2,2,59,speech,CELIA,CELIA,"Marry, I prithee do, to make sport withal, but love no
man in good earnest, nor no further in sport neither
than with safety of a pure blush thou mayst in honor
come off again.",0.9,0.9899,-0.49931
as-you-like-it,As You Like It,main,1,2,2,60,speech,ROSALIND,ROSALIND,"What shall be our sport, then?",0.34,-0.93352,-0.00809
as-you-like-it,As You Like It,main,1,2,2,61,speech,CELIA,CELIA,"Let us sit and mock the good housewife Fortune from her
wheel, that her gifts may henceforth be bestowed
equally.",0.0258,-0.99166,0.18936
as-you-like-it,As You Like It,main,1,2,2,62,speech,ROSALIND,ROSALIND,"I would we could do so, for her benefits are mightily
misplaced, and the bountiful blind woman doth most
mistake in her gifts to women.",-0.024,-0.99227,-0.78195
as-you-like-it,As You Like It,main,1,2,2,63,speech,CELIA,CELIA,"'Tis true, for those that she makes fair she scarce
makes honest, and those that she makes honest she makes
very ill- favoredly.",0.5267,-0.99613,-0.46478
as-you-like-it,As You Like It,main,1,2,2,64,speech,ROSALIND,ROSALIND,"Nay, now thou goest from Fortune’s office to Nature’s.
Fortune reigns in gifts of the world, not in the
lineaments of
Nature.",-0.3182,-0.99686,-0.01897
as-you-like-it,As You Like It,main,1,2,2,65,stage_direction,,,Enter TOUCHSTONE,0.0,0.96135,0.02871
as-you-like-it,As You Like It,main,1,2,2,66,speech,CELIA,CELIA,"No? When Nature hath made a fair creature, may she not
by Fortune fall into the fire? Though Nature hath given
us wit to flout at Fortune, hath not Fortune sent in
this fool to cut off the argument?",-0.766,-0.99804,-0.56706
as-you-like-it,As You Like It,main,1,2,2,67,speech,ROSALIND,ROSALIND,"Indeed, there is Fortune too hard for Nature, when
Fortune makes Nature’s natural the cutter-off of
Nature’s wit.",0.0258,0.78459,0.1631
as-you-like-it,As You Like It,main,1,2,2,68,speech,CELIA,CELIA,"Peradventure this is not Fortune’s work neither, but
Nature’s, who perceiveth our natural wits too dull to
reason of such goddesses, and hath sent this natural for
our whetstone, for always the dullness of the fool is
the whetstone of the wits. How now, wit, whither wander
you?",-0.9235,0.94034,0.11201
as-you-like-it,As You Like It,main,1,2,2,69,speech,TOUCHSTONE,TOUCHSTONE,"Mistress, you must come away to your father.",0.0,0.96022,0.25625
as-you-like-it,As You Like It,main,1,2,2,70,speech,CELIA,CELIA,Were you made the messenger?,0.0,-0.99886,-0.02873
as-you-like-it,As You Like It,main,1,2,2,71,speech,TOUCHSTONE,TOUCHSTONE,"No, by mine honor, but I was bid to come for you.",0.2732,-0.97779,-0.17919
as-you-like-it,As You Like It,main,1,2,2,72,speech,ROSALIND,ROSALIND,"Where learned you that oath, fool?",0.0258,-0.995,-0.08774
as-you-like-it,As You Like It,main,1,2,2,73,speech,TOUCHSTONE,TOUCHSTONE,"Of a certain knight that swore by his honor they were
good pancakes, and swore by his honor the mustard was
naught. Now, I’ll stand to it, the pancakes were naught
and the mustard was good, and yet was not the knight
forsworn.",0.8317,0.89021,0.25759
as-you-like-it,As You Like It,main,1,2,2,74,speech,CELIA,CELIA,How prove you that in the great heap of your knowledge?,0.6249,-0.99658,-0.44252
as-you-like-it,As You Like It,main,1,2,2,75,speech,ROSALIND,ROSALIND,"Ay, marry, now unmuzzle your wisdom.",0.8126,0.99447,0.32982
as-you-like-it,As You Like It,main,1,2,2,76,speech,TOUCHSTONE,TOUCHSTONE,"Stand you both forth now: stroke your chins and swear
by your beards that I am a knave.",-0.5994,-0.9985,-0.12024
as-you-like-it,As You Like It,main,1,2,2,77,speech,CELIA,CELIA,"By our beards (if we had them), thou art.",-0.5719,-0.99834,-0.76302
as-you-like-it,As You Like It,main,1,2,2,78,speech,TOUCHSTONE,TOUCHSTONE,"By my knavery (if I had it), then I were. But if you
swear by that that is not, you are not forsworn. No more
was this knight swearing by his honor, for he never had
any; or if he had, he had sworn it away before ever he
saw those pancakes or that mustard.",0.1729,-0.99664,-0.84807
as-you-like-it,As You Like It,main,1,2,2,79,speech,CELIA,CELIA,"Prithee, who is ’t that thou mean’st?",0.0,-0.99684,-0.02493
as-you-like-it,As You Like It,main,1,2,2,80,speech,TOUCHSTONE,TOUCHSTONE,"One that old Frederick, your father, loves.",0.5719,0.99462,0.43063
as-you-like-it,As You Like It,main,1,2,2,81,speech,CELIA,CELIA,"My father’s love is enough to honor him. Enough. Speak
no more of him; you’ll be whipped for taxation one of
these days.",0.7351,-0.99726,-0.30331
as-you-like-it,As You Like It,main,1,2,2,82,speech,TOUCHSTONE,TOUCHSTONE,"The more pity that fools may not speak wisely what wise
men do foolishly.",-0.3182,-0.98329,-0.51145
as-you-like-it,As You Like It,main,1,2,2,83,speech,CELIA,CELIA,"By my troth, thou sayest true. For, since the little
wit that fools have was silenced, the little foolery
that wise men have makes a great show. Here comes
Monsieur Le Beau.",0.3818,0.98487,0.39291
as-you-like-it,As You Like It,main,1,2,2,84,stage_direction,,,Enter LE BEAU,0.0,0.98992,0.01294
as-you-like-it,As You Like It,main,1,2,2,85,speech,ROSALIND,ROSALIND,With his mouth full of news.,0.0,0.99234,0.32721
as-you-like-it,As You Like It,main,1,2,2,86,speech,CELIA,CELIA,Which he will put on us as pigeons feed their young.,0.3612,-0.99836,-0.4475
as-you-like-it,As You Like It,main,1,2,2,87,speech,ROSALIND,ROSALIND,Then shall we be news-crammed.,0.0,-0.95049,-0.08777
as-you-like-it,As You Like It,main,1,2,2,88,speech,CELIA,CELIA,"All the better. We shall be the more
marketable.—Bonjour,
Monsieur Le Beau. What’s the news?",0.7717,0.98552,-0.07438
as-you-like-it,As You Like It,main,1,2,2,89,speech,LE BEAU,LE BEAU,"Fair princess, you have lost much good sport.",0.4588,-0.99528,0.43921
as-you-like-it,As You Like It,main,1,2,2,90,speech,CELIA,CELIA,Sport? Of what color?,0.0,0.05522,-0.06495
as-you-like-it,As You Like It,main,1,2,2,91,speech,LE BEAU,LE BEAU,"What color, madam? How shall I answer you?",0.0,-0.99895,-0.33359
as-you-like-it,As You Like It,main,1,2,2,92,speech,ROSALIND,ROSALIND,As wit and fortune will.,0.0,0.99275,0.4337
as-you-like-it,As You Like It,main,1,2,2,93,speech,TOUCHSTONE,TOUCHSTONE,Or as the Destinies decrees.,0.0,0.95768,-0.0547
as-you-like-it,As You Like It,main,1,2,2,94,speech,CELIA,CELIA,Well said. That was laid on with a trowel.,0.2732,0.99667,0.36042
as-you-like-it,As You Like It,main,1,2,2,95,speech,TOUCHSTONE,TOUCHSTONE,"Nay, if I keep not my rank—",0.2732,-0.99337,-0.29115
as-you-like-it,As You Like It,main,1,2,2,96,speech,ROSALIND,ROSALIND,Thou losest thy old smell.,-0.4019,-0.97581,-0.5032
as-you-like-it,As You Like It,main,1,2,2,97,speech,LE BEAU,LE BEAU,"You amaze me, ladies. I would have told you of good
wrestling, which you have lost the sight of.",-0.0516,-0.99899,-0.16168
as-you-like-it,As You Like It,main,1,2,2,98,speech,ROSALIND,ROSALIND,You tell us the manner of the wrestling.,0.0,-0.97011,0.01911
as-you-like-it,As You Like It,main,1,2,2,99,speech,LE BEAU,LE BEAU,"I will tell you the beginning, and if it please your
Ladyships, you may see the end, for the best is yet to
do, and here, where you are, they are coming to perform
it.",0.7845,0.99527,0.42591
as-you-like-it,As You Like It,main,1,2,2,100,speech,CELIA,CELIA,"Well, the beginning that is dead and buried.",-0.4939,-0.99891,-0.47495
as-you-like-it,As You Like It,main,1,2,2,101,speech,LE BEAU,LE BEAU,There comes an old man and his three sons—,0.0,-0.94666,-0.15815
as-you-like-it,As You Like It,main,1,2,2,102,speech,CELIA,CELIA,I could match this beginning with an old tale.,0.3612,-0.99755,0.00828
as-you-like-it,As You Like It,main,1,2,2,103,speech,LE BEAU,LE BEAU,"Three proper young men of excellent growth and
presence.",0.4404,0.99758,0.39275
as-you-like-it,As You Like It,main,1,2,2,104,speech,ROSALIND,ROSALIND,"With bills on their necks: “Be it known unto all men by
these presents.”",0.0,0.98915,0.00574
as-you-like-it,As You Like It,main,1,2,2,105,speech,LE BEAU,LE BEAU,"The eldest of the three wrestled with Charles, the
duke’s wrestler, which Charles in a moment threw him and
broke three of his ribs, that there is little hope of
life in him. So he served the second, and so the third.
Yonder they lie, the poor old man their father making
such pitiful dole over them that all the beholders take
his part with weeping.",-0.9457,-0.99618,-0.10833
as-you-like-it,As You Like It,main,1,2,2,106,speech,ROSALIND,ROSALIND,Alas!,0.0,-0.9893,0.60913
as-you-like-it,As You Like It,main,1,2,2,107,speech,TOUCHSTONE,TOUCHSTONE,"But what is the sport, monsieur, that the ladies have
lost?",-0.4215,-0.99293,-0.50324
as-you-like-it,As You Like It,main,1,2,2,108,speech,LE BEAU,LE BEAU,"Why, this that I speak of.",0.0,0.9326,-0.02184
as-you-like-it,As You Like It,main,1,2,2,109,speech,TOUCHSTONE,TOUCHSTONE,"Thus men may grow wiser every day. It is the first time
that ever I heard breaking of ribs was sport for
ladies.",0.296,-0.92391,0.02844
as-you-like-it,As You Like It,main,1,2,2,110,speech,CELIA,CELIA,"Or I, I promise thee.",0.3182,0.9933,0.5065
as-you-like-it,As You Like It,main,1,2,2,111,speech,ROSALIND,ROSALIND,"But is there any else longs to see this broken music in
his sides? Is there yet another dotes upon
rib-breaking? Shall we see this wrestling, cousin?",-0.5224,0.91882,-0.63869
as-you-like-it,As You Like It,main,1,2,2,112,speech,LE BEAU,LE BEAU,"You must if you stay here, for here is the place
appointed for the wrestling, and they are ready to
perform it.",0.3612,0.9967,-0.02252
as-you-like-it,As You Like It,main,1,2,2,113,speech,CELIA,CELIA,"Yonder sure they are coming. Let us now stay and see
it.",0.4019,0.99728,0.41059
as-you-like-it,As You Like It,main,1,2,2,114,stage_direction,,,"Flourish. Enter DUKE FREDERICK, lords, ORLANDO, CHARLES, and attendants",0.25,0.98676,0.14836
as-you-like-it,As You Like It,main,1,2,2,115,speech,DUKE FREDERICK,DUKE FREDERICK,"Come on. Since the youth will not be entreated, his own
peril on his forwardness.",-0.2023,-0.99377,-0.43423
as-you-like-it,As You Like It,main,1,2,2,116,speech,ROSALIND,ROSALIND,Is yonder the man?,0.0,0.99526,-0.05389
as-you-like-it,As You Like It,main,1,2,2,117,speech,LE BEAU,LE BEAU,"Even he, madam.",0.0,0.98671,0.02088
as-you-like-it,As You Like It,main,1,2,2,118,speech,CELIA,CELIA,"Alas, he is too young. Yet he looks successfully.",0.6369,-0.99404,-0.57997
as-you-like-it,As You Like It,main,1,2,2,119,speech,DUKE FREDERICK,DUKE FREDERICK,"How now, daughter and cousin? Are you crept hither to
see the wrestling?",0.0,0.99654,-0.01371
as-you-like-it,As You Like It,main,1,2,2,120,speech,ROSALIND,ROSALIND,"Ay, my liege, so please you give us leave.",0.4019,0.99271,-0.25489
as-you-like-it,As You Like It,main,1,2,2,121,speech,DUKE FREDERICK,DUKE FREDERICK,"You will take little delight in it, I can tell you,
there is such odds in the man. In pity of the
challenger’s youth, I would fain dissuade him, but he
will not be entreated. Speak to him, ladies; see if you
can move him.",-0.2415,-0.99033,-0.81443
as-you-like-it,As You Like It,main,1,2,2,122,speech,CELIA,CELIA,"Call him hither, good Monsieur Le Beau.",0.4404,0.99379,0.46045
as-you-like-it,As You Like It,main,1,2,2,123,speech,DUKE FREDERICK,DUKE FREDERICK,Do so. I’ll not be by.,0.0,-0.99814,-0.095
as-you-like-it,As You Like It,main,1,2,2,124,speech,LE BEAU,LE BEAU,"Monsieur the challenger, the Princess calls for you.",0.128,0.97669,0.27762
as-you-like-it,As You Like It,main,1,2,2,125,speech,ORLANDO,ORLANDO,I attend them with all respect and duty.,0.4767,0.99413,0.10708
as-you-like-it,As You Like It,main,1,2,2,126,speech,ROSALIND,ROSALIND,"Young man, have you challenged Charles the wrestler?",-0.1027,0.87532,0.00607
