play_id,play_title,section,act,scene,scene_index_in_play,unit_index_in_play,type,speaker_original,speaker_normalized,original_text,vader_score,dl_score
henry-vi-part-2,"Henry VI, Part 2",main,4,2,13,626,speech,HOLLAND,HOLLAND,"True; and yet it is said, labour in thy vocation;
which is as much to say as, let the magistrates be
labouring men; and therefore should we be
magistrates.",0.4753,-0.08446
henry-vi-part-2,"Henry VI, Part 2",main,4,2,13,627,speech,BEVIS,BEVIS,"Thou hast hit it; for there's no better sign of a
brave mind than a hard hand.",0.4007,-0.19324
henry-vi-part-2,"Henry VI, Part 2",main,4,2,13,628,speech,HOLLAND,HOLLAND,"I see them! I see them! There's Best's son, the
tanner of Wingham,—",0.0,0.77978
henry-vi-part-2,"Henry VI, Part 2",main,4,2,13,629,speech,BEVIS,BEVIS,"He shall have the skin of our enemies, to make
dog's-leather of.",-0.5411,0.41043
henry-vi-part-2,"Henry VI, Part 2",main,4,2,13,630,speech,HOLLAND,HOLLAND,"And Dick the Butcher,—",-0.5106,-0.18905
henry-vi-part-2,"Henry VI, Part 2",main,4,2,13,631,speech,BEVIS,BEVIS,"Then is sin struck down like an ox, and iniquity's
throat cut like a calf.",-0.7783,-0.05158
henry-vi-part-2,"Henry VI, Part 2",main,4,2,13,632,speech,HOLLAND,HOLLAND,"And Smith the weaver,—",0.0,0.19354
henry-vi-part-2,"Henry VI, Part 2",main,4,2,13,633,speech,BEVIS,BEVIS,"Argo, their thread of life is spun.",0.34,0.02768
henry-vi-part-2,"Henry VI, Part 2",main,4,2,13,634,speech,HOLLAND,HOLLAND,"Come, come, let's fall in with them.",0.3595,0.39678
henry-vi-part-2,"Henry VI, Part 2",main,4,2,13,635,stage_direction,,,"Drum. Enter CADE, DICK the Butcher, SMITH the Weaver, and a Sawyer, with infinite numbers",-0.6166,0.07792
henry-vi-part-2,"Henry VI, Part 2",main,4,2,13,636,speech,CADE,CADE,"We John Cade, so termed of our supposed father,—",0.0,0.05501
henry-vi-part-2,"Henry VI, Part 2",main,4,2,13,637,speech,DICK,DICK,"[Aside] Or rather, of stealing a cade of herrings.",0.0,-0.44833
henry-vi-part-2,"Henry VI, Part 2",main,4,2,13,638,speech,CADE,CADE,"For our enemies shall fall before us, inspired with
the spirit of putting down kings and princes,
—Command silence.",0.0,-0.25301
henry-vi-part-2,"Henry VI, Part 2",main,4,2,13,639,speech,DICK,DICK,Silence!,0.0,0.46697
henry-vi-part-2,"Henry VI, Part 2",main,4,2,13,640,speech,CADE,CADE,"My father was a Mortimer,—",0.0,-0.3953
henry-vi-part-2,"Henry VI, Part 2",main,4,2,13,641,speech,DICK,DICK,"[Aside] He was an honest man, and a good
bricklayer.",0.7351,0.46635
henry-vi-part-2,"Henry VI, Part 2",main,4,2,13,642,speech,CADE,CADE,"My mother a Plantagenet,—",0.0,-0.13986
henry-vi-part-2,"Henry VI, Part 2",main,4,2,13,643,speech,DICK,DICK,[Aside] I knew her well; she was a midwife.,0.2732,0.47349
henry-vi-part-2,"Henry VI, Part 2",main,4,2,13,644,speech,CADE,CADE,"My wife descended of the Lacies,—",0.0,-0.11497
henry-vi-part-2,"Henry VI, Part 2",main,4,2,13,645,speech,DICK,DICK,"[Aside] She was, indeed, a pedler's daughter, and
sold many laces.",0.0,0.45354
henry-vi-part-2,"Henry VI, Part 2",main,4,2,13,646,speech,SMITH,SMITH,"[Aside] But now of late, not able to travel with her
furred pack, she washes bucks here at home.",-0.3646,-0.49038
henry-vi-part-2,"Henry VI, Part 2",main,4,2,13,647,speech,CADE,CADE,Therefore am I of an honourable house.,0.5423,0.56649
henry-vi-part-2,"Henry VI, Part 2",main,4,2,13,648,speech,DICK,DICK,"[Aside] Ay, by my faith, the field is honourable;
and there was he borne, under a hedge, for his
father had never a house but the cage.",0.4767,0.56981
henry-vi-part-2,"Henry VI, Part 2",main,4,2,13,649,speech,CADE,CADE,Valiant I am.,0.5267,0.53912
henry-vi-part-2,"Henry VI, Part 2",main,4,2,13,650,speech,SMITH,SMITH,[Aside] A' must needs; for beggary is valiant.,0.7269,0.4628
henry-vi-part-2,"Henry VI, Part 2",main,4,2,13,651,speech,CADE,CADE,I am able to endure much.,0.0,0.36685
henry-vi-part-2,"Henry VI, Part 2",main,4,2,13,652,speech,DICK,DICK,"[Aside] No question of that; for I have seen him
whipped three market-days together.",-0.296,-0.24288
henry-vi-part-2,"Henry VI, Part 2",main,4,2,13,653,speech,CADE,CADE,I fear neither sword nor fire.,-0.34,-0.23027
henry-vi-part-2,"Henry VI, Part 2",main,4,2,13,654,speech,SMITH,SMITH,"[Aside] He need not fear the sword; for his coat is of
proof.",-0.6166,0.54955
henry-vi-part-2,"Henry VI, Part 2",main,4,2,13,655,speech,DICK,DICK,"[Aside] But methinks he should stand in fear of
fire, being burnt i' the hand for stealing of sheep.",-0.5927,-0.72423
henry-vi-part-2,"Henry VI, Part 2",main,4,2,13,656,speech,CADE,CADE,"Be brave, then; for your captain is brave, and vows
reformation. There shall be in England seven
halfpenny loaves sold for a penny: the three-hooped
pot; shall have ten hoops and I will make it felony
to drink small beer: all the realm shall be in
common; and in Cheapside shall my palfrey go to
grass: and when I am king, as king I will be,—",0.4588,-0.21381
henry-vi-part-2,"Henry VI, Part 2",main,4,2,13,657,speech,ALL,ALL,God save your majesty!,0.68,0.74533
henry-vi-part-2,"Henry VI, Part 2",main,4,2,13,658,speech,CADE,CADE,"I thank you, good people: there shall be no money;
all shall eat and drink on my score; and I will
apparel them all in one livery, that they may agree
like brothers and worship me their lord.",0.7845,-0.5324
henry-vi-part-2,"Henry VI, Part 2",main,4,2,13,659,speech,DICK,DICK,"The first thing we do, let's kill all the lawyers.",-0.6908,-0.33241
henry-vi-part-2,"Henry VI, Part 2",main,4,2,13,660,speech,CADE,CADE,"Nay, that I mean to do. Is not this a lamentable
thing, that of the skin of an innocent lamb should
be made parchment? That parchment, being scribbled
o'er, should undo a man? Some say the bee stings:
but I say, 'tis the bee's wax; for I did but seal
once to a thing, and I was never mine own man
since. How now! Who's there?",0.3235,-0.52227
henry-vi-part-2,"Henry VI, Part 2",main,4,2,13,661,stage_direction,,,"Enter some, bringing forward the Clerk of Chartham",0.0,0.0916
henry-vi-part-2,"Henry VI, Part 2",main,4,2,13,662,speech,SMITH,SMITH,"The clerk of Chartham: he can write and read and
cast accompt.",0.0,0.06614
henry-vi-part-2,"Henry VI, Part 2",main,4,2,13,663,speech,CADE,CADE,O monstrous!,0.0,0.52903
henry-vi-part-2,"Henry VI, Part 2",main,4,2,13,664,speech,SMITH,SMITH,We took him setting of boys' copies.,0.0,0.11824
henry-vi-part-2,"Henry VI, Part 2",main,4,2,13,665,speech,CADE,CADE,Here's a villain!,-0.5983,0.62048
henry-vi-part-2,"Henry VI, Part 2",main,4,2,13,666,speech,SMITH,SMITH,Has a book in his pocket with red letters in't.,0.0,-0.00505
henry-vi-part-2,"Henry VI, Part 2",main,4,2,13,667,speech,CADE,CADE,"Nay, then, he is a conjurer.",0.2732,0.29238
henry-vi-part-2,"Henry VI, Part 2",main,4,2,13,668,speech,DICK,DICK,"Nay, he can make obligations, and write court-hand.",0.25,-0.16316
henry-vi-part-2,"Henry VI, Part 2",main,4,2,13,669,speech,CADE,CADE,"I am sorry for't: the man is a proper man, of mine
honour; unless I find him guilty, he shall not die.
Come hither, sirrah, I must examine thee: what is thy
name?",0.6182,0.44952
henry-vi-part-2,"Henry VI, Part 2",main,4,2,13,670,speech,CLERK,CLERK,Emmanuel.,0.0,0.31008
henry-vi-part-2,"Henry VI, Part 2",main,4,2,13,671,speech,DICK,DICK,"They use to write it on the top of letters: 'twill
go hard with you.",-0.3182,-0.33404
henry-vi-part-2,"Henry VI, Part 2",main,4,2,13,672,speech,CADE,CADE,"Let me alone. Dost thou use to write thy name? Or
hast thou a mark to thyself, like an honest
plain-dealing man?",0.6072,-0.5959
henry-vi-part-2,"Henry VI, Part 2",main,4,2,13,673,speech,CLERK,CLERK,"Sir, I thank God, I have been so well brought up
that I can write my name.",0.7462,0.65256
henry-vi-part-2,"Henry VI, Part 2",main,4,2,13,674,speech,ALL,ALL,"He hath confessed: away with him! He's a villain
and a traitor.",-0.6351,0.66049
henry-vi-part-2,"Henry VI, Part 2",main,4,2,13,675,speech,CADE,CADE,"Away with him, I say! Hang him with his pen and
ink-horn about his neck.",0.0,0.3972
henry-vi-part-2,"Henry VI, Part 2",main,4,2,13,676,stage_direction,,,Exit one with the Clerk,0.0,-0.02555
henry-vi-part-2,"Henry VI, Part 2",main,4,2,13,677,stage_direction,,,Enter MICHAEL,0.0,0.01263
henry-vi-part-2,"Henry VI, Part 2",main,4,2,13,678,speech,MICHAEL,MICHAEL,Where's our general?,0.0,-0.00715
henry-vi-part-2,"Henry VI, Part 2",main,4,2,13,679,speech,CADE,CADE,"Here I am, thou particular fellow.",0.0,0.17237
henry-vi-part-2,"Henry VI, Part 2",main,4,2,13,680,speech,MICHAEL,MICHAEL,"Fly, fly, fly! Sir Humphrey Stafford and his
brother are hard by, with the king's forces.",0.0,0.36175
henry-vi-part-2,"Henry VI, Part 2",main,4,2,13,681,speech,CADE,CADE,"Stand, villain, stand, or I'll fell thee down. He
shall be encountered with a man as good as himself:
he is but a knight, is a'?",-0.4664,0.2565
henry-vi-part-2,"Henry VI, Part 2",main,4,2,13,682,speech,MICHAEL,MICHAEL,No.,0.0,-0.17625
henry-vi-part-2,"Henry VI, Part 2",main,4,2,13,683,speech,CADE,CADE,"To equal him, I will make myself a knight presently.",0.0,0.41362
henry-vi-part-2,"Henry VI, Part 2",main,4,2,13,684,stage_direction,,,Kneels,0.0,-0.04334
henry-vi-part-2,"Henry VI, Part 2",main,4,2,13,685,speech,CADE,CADE,Rise up Sir John Mortimer.,0.0,0.38399
henry-vi-part-2,"Henry VI, Part 2",main,4,2,13,686,speech,CADE,CADE,Now have at him!,0.0,0.59144
henry-vi-part-2,"Henry VI, Part 2",main,4,2,13,687,speech,SIR HUMPHREY,SIR HUMPHREY,"Rebellious hinds, the filth and scum of Kent,
Mark'd for the gallows, lay your weapons down;
Home to your cottages, forsake this groom:
The king is merciful, if you revolt.",-0.4588,-0.81097
henry-vi-part-2,"Henry VI, Part 2",main,4,2,13,688,speech,WILLIAM STAFFORD,WILLIAM STAFFORD,"But angry, wrathful, and inclined to blood,
If you go forward; therefore yield, or die.",-0.9442,-0.19182
henry-vi-part-2,"Henry VI, Part 2",main,4,2,13,689,speech,CADE,CADE,"As for these silken-coated slaves, I pass not:
It is to you, good people, that I speak,
Over whom, in time to come, I hope to reign;
For I am rightful heir unto the crown.",0.5368,-0.21805
henry-vi-part-2,"Henry VI, Part 2",main,4,2,13,690,speech,SIR HUMPHREY,SIR HUMPHREY,"Villain, thy father was a plasterer;
And thou thyself a shearman, art thou not?",-0.5574,0.57466
henry-vi-part-2,"Henry VI, Part 2",main,4,2,13,691,speech,CADE,CADE,And Adam was a gardener.,0.0,0.39896
henry-vi-part-2,"Henry VI, Part 2",main,4,2,13,692,speech,WILLIAM STAFFORD,WILLIAM STAFFORD,And what of that?,0.0,-0.23886
henry-vi-part-2,"Henry VI, Part 2",main,4,2,13,693,speech,CADE,CADE,"Marry, this: Edmund Mortimer, Earl of March.
Married the Duke of Clarence' daughter, did he not?",0.0,-0.09831
henry-vi-part-2,"Henry VI, Part 2",main,4,2,13,694,speech,SIR HUMPHREY,SIR HUMPHREY,"Ay, sir.",0.4019,0.45258
henry-vi-part-2,"Henry VI, Part 2",main,4,2,13,695,speech,CADE,CADE,By her he had two children at one birth.,0.0,-0.3165
henry-vi-part-2,"Henry VI, Part 2",main,4,2,13,696,speech,WILLIAM STAFFORD,WILLIAM STAFFORD,That's false.,-0.3252,-0.4522
henry-vi-part-2,"Henry VI, Part 2",main,4,2,13,697,speech,CADE,CADE,"Ay, there's the question; but I say, 'tis true:
The elder of them, being put to nurse,
Was by a beggar-woman stolen away;
And, ignorant of his birth and parentage,
Became a bricklayer when he came to age:
His son am I; deny it, if you can.",-0.431,-0.83905
henry-vi-part-2,"Henry VI, Part 2",main,4,2,13,698,speech,DICK,DICK,"Nay, 'tis too true; therefore he shall be king.",0.4753,-0.03915
henry-vi-part-2,"Henry VI, Part 2",main,4,2,13,699,speech,SMITH,SMITH,"Sir, he made a chimney in my father's house, and
the bricks are alive at this day to testify it;
therefore deny it not.",0.3214,-0.30435
henry-vi-part-2,"Henry VI, Part 2",main,4,2,13,700,speech,SIR HUMPHREY,SIR HUMPHREY,"And will you credit this base drudge's words,
That speaks he knows not what?",-0.3071,-0.29402
henry-vi-part-2,"Henry VI, Part 2",main,4,2,13,701,speech,ALL,ALL,"Ay, marry, will we; therefore get ye gone.",0.4574,0.7686
henry-vi-part-2,"Henry VI, Part 2",main,4,2,13,702,speech,WILLIAM STAFFORD,WILLIAM STAFFORD,"Jack Cade, the Duke of York hath taught you this.",0.0,0.09869
henry-vi-part-2,"Henry VI, Part 2",main,4,2,13,703,speech,CADE,CADE,"[Aside] He lies, for I invented it myself.
Go to, sirrah, tell the king from me, that, for his
father's sake, Henry the Fifth, in whose time boys
went to span-counter for French crowns, I am content
he shall reign; but I'll be protector over him.",-0.09,0.65089
henry-vi-part-2,"Henry VI, Part 2",main,4,2,13,704,speech,DICK,DICK,"And furthermore, we'll have the Lord Say's head for
selling the dukedom of Maine.",0.0,0.10382
henry-vi-part-2,"Henry VI, Part 2",main,4,2,13,705,speech,CADE,CADE,"And good reason; for thereby is England mained, and
fain to go with a staff, but that my puissance holds
it up. Fellow kings, I tell you that that Lord Say
hath gelded the commonwealth, and made it an eunuch:
and more than that, he can speak French; and
therefore he is a traitor.",-0.0516,-0.73824
henry-vi-part-2,"Henry VI, Part 2",main,4,2,13,706,speech,SIR HUMPHREY,SIR HUMPHREY,O gross and miserable ignorance!,-0.6634,-0.8905
henry-vi-part-2,"Henry VI, Part 2",main,4,2,13,707,speech,CADE,CADE,"Nay, answer, if you can: the Frenchmen are our
enemies; go to, then, I ask but this: can he that
speaks with the tongue of an enemy be a good
counsellor, or no?",-0.6124,-0.25932
henry-vi-part-2,"Henry VI, Part 2",main,4,2,13,708,speech,ALL,ALL,"No, no; and therefore we'll have his head.",0.0,0.25895
henry-vi-part-2,"Henry VI, Part 2",main,4,2,13,709,speech,WILLIAM STAFFORD,WILLIAM STAFFORD,"Well, seeing gentle words will not prevail,
Assail them with the army of the king.",0.7472,-0.35351
henry-vi-part-2,"Henry VI, Part 2",main,4,2,13,710,speech,SIR HUMPHREY,SIR HUMPHREY,"Herald, away; and throughout every town
Proclaim them traitors that are up with Cade;
That those which fly before the battle ends
May, even in their wives' and children's sight,
Be hang'd up for example at their doors:
And you that be the king's friends, follow me.",-0.7901,0.62172
henry-vi-part-2,"Henry VI, Part 2",main,4,2,13,711,speech,CADE,CADE,"And you that love the commons, follow me.
Now show yourselves men; 'tis for liberty.
We will not leave one lord, one gentleman:
Spare none but such as go in clouted shoon;
For they are thrifty honest men, and such
As would, but that they dare not, take our parts.",0.9151,0.78595
henry-vi-part-2,"Henry VI, Part 2",main,4,2,13,712,speech,DICK,DICK,They are all in order and march toward us.,-0.4389,0.52007
henry-vi-part-2,"Henry VI, Part 2",main,4,2,13,713,speech,CADE,CADE,"But then are we in order when we are most
out of order. Come, march forward.",-0.4753,-0.37015
henry-vi-part-2,"Henry VI, Part 2",main,4,2,13,714,stage_direction,,,Exeunt,0.0,-0.09736
henry-vi-part-2,"Henry VI, Part 2",main,4,3,14,715,stage_direction,,,"Alarums to the fight, wherein SIR HUMPHREY and WILLIAM STAFFORD are slain. Enter CADE and the rest",-0.7964,-0.01233
henry-vi-part-2,"Henry VI, Part 2",main,4,3,14,716,speech,CADE,CADE,"Where's Dick, the butcher of Ashford?",-0.5106,-0.03991
henry-vi-part-2,"Henry VI, Part 2",main,4,3,14,717,speech,DICK,DICK,"Here, sir.",0.0,0.44799
henry-vi-part-2,"Henry VI, Part 2",main,4,3,14,718,speech,CADE,CADE,"They fell before thee like sheep and oxen, and thou
behavedst thyself as if thou hadst been in thine own
slaughter-house: therefore thus will I reward thee,
the Lent shall be as long again as it is; and thou
shalt have a licence to kill for a hundred lacking
one.",0.4939,-0.24336
henry-vi-part-2,"Henry VI, Part 2",main,4,3,14,719,speech,DICK,DICK,I desire no more.,0.0772,-0.37645
henry-vi-part-2,"Henry VI, Part 2",main,4,3,14,720,speech,CADE,CADE,"And, to speak truth, thou deservest no less. This
monument of the victory will I bear;",0.3182,0.38923
henry-vi-part-2,"Henry VI, Part 2",main,4,3,14,721,speech,CADE,CADE,"and the bodies shall be dragged at my horse' heels
till I do come to London, where we will have the
mayor's sword borne before us.",-0.0516,-0.21095
henry-vi-part-2,"Henry VI, Part 2",main,4,3,14,722,speech,DICK,DICK,"If we mean to thrive and do good, break open the
gaols and let out the prisoners.",0.5267,-0.32129
henry-vi-part-2,"Henry VI, Part 2",main,4,3,14,723,speech,CADE,CADE,"Fear not that, I warrant thee. Come, let's march
towards London.",0.0951,-0.12255
henry-vi-part-2,"Henry VI, Part 2",main,4,3,14,724,stage_direction,,,Exeunt,0.0,-0.09736
henry-vi-part-2,"Henry VI, Part 2",main,4,4,15,725,stage_direction,,,"Enter KING HENRY VI with a supplication, and the QUEEN with SUFFOLK'S head, BUCKINGHAM and Lord SAY",0.0,0.2446
henry-vi-part-2,"Henry VI, Part 2",main,4,4,15,726,speech,QUEEN MARGARET,QUEEN MARGARET,"Oft have I heard that grief softens the mind,
And makes it fearful and degenerate;
Think therefore on revenge and cease to weep.
But who can cease to weep and look on this?
Here may his head lie on my throbbing breast:
But where's the body that I should embrace?",-0.7882,-0.80519
henry-vi-part-2,"Henry VI, Part 2",main,4,4,15,727,speech,BUCKINGHAM,BUCKINGHAM,"What answer makes your grace to the rebels'
supplication?",0.25,-0.01321
henry-vi-part-2,"Henry VI, Part 2",main,4,4,15,728,speech,KING HENRY VI,KING HENRY VI,"I'll send some holy bishop to entreat;
For God forbid so many simple souls
Should perish by the sword! And I myself,
Rather than bloody war shall cut them short,
Will parley with Jack Cade their general:
But stay, I'll read it over once again.",-0.8777,-0.17584
henry-vi-part-2,"Henry VI, Part 2",main,4,4,15,729,speech,QUEEN MARGARET,QUEEN MARGARET,"Ah, barbarous villains! Hath this lovely face
Ruled, like a wandering planet, over me,
And could it not enforce them to relent,
That were unworthy to behold the same?",0.088,-0.44388
henry-vi-part-2,"Henry VI, Part 2",main,4,4,15,730,speech,KING HENRY VI,KING HENRY VI,"Lord Say, Jack Cade hath sworn to have thy head.",0.0,0.64321
henry-vi-part-2,"Henry VI, Part 2",main,4,4,15,731,speech,SAY,SAY,"Ay, but I hope your highness shall have his.",0.6908,0.13426
henry-vi-part-2,"Henry VI, Part 2",main,4,4,15,732,speech,KING HENRY VI,KING HENRY VI,"How now, madam!
Still lamenting and mourning for Suffolk's death?
I fear me, love, if that I had been dead,
Thou wouldst not have mourn'd so much for me.",-0.8512,-0.77237
henry-vi-part-2,"Henry VI, Part 2",main,4,4,15,733,speech,QUEEN MARGARET,QUEEN MARGARET,"No, my love, I should not mourn, but die for thee.",-0.3736,-0.81369
henry-vi-part-2,"Henry VI, Part 2",main,4,4,15,734,stage_direction,,,Enter a Messenger,0.0,0.00373
henry-vi-part-2,"Henry VI, Part 2",main,4,4,15,735,speech,KING HENRY VI,KING HENRY VI,How now! What news? Why comest thou in such haste?,0.0,-0.12763
henry-vi-part-2,"Henry VI, Part 2",main,4,4,15,736,speech,MESSENGER,MESSENGER,"The rebels are in Southwark; fly, my lord!
Jack Cade proclaims himself Lord Mortimer,
Descended from the Duke of Clarence' house,
And calls your grace usurper openly
And vows to crown himself in Westminster.
His army is a ragged multitude
Of hinds and peasants, rude and merciless:
Sir Humphrey Stafford and his brother's death
Hath given them heart and courage to proceed:
All scholars, lawyers, courtiers, gentlemen,
They call false caterpillars, and intend their death.",-0.3164,0.33388
henry-vi-part-2,"Henry VI, Part 2",main,4,4,15,737,speech,KING HENRY VI,KING HENRY VI,O graceless men! They know not what they do.,-0.3382,-0.71944
henry-vi-part-2,"Henry VI, Part 2",main,4,4,15,738,speech,BUCKINGHAM,BUCKINGHAM,"My gracious lord, return to Killingworth,
Until a power be raised to put them down.",0.34,-0.7966
henry-vi-part-2,"Henry VI, Part 2",main,4,4,15,739,speech,QUEEN MARGARET,QUEEN MARGARET,"Ah, were the Duke of Suffolk now alive,
These Kentish rebels would be soon appeased!",-0.3802,-0.34259
henry-vi-part-2,"Henry VI, Part 2",main,4,4,15,740,speech,KING HENRY VI,KING HENRY VI,"Lord Say, the traitors hate thee;
Therefore away with us to Killingworth.",-0.5719,-0.47204
henry-vi-part-2,"Henry VI, Part 2",main,4,4,15,741,speech,SAY,SAY,"So might your grace's person be in danger.
The sight of me is odious in their eyes;
And therefore in this city will I stay
And live alone as secret as I may.",-0.7579,-0.61887
henry-vi-part-2,"Henry VI, Part 2",main,4,4,15,742,stage_direction,,,Enter another Messenger,0.0,-0.003
henry-vi-part-2,"Henry VI, Part 2",main,4,4,15,743,speech,MESSENGER,MESSENGER,"Jack Cade hath gotten London bridge:
The citizens fly and forsake their houses:
The rascal people, thirsting after prey,
Join with the traitor, and they jointly swear
To spoil the city and your royal court.",-0.4215,-0.61515
henry-vi-part-2,"Henry VI, Part 2",main,4,4,15,744,speech,BUCKINGHAM,BUCKINGHAM,"Then linger not, my lord, away, take horse.",0.0,-0.11303
henry-vi-part-2,"Henry VI, Part 2",main,4,4,15,745,speech,KING HENRY VI,KING HENRY VI,"Come, Margaret; God, our hope, will succor us.",0.7717,0.66125
henry-vi-part-2,"Henry VI, Part 2",main,4,4,15,746,speech,QUEEN MARGARET,QUEEN MARGARET,"My hope is gone, now Suffolk is deceased.",-0.34,-0.73496
henry-vi-part-2,"Henry VI, Part 2",main,4,4,15,747,speech,KING HENRY VI,KING HENRY VI,"Farewell, my lord: trust not the Kentish rebels.",-0.5426,-0.8485
henry-vi-part-2,"Henry VI, Part 2",main,4,4,15,748,speech,BUCKINGHAM,BUCKINGHAM,"Trust nobody, for fear you be betray'd.",-0.7719,-0.39677
henry-vi-part-2,"Henry VI, Part 2",main,4,4,15,749,speech,SAY,SAY,"The trust I have is in mine innocence,
And therefore am I bold and resolute.",0.8934,-0.32145
henry-vi-part-2,"Henry VI, Part 2",main,4,4,15,750,stage_direction,,,Exeunt,0.0,-0.09736
henry-vi-part-2,"Henry VI, Part 2",main,4,5,16,751,stage_direction,,,"Enter SCALES upon the Tower, walking. Then enter two or three Citizens below",0.0,0.01297
henry-vi-part-2,"Henry VI, Part 2",main,4,5,16,752,speech,SCALES,SCALES,How now! Is Jack Cade slain?,-0.6868,-0.26684
henry-vi-part-2,"Henry VI, Part 2",main,4,5,16,753,speech,FIRST CITIZEN,FIRST CITIZEN,"No, my lord, nor likely to be slain; for they have
won the bridge, killing all those that withstand
them: the lord mayor craves aid of your honour from
the Tower, to defend the city from the rebels.",-0.8402,-0.65456
henry-vi-part-2,"Henry VI, Part 2",main,4,5,16,754,speech,SCALES,SCALES,"Such aid as I can spare you shall command;
But I am troubled here with them myself;
The rebels have assay'd to win the Tower.
But get you to Smithfield, and gather head,
And thither I will send you Matthew Goffe;
Fight for your king, your country and your lives;
And so, farewell, for I must hence again.",-0.829,0.32395
henry-vi-part-2,"Henry VI, Part 2",main,4,5,16,755,stage_direction,,,Exeunt,0.0,-0.09736
henry-vi-part-2,"Henry VI, Part 2",main,4,6,17,756,stage_direction,,,"Enter CADE and the rest, and strikes his staff on London-stone",0.0,-0.0116
henry-vi-part-2,"Henry VI, Part 2",main,4,6,17,757,speech,CADE,CADE,"Now is Mortimer lord of this city. And here, sitting
upon London-stone, I charge and command that, of the
city's cost, the pissing-conduit run nothing but
claret wine this first year of our reign . And now
henceforward it shall be treason for any that calls
me other than Lord Mortimer.",-0.5927,0.44987
henry-vi-part-2,"Henry VI, Part 2",main,4,6,17,758,stage_direction,,,"Enter a Soldier, running",0.0,0.00105
henry-vi-part-2,"Henry VI, Part 2",main,4,6,17,759,speech,SOLDIER,SOLDIER,Jack Cade! Jack Cade!,0.0,0.78807
henry-vi-part-2,"Henry VI, Part 2",main,4,6,17,760,speech,CADE,CADE,Knock him down there.,-0.8932,-0.68884
henry-vi-part-2,"Henry VI, Part 2",main,4,6,17,761,speech,SMITH,SMITH,"If this fellow be wise, he'll never call ye Jack
Cade more: I think he hath a very fair warning.",0.4588,-0.6226
henry-vi-part-2,"Henry VI, Part 2",main,4,6,17,762,speech,DICK,DICK,"My lord, there's an army gathered together in
Smithfield.",0.0,0.09795
henry-vi-part-2,"Henry VI, Part 2",main,4,6,17,763,speech,CADE,CADE,"Come, then, let's go fight with them; but first, go
and set London bridge on fire; and, if you can, burn
down the Tower too. Come, let's away.",-0.5994,0.02955
henry-vi-part-2,"Henry VI, Part 2",main,4,6,17,764,stage_direction,,,Exeunt,0.0,-0.09735
henry-vi-part-2,"Henry VI, Part 2",main,4,7,18,765,stage_direction,,,"Alarums. MATTHEW GOFFE is slain, and all the rest. Then enter CADE, with his company.",-0.6705,-0.36096
henry-vi-part-2,"Henry VI, Part 2",main,4,7,18,766,speech,CADE,CADE,"So, sirs: now go some and pull down the Savoy;
others to the Inns of Court; down with them all.",0.0,-0.2149
henry-vi-part-2,"Henry VI, Part 2",main,4,7,18,767,speech,DICK,DICK,I have a suit unto your lordship.,0.0,0.00351
henry-vi-part-2,"Henry VI, Part 2",main,4,7,18,768,speech,CADE,CADE,"Be it a lordship, thou shalt have it for that word.",0.25,-0.01491
henry-vi-part-2,"Henry VI, Part 2",main,4,7,18,769,speech,DICK,DICK,"Only that the laws of England may come out of your
mouth.",0.0,0.01607
henry-vi-part-2,"Henry VI, Part 2",main,4,7,18,770,speech,HOLLAND,HOLLAND,"[Aside] Mass, 'twill be sore law, then; for he was
thrust in the mouth with a spear, and 'tis not whole
yet.",-0.7003,-0.81994
henry-vi-part-2,"Henry VI, Part 2",main,4,7,18,771,speech,SMITH,SMITH,"[Aside] Nay, John, it will be stinking law for his
breath stinks with eating toasted cheese.",-0.6597,-0.58511
henry-vi-part-2,"Henry VI, Part 2",main,4,7,18,772,speech,CADE,CADE,"I have thought upon it, it shall be so. Away, burn
all the records of the realm: my mouth shall be
the parliament of England.",0.0,0.10961
henry-vi-part-2,"Henry VI, Part 2",main,4,7,18,773,speech,HOLLAND,HOLLAND,"[Aside] Then we are like to have biting statutes,
unless his teeth be pulled out.",-0.3818,-0.48413
henry-vi-part-2,"Henry VI, Part 2",main,4,7,18,774,speech,CADE,CADE,And henceforward all things shall be in common.,0.34,0.26055
