play_id,play_title,section,act,scene,scene_index_in_play,unit_index_in_play,type,speaker_original,speaker_normalized,original_text,vader_score,dl_score
henry-vi-part-2,"Henry VI, Part 2",main,3,1,9,432,speech,SUFFOLK,SUFFOLK,"But, in my mind, that were no policy:
The king will labour still to save his life,
The commons haply rise, to save his life;
And yet we have but trivial argument,
More than mistrust, that shows him worthy death.",0.4568,-0.24922
henry-vi-part-2,"Henry VI, Part 2",main,3,1,9,433,speech,YORK,YORK,"So that, by this, you would not have him die.",0.4847,-0.44459
henry-vi-part-2,"Henry VI, Part 2",main,3,1,9,434,speech,SUFFOLK,SUFFOLK,"Ah, York, no man alive so fain as I!",-0.6941,-0.02207
henry-vi-part-2,"Henry VI, Part 2",main,3,1,9,435,speech,YORK,YORK,"'Tis York that hath more reason for his death.
But, my lord cardinal, and you, my Lord of Suffolk,
Say as you think, and speak it from your souls,
Were't not all one, an empty eagle were set
To guard the chicken from a hungry kite,
As place Duke Humphrey for the king's protector?",-0.7974,-0.57308
henry-vi-part-2,"Henry VI, Part 2",main,3,1,9,436,speech,QUEEN MARGARET,QUEEN MARGARET,So the poor chicken should be sure of death.,-0.6908,-0.56522
henry-vi-part-2,"Henry VI, Part 2",main,3,1,9,437,speech,SUFFOLK,SUFFOLK,"Madam, 'tis true; and were't not madness, then,
To make the fox surveyor of the fold?
Who being accused a crafty murderer,
His guilt should be but idly posted over,
Because his purpose is not executed.
No; let him die, in that he is a fox,
By nature proved an enemy to the flock,
Before his chaps be stain'd with crimson blood,
As Humphrey, proved by reasons, to my liege.
And do not stand on quillets how to slay him:
Be it by gins, by snares, by subtlety,
Sleeping or waking, 'tis no matter how,
So he be dead; for that is good deceit
Which mates him first that first intends deceit.",-0.9815,-0.1072
henry-vi-part-2,"Henry VI, Part 2",main,3,1,9,438,speech,QUEEN MARGARET,QUEEN MARGARET,"Thrice-noble Suffolk, 'tis resolutely spoke.",0.4588,0.38873
henry-vi-part-2,"Henry VI, Part 2",main,3,1,9,439,speech,SUFFOLK,SUFFOLK,"Not resolute, except so much were done;
For things are often spoke and seldom meant:
But that my heart accordeth with my tongue,
Seeing the deed is meritorious,
And to preserve my sovereign from his foe,
Say but the word, and I will be his priest.",0.8126,-0.31565
henry-vi-part-2,"Henry VI, Part 2",main,3,1,9,440,speech,CARDINAL,CARDINAL,"But I would have him dead, my Lord of Suffolk,
Ere you can take due orders for a priest:
Say you consent and censure well the deed,
And I'll provide his executioner,
I tender so the safety of my liege.",0.7184,0.1957
henry-vi-part-2,"Henry VI, Part 2",main,3,1,9,441,speech,SUFFOLK,SUFFOLK,"Here is my hand, the deed is worthy doing.",0.7269,0.48847
henry-vi-part-2,"Henry VI, Part 2",main,3,1,9,442,speech,QUEEN MARGARET,QUEEN MARGARET,And so say I.,0.3612,0.14459
henry-vi-part-2,"Henry VI, Part 2",main,3,1,9,443,speech,YORK,YORK,"And I and now we three have spoke it,
It skills not greatly who impugns our doom.",0.3455,0.02317
henry-vi-part-2,"Henry VI, Part 2",main,3,1,9,444,stage_direction,,,Enter a Post,0.0,0.00267
henry-vi-part-2,"Henry VI, Part 2",main,3,1,9,445,speech,POST,POST,"Great lords, from Ireland am I come amain,
To signify that rebels there are up
And put the Englishmen unto the sword:
Send succors, lords, and stop the rage betime,
Before the wound do grow uncurable;
For, being green, there is great hope of help.",0.2263,0.42585
henry-vi-part-2,"Henry VI, Part 2",main,3,1,9,446,speech,CARDINAL,CARDINAL,"A breach that craves a quick expedient stop!
What counsel give you in this weighty cause?",-0.3802,-0.06895
henry-vi-part-2,"Henry VI, Part 2",main,3,1,9,447,speech,YORK,YORK,"That Somerset be sent as regent thither:
'Tis meet that lucky ruler be employ'd;
Witness the fortune he hath had in France.",0.8497,-0.01961
henry-vi-part-2,"Henry VI, Part 2",main,3,1,9,448,speech,SOMERSET,SOMERSET,"If York, with all his far-fet policy,
Had been the regent there instead of me,
He never would have stay'd in France so long.",-0.4767,-0.61209
henry-vi-part-2,"Henry VI, Part 2",main,3,1,9,449,speech,YORK,YORK,"No, not to lose it all, as thou hast done:
I rather would have lost my life betimes
Than bring a burthen of dishonour home
By staying there so long till all were lost.
Show me one scar character'd on thy skin:
Men's flesh preserved so whole do seldom win.",-0.7729,-0.58962
henry-vi-part-2,"Henry VI, Part 2",main,3,1,9,450,speech,QUEEN MARGARET,QUEEN MARGARET,"Nay, then, this spark will prove a raging fire,
If wind and fuel be brought to feed it with:
No more, good York; sweet Somerset, be still:
Thy fortune, York, hadst thou been regent there,
Might happily have proved far worse than his.",-0.5164,-0.3643
henry-vi-part-2,"Henry VI, Part 2",main,3,1,9,451,speech,YORK,YORK,"What, worse than nought? Nay, then, a shame take all!",-0.8873,-0.74883
henry-vi-part-2,"Henry VI, Part 2",main,3,1,9,452,speech,SOMERSET,SOMERSET,"And, in the number, thee that wishest shame!",-0.5255,0.65672
henry-vi-part-2,"Henry VI, Part 2",main,3,1,9,453,speech,CARDINAL,CARDINAL,"My Lord of York, try what your fortune is.
The uncivil kerns of Ireland are in arms
And temper clay with blood of Englishmen:
To Ireland will you lead a band of men,
Collected choicely, from each county some,
And try your hap against the Irishmen?",-0.0516,-0.00955
henry-vi-part-2,"Henry VI, Part 2",main,3,1,9,454,speech,YORK,YORK,"I will, my lord, so please his majesty.",0.0,-0.14894
henry-vi-part-2,"Henry VI, Part 2",main,3,1,9,455,speech,SUFFOLK,SUFFOLK,"Why, our authority is his consent,
And what we do establish he confirms:
Then, noble York, take thou this task in hand.",0.6249,-0.04773
henry-vi-part-2,"Henry VI, Part 2",main,3,1,9,456,speech,YORK,YORK,"I am content: provide me soldiers, lords,
Whiles I take order for mine own affairs.",0.5719,0.47022
henry-vi-part-2,"Henry VI, Part 2",main,3,1,9,457,speech,SUFFOLK,SUFFOLK,"A charge, Lord York, that I will see perform'd.
But now return we to the false Duke Humphrey.",0.2732,-0.36943
henry-vi-part-2,"Henry VI, Part 2",main,3,1,9,458,speech,CARDINAL,CARDINAL,"No more of him; for I will deal with him
That henceforth he shall trouble us no more.
And so break off; the day is almost spent:
Lord Suffolk, you and I must talk of that event.",0.015,-0.24616
henry-vi-part-2,"Henry VI, Part 2",main,3,1,9,459,speech,YORK,YORK,"My Lord of Suffolk, within fourteen days
At Bristol I expect my soldiers;
For there I'll ship them all for Ireland.",0.0,0.16559
henry-vi-part-2,"Henry VI, Part 2",main,3,1,9,460,speech,SUFFOLK,SUFFOLK,"I'll see it truly done, my Lord of York.",0.0,0.54672
henry-vi-part-2,"Henry VI, Part 2",main,3,1,9,461,stage_direction,,,Exeunt all but YORK,0.0,-0.21918
henry-vi-part-2,"Henry VI, Part 2",main,3,1,9,462,speech,YORK,YORK,"Now, York, or never, steel thy fearful thoughts,
And change misdoubt to resolution:
Be that thou hopest to be, or what thou art
Resign to death; it is not worth the enjoying:
Let pale-faced fear keep with the mean-born man,
And find no harbour in a royal heart.
Faster than spring-time showers comes thought
on thought,
And not a thought but thinks on dignity.
My brain more busy than the labouring spider
Weaves tedious snares to trap mine enemies.
Well, nobles, well, 'tis politicly done,
To send me packing with an host of men:
I fear me you but warm the starved snake,
Who, cherish'd in your breasts, will sting
your hearts.
'Twas men I lack'd and you will give them me:
I take it kindly; and yet be well assured
You put sharp weapons in a madman's hands.
Whiles I in Ireland nourish a mighty band,
I will stir up in England some black storm
Shall blow ten thousand souls to heaven or hell;
And this fell tempest shall not cease to rage
Until the golden circuit on my head,
Like to the glorious sun's transparent beams,
Do calm the fury of this mad-bred flaw.
And, for a minister of my intent,
I have seduced a headstrong Kentishman,
John Cade of Ashford,
To make commotion, as full well he can,
Under the title of John Mortimer.
In Ireland have I seen this stubborn Cade
Oppose himself against a troop of kerns,
And fought so long, till that his thighs with darts
Were almost like a sharp-quill'd porpentine;
And, in the end being rescued, I have seen
Him caper upright like a wild Morisco,
Shaking the bloody darts as he his bells.
Full often, like a shag-hair'd crafty kern,
Hath he conversed with the enemy,
And undiscover'd come to me again
And given me notice of their villanies.
This devil here shall be my substitute;
For that John Mortimer, which now is dead,
In face, in gait, in speech, he doth resemble:
By this I shall perceive the commons' mind,
How they affect the house and claim of York.
Say he be taken, rack'd and tortured,
I know no pain they can inflict upon him
Will make him say I moved him to those arms.
Say that he thrive, as 'tis great like he will,
Why, then from Ireland come I with my strength
And reap the harvest which that rascal sow'd;
For Humphrey being dead, as he shall be,
And Henry put apart, the next for me.",-0.9685,0.52668
henry-vi-part-2,"Henry VI, Part 2",main,3,1,9,463,stage_direction,,,Exit,0.0,0.01379
henry-vi-part-2,"Henry VI, Part 2",main,3,2,10,464,stage_direction,,,"Enter certain Murderers, hastily",-0.6486,-0.41012
henry-vi-part-2,"Henry VI, Part 2",main,3,2,10,465,speech,FIRST MURDERER,FIRST MURDERER,"Run to my Lord of Suffolk; let him know
We have dispatch'd the duke, as he commanded.",-0.4588,-0.23474
henry-vi-part-2,"Henry VI, Part 2",main,3,2,10,466,speech,SECOND MURDERER,SECOND MURDERER,"O that it were to do! What have we done?
Didst ever hear a man so penitent?",0.0,0.35186
henry-vi-part-2,"Henry VI, Part 2",main,3,2,10,467,stage_direction,,,Enter SUFFOLK,0.0,0.01951
henry-vi-part-2,"Henry VI, Part 2",main,3,2,10,468,speech,FIRST MURDER,FIRST MURDER,Here comes my lord.,0.0,0.68754
henry-vi-part-2,"Henry VI, Part 2",main,3,2,10,469,speech,SUFFOLK,SUFFOLK,"Now, sirs, have you dispatch'd this thing?",0.0,0.0038
henry-vi-part-2,"Henry VI, Part 2",main,3,2,10,470,speech,FIRST MURDERER,FIRST MURDERER,"Ay, my good lord, he's dead.",0.0772,-0.68594
henry-vi-part-2,"Henry VI, Part 2",main,3,2,10,471,speech,SUFFOLK,SUFFOLK,"Why, that's well said. Go, get you to my house;
I will reward you for this venturous deed.
The king and all the peers are here at hand.
Have you laid fair the bed? Is all things well,
According as I gave directions?",0.7149,0.50322
henry-vi-part-2,"Henry VI, Part 2",main,3,2,10,472,speech,FIRST MURDERER,FIRST MURDERER,"'Tis, my good lord.",0.4404,0.71279
henry-vi-part-2,"Henry VI, Part 2",main,3,2,10,473,speech,SUFFOLK,SUFFOLK,Away! Be gone.,0.0,0.29308
henry-vi-part-2,"Henry VI, Part 2",main,3,2,10,474,stage_direction,,,Exeunt Murderers,-0.6486,-0.14504
henry-vi-part-2,"Henry VI, Part 2",main,3,2,10,475,stage_direction,,,"Sound trumpets. Enter KING HENRY VI, QUEEN MARGARET, CARDINAL, SOMERSET, with Attendants",0.0,0.06832
henry-vi-part-2,"Henry VI, Part 2",main,3,2,10,476,speech,KING HENRY VI,KING HENRY VI,"Go, call our uncle to our presence straight;
Say we intend to try his grace to-day.
If he be guilty, as 'tis published.",-0.4767,-0.12166
henry-vi-part-2,"Henry VI, Part 2",main,3,2,10,477,speech,SUFFOLK,SUFFOLK,"I'll call him presently, my noble lord.",0.4588,0.54568
henry-vi-part-2,"Henry VI, Part 2",main,3,2,10,478,stage_direction,,,Exit,0.0,0.03636
henry-vi-part-2,"Henry VI, Part 2",main,3,2,10,479,speech,KING HENRY VI,KING HENRY VI,"Lords, take your places; and, I pray you all,
Proceed no straiter 'gainst our uncle Gloucester
Than from true evidence of good esteem
He be approved in practise culpable.",0.1779,0.28631
henry-vi-part-2,"Henry VI, Part 2",main,3,2,10,480,speech,QUEEN MARGARET,QUEEN MARGARET,"God forbid any malice should prevail,
That faultless may condemn a nobleman!
Pray God he may acquit him of suspicion!",-0.166,-0.79948
henry-vi-part-2,"Henry VI, Part 2",main,3,2,10,481,speech,KING HENRY VI,KING HENRY VI,"I thank thee, Meg; these words content me much.",0.7574,0.53414
henry-vi-part-2,"Henry VI, Part 2",main,3,2,10,482,stage_direction,,,Re-enter SUFFOLK,0.0,0.01416
henry-vi-part-2,"Henry VI, Part 2",main,3,2,10,483,speech,KING HENRY VI,KING HENRY VI,"How now! Why look'st thou pale? Why tremblest thou?
Where is our uncle? What's the matter, Suffolk?",-0.3736,-0.12974
henry-vi-part-2,"Henry VI, Part 2",main,3,2,10,484,speech,SUFFOLK,SUFFOLK,"Dead in his bed, my lord; Gloucester is dead.",-0.8625,-0.83682
henry-vi-part-2,"Henry VI, Part 2",main,3,2,10,485,speech,QUEEN MARGARET,QUEEN MARGARET,"Marry, God forfend!",-0.126,-0.32512
henry-vi-part-2,"Henry VI, Part 2",main,3,2,10,486,speech,CARDINAL,CARDINAL,"God's secret judgment: I did dream to-night
The duke was dumb and could not speak a word.",-0.34,-0.24168
henry-vi-part-2,"Henry VI, Part 2",main,3,2,10,487,speech,QUEEN MARGARET,QUEEN MARGARET,"How fares my lord? Help, lords! The king is dead.",-0.4389,-0.82386
henry-vi-part-2,"Henry VI, Part 2",main,3,2,10,488,speech,SOMERSET,SOMERSET,Rear up his body; wring him by the nose.,0.4019,0.12385
henry-vi-part-2,"Henry VI, Part 2",main,3,2,10,489,speech,QUEEN MARGARET,QUEEN MARGARET,"Run, go, help, help! O Henry, ope thine eyes!",0.508,0.63909
henry-vi-part-2,"Henry VI, Part 2",main,3,2,10,490,speech,SUFFOLK,SUFFOLK,"He doth revive again: madam, be patient.",0.0,-0.60391
henry-vi-part-2,"Henry VI, Part 2",main,3,2,10,491,speech,KING HENRY VI,KING HENRY VI,O heavenly God!,0.75,0.82477
henry-vi-part-2,"Henry VI, Part 2",main,3,2,10,492,speech,QUEEN MARGARET,QUEEN MARGARET,How fares my gracious lord?,0.5574,-0.51216
henry-vi-part-2,"Henry VI, Part 2",main,3,2,10,493,speech,SUFFOLK,SUFFOLK,"Comfort, my sovereign! Gracious Henry, comfort!",0.8309,0.77044
henry-vi-part-2,"Henry VI, Part 2",main,3,2,10,494,speech,KING HENRY VI,KING HENRY VI,"What, doth my Lord of Suffolk comfort me?
Came he right now to sing a raven's note,
Whose dismal tune bereft my vital powers;
And thinks he that the chirping of a wren,
By crying comfort from a hollow breast,
Can chase away the first-conceived sound?
Hide not thy poison with such sugar'd words;
Lay not thy hands on me; forbear, I say;
Their touch affrights me as a serpent's sting.
Thou baleful messenger, out of my sight!
Upon thy eye-balls murderous tyranny
Sits in grim majesty, to fright the world.
Look not upon me, for thine eyes are wounding:
Yet do not go away: come, basilisk,
And kill the innocent gazer with thy sight;
For in the shade of death I shall find joy;
In life but double death, now Gloucester's dead.",-0.9817,-0.90818
henry-vi-part-2,"Henry VI, Part 2",main,3,2,10,495,speech,QUEEN MARGARET,QUEEN MARGARET,"Why do you rate my Lord of Suffolk thus?
Although the duke was enemy to him,
Yet he most Christian-like laments his death:
And for myself, foe as he was to me,
Might liquid tears or heart-offending groans
Or blood-consuming sighs recall his life,
I would be blind with weeping, sick with groans,
Look pale as primrose with blood-drinking sighs,
And all to have the noble duke alive.
What know I how the world may deem of me?
For it is known we were but hollow friends:
It may be judged I made the duke away;
So shall my name with slander's tongue be wounded,
And princes' courts be fill'd with my reproach.
This get I by his death: ay me, unhappy!
To be a queen, and crown'd with infamy!",-0.9938,-0.85015
henry-vi-part-2,"Henry VI, Part 2",main,3,2,10,496,speech,KING HENRY VI,KING HENRY VI,"Ah, woe is me for Gloucester, wretched man!",-0.2578,0.70037
henry-vi-part-2,"Henry VI, Part 2",main,3,2,10,497,speech,QUEEN MARGARET,QUEEN MARGARET,"Be woe for me, more wretched than he is.
What, dost thou turn away and hide thy face?
I am no loathsome leper; look on me.
What! Art thou, like the adder, waxen deaf?
Be poisonous too and kill thy forlorn queen.
Is all thy comfort shut in Gloucester's tomb?
Why, then, dame Margaret was ne'er thy joy.
Erect his statue and worship it,
And make my image but an alehouse sign.
Was I for this nigh wreck'd upon the sea
And twice by awkward wind from England's bank
Drove back again unto my native clime?
What boded this, but well forewarning wind
Did seem to say 'Seek not a scorpion's nest,
Nor set no footing on this unkind shore'?
What did I then, but cursed the gentle gusts
And he that loosed them forth their brazen caves:
And bid them blow towards England's blessed shore,
Or turn our stern upon a dreadful rock
Yet AEolus would not be a murderer,
But left that hateful office unto thee:
The pretty-vaulting sea refused to drown me,
Knowing that thou wouldst have me drown'd on shore,
With tears as salt as sea, through thy unkindness:
The splitting rocks cower'd in the sinking sands
And would not dash me with their ragged sides,
Because thy flinty heart, more hard than they,
Might in thy palace perish Margaret.
As far as I could ken thy chalky cliffs,
When from thy shore the tempest beat us back,
I stood upon the hatches in the storm,
And when the dusky sky began to rob
My earnest-gaping sight of thy land's view,
I took a costly jewel from my neck,
A heart it was, bound in with diamonds,
And threw it towards thy land: the sea received it,
And so I wish'd thy body might my heart:
And even with this I lost fair England's view
And bid mine eyes be packing with my heart
And call'd them blind and dusky spectacles,
For losing ken of Albion's wished coast.
How often have I tempted Suffolk's tongue,
The agent of thy foul inconstancy,
To sit and witch me, as Ascanius did
When he to madding Dido would unfold
His father's acts commenced in burning Troy!
Am I not witch'd like her? Or thou not false like him?
Ay me, I can no more! Die, Margaret!
For Henry weeps that thou dost live so long.",-0.8934,-0.81006
henry-vi-part-2,"Henry VI, Part 2",main,3,2,10,498,stage_direction,,,"Noise within. Enter WARWICK, SALISBURY, and many Commons",0.0,0.14793
henry-vi-part-2,"Henry VI, Part 2",main,3,2,10,499,speech,WARWICK,WARWICK,"It is reported, mighty sovereign,
That good Duke Humphrey traitorously is murder'd
By Suffolk and the Cardinal Beaufort's means.
The commons, like an angry hive of bees
That want their leader, scatter up and down
And care not who they sting in his revenge.
Myself have calm'd their spleenful mutiny,
Until they hear the order of his death.",-0.9519,-0.73574
henry-vi-part-2,"Henry VI, Part 2",main,3,2,10,500,speech,KING HENRY VI,KING HENRY VI,"That he is dead, good Warwick, 'tis too true;
But how he died God knows, not Henry:
Enter his chamber, view his breathless corpse,
And comment then upon his sudden death.",-0.9325,-0.49203
henry-vi-part-2,"Henry VI, Part 2",main,3,2,10,501,speech,WARWICK,WARWICK,"That shall I do, my liege. Stay, Salisbury,
With the rude multitude till I return.",-0.2732,-0.06783
henry-vi-part-2,"Henry VI, Part 2",main,3,2,10,502,stage_direction,,,Exit,0.0,0.01159
henry-vi-part-2,"Henry VI, Part 2",main,3,2,10,503,speech,KING HENRY VI,KING HENRY VI,"O Thou that judgest all things, stay my thoughts,
My thoughts, that labour to persuade my soul
Some violent hands were laid on Humphrey's life!
If my suspect be false, forgive me, God,
For judgment only doth belong to thee.
Fain would I go to chafe his paly lips
With twenty thousand kisses, and to drain
Upon his face an ocean of salt tears,
To tell my love unto his dumb deaf trunk,
And with my fingers feel his hand unfeeling:
But all in vain are these mean obsequies;
And to survey his dead and earthly image,
What were it but to make my sorrow greater?",-0.9625,-0.31385
henry-vi-part-2,"Henry VI, Part 2",main,3,2,10,504,stage_direction,,,"Re-enter WARWICK and others, bearing GLOUCESTER'S body on a bed",0.0,0.01014
henry-vi-part-2,"Henry VI, Part 2",main,3,2,10,505,speech,WARWICK,WARWICK,"Come hither, gracious sovereign, view this body.",0.5574,0.22719
henry-vi-part-2,"Henry VI, Part 2",main,3,2,10,506,speech,KING HENRY VI,KING HENRY VI,"That is to see how deep my grave is made;
For with his soul fled all my worldly solace,
For seeing him I see my life in death.",-0.4404,0.5473
henry-vi-part-2,"Henry VI, Part 2",main,3,2,10,507,speech,WARWICK,WARWICK,"As surely as my soul intends to live
With that dread King that took our state upon him
To free us from his father's wrathful curse,
I do believe that violent hands were laid
Upon the life of this thrice-famed duke.",-0.9246,-0.7985
henry-vi-part-2,"Henry VI, Part 2",main,3,2,10,508,speech,SUFFOLK,SUFFOLK,"A dreadful oath, sworn with a solemn tongue!
What instance gives Lord Warwick for his vow?",-0.4939,-0.66653
henry-vi-part-2,"Henry VI, Part 2",main,3,2,10,509,speech,WARWICK,WARWICK,"See how the blood is settled in his face.
Oft have I seen a timely-parted ghost,
Of ashy semblance, meagre, pale and bloodless,
Being all descended to the labouring heart;
Who, in the conflict that it holds with death,
Attracts the same for aidance 'gainst the enemy;
Which with the heart there cools and ne'er returneth
To blush and beautify the cheek again.
But see, his face is black and full of blood,
His eye-balls further out than when he lived,
Staring full ghastly like a strangled man;
His hair uprear'd, his nostrils stretched with
struggling;
His hands abroad display'd, as one that grasp'd
And tugg'd for life and was by strength subdued:
Look, on the sheets his hair you see, is sticking;
His well-proportion'd beard made rough and rugged,
Like to the summer's corn by tempest lodged.
It cannot be but he was murder'd here;
The least of all these signs were probable.",-0.9743,-0.39084
henry-vi-part-2,"Henry VI, Part 2",main,3,2,10,510,speech,SUFFOLK,SUFFOLK,"Why, Warwick, who should do the duke to death?
Myself and Beaufort had him in protection;
And we, I hope, sir, are no murderers.",0.484,0.02456
henry-vi-part-2,"Henry VI, Part 2",main,3,2,10,511,speech,WARWICK,WARWICK,"But both of you were vow'd Duke Humphrey's foes,
And you, forsooth, had the good duke to keep:
'Tis like you would not feast him like a friend;
And 'tis well seen he found an enemy.",0.2263,-0.32131
henry-vi-part-2,"Henry VI, Part 2",main,3,2,10,512,speech,QUEEN MARGARET,QUEEN MARGARET,"Then you, belike, suspect these noblemen
As guilty of Duke Humphrey's timeless death.",-0.836,-0.52143
henry-vi-part-2,"Henry VI, Part 2",main,3,2,10,513,speech,WARWICK,WARWICK,"Who finds the heifer dead and bleeding fresh
And sees fast by a butcher with an axe,
But will suspect 'twas he that made the slaughter?
Who finds the partridge in the puttock's nest,
But may imagine how the bird was dead,
Although the kite soar with unbloodied beak?
Even so suspicious is this tragedy.",-0.9522,-0.8073
henry-vi-part-2,"Henry VI, Part 2",main,3,2,10,514,speech,QUEEN MARGARET,QUEEN MARGARET,"Are you the butcher, Suffolk? Where's your knife?
Is Beaufort term'd a kite? Where are his talons?",-0.7399,-0.04985
henry-vi-part-2,"Henry VI, Part 2",main,3,2,10,515,speech,SUFFOLK,SUFFOLK,"I wear no knife to slaughter sleeping men;
But here's a vengeful sword, rusted with ease,
That shall be scoured in his rancorous heart
That slanders me with murder's crimson badge.
Say, if thou darest, proud Lord of Warwickshire,
That I am faulty in Duke Humphrey's death.",-0.9032,-0.7269
henry-vi-part-2,"Henry VI, Part 2",main,3,2,10,516,stage_direction,,,"Exeunt CARDINAL, SOMERSET, and others",0.0,0.04494
henry-vi-part-2,"Henry VI, Part 2",main,3,2,10,517,speech,WARWICK,WARWICK,"What dares not Warwick, if false Suffolk dare him?",0.0,-0.0829
henry-vi-part-2,"Henry VI, Part 2",main,3,2,10,518,speech,QUEEN MARGARET,QUEEN MARGARET,"He dares not calm his contumelious spirit
Nor cease to be an arrogant controller,
Though Suffolk dare him twenty thousand times.",-0.789,-0.40369
henry-vi-part-2,"Henry VI, Part 2",main,3,2,10,519,speech,WARWICK,WARWICK,"Madam, be still; with reverence may I say;
For every word you speak in his behalf
Is slander to your royal dignity.",0.5267,0.2203
henry-vi-part-2,"Henry VI, Part 2",main,3,2,10,520,speech,SUFFOLK,SUFFOLK,"Blunt-witted lord, ignoble in demeanor!
If ever lady wrong'd her lord so much,
Thy mother took into her blameful bed
Some stern untutor'd churl, and noble stock
Was graft with crab-tree slip; whose fruit thou art,
And never of the Nevils' noble race.",-0.4374,0.02169
henry-vi-part-2,"Henry VI, Part 2",main,3,2,10,521,speech,WARWICK,WARWICK,"But that the guilt of murder bucklers thee
And I should rob the deathsman of his fee,
Quitting thee thereby of ten thousand shames,
And that my sovereign's presence makes me mild,
I would, false murderous coward, on thy knee
Make thee beg pardon for thy passed speech,
And say it was thy mother that thou meant'st
That thou thyself was born in bastardy;
And after all this fearful homage done,
Give thee thy hire and send thy soul to hell,
Pernicious blood-sucker of sleeping men!",-0.9915,-0.18178
henry-vi-part-2,"Henry VI, Part 2",main,3,2,10,522,speech,SUFFOLK,SUFFOLK,"Thou shall be waking well I shed thy blood,
If from this presence thou darest go with me.",0.0,-0.30084
henry-vi-part-2,"Henry VI, Part 2",main,3,2,10,523,speech,WARWICK,WARWICK,"Away even now, or I will drag thee hence:
Unworthy though thou art, I'll cope with thee
And do some service to Duke Humphrey's ghost.",-0.6711,0.13063
henry-vi-part-2,"Henry VI, Part 2",main,3,2,10,524,stage_direction,,,Exeunt SUFFOLK and WARWICK,0.0,0.03418
henry-vi-part-2,"Henry VI, Part 2",main,3,2,10,525,speech,KING HENRY VI,KING HENRY VI,"What stronger breastplate than a heart untainted!
Thrice is he armed that hath his quarrel just,
And he but naked, though lock'd up in steel
Whose conscience with injustice is corrupted.",0.7345,-0.61889
henry-vi-part-2,"Henry VI, Part 2",main,3,2,10,526,stage_direction,,,A noise within,0.0,-0.02277
henry-vi-part-2,"Henry VI, Part 2",main,3,2,10,527,speech,QUEEN MARGARET,QUEEN MARGARET,What noise is this?,0.0,-0.06067
