play_id,play_title,section,act,scene,scene_index_in_play,unit_index_in_play,type,speaker_original,speaker_normalized,original_text,vader_score,dl_score,dl2_score
king-lear,King Lear,main,2,4,9,525,speech,LEAR,LEAR,"[rising] Never, Regan.
She hath abated me of half my train,
Looked black upon me, struck me with her tongue,
Most serpentlike, upon the very heart.
All the stored vengeances of heaven fall
On her ingrateful top! Strike her young bones,
You taking airs, with lameness!",-0.9391,-0.99633,0.58428
king-lear,King Lear,main,2,4,9,526,speech,CORNWALL,CORNWALL,"Fie, sir, fie!",-0.7081,-0.99867,0.75954
king-lear,King Lear,main,2,4,9,527,speech,LEAR,LEAR,"You nimble lightnings, dart your blinding flames
Into her scornful eyes! Infect her beauty,
You fen-sucked fogs drawn by the powerful sun,
To fall and blister!",-0.8217,-0.9965,0.35769
king-lear,King Lear,main,2,4,9,528,speech,REGAN,REGAN,"O the blessed gods!
So will you wish on me when the rash mood is on.",0.4003,-0.99678,0.07324
king-lear,King Lear,main,2,4,9,529,speech,LEAR,LEAR,"No, Regan, thou shalt never have my curse.
Thy tender-hafted nature shall not give
Thee o'er to harshness. Her eyes are fierce, but thine
Do comfort and not burn. 'Tis not in thee
To grudge my pleasures, to cut off my train,
To bandy hasty words, to scant my sizes,
And in conclusion to oppose the bolt
Against my coming in. Thou better know’st
The offices of nature, bond of childhood,
Effects of courtesy, dues of gratitude.
Thy half o' th' kingdom hast thou not forgot,
Wherein I thee endowed.",0.9813,0.99738,-0.11198
king-lear,King Lear,main,2,4,9,530,speech,REGAN,REGAN,"Good sir, to the purpose.",0.4404,0.99678,0.46788
king-lear,King Lear,main,2,4,9,531,speech,LEAR,LEAR,Who put my man i' th' stocks?,0.0,-0.99761,-0.00714
king-lear,King Lear,main,2,4,9,532,stage_direction,,,Tucket within,0.25,0.98629,-0.01577
king-lear,King Lear,main,2,4,9,533,speech,CORNWALL,CORNWALL,What trumpet’s that?,0.0,-0.97122,-0.0096
king-lear,King Lear,main,2,4,9,534,stage_direction,,,Enter OSWALD the steward,0.0,0.97039,0.00976
king-lear,King Lear,main,2,4,9,535,speech,REGAN,REGAN,"I know ’t—my sister’s. This approves her letter
That she would soon be here. [to OSWALD]
Is your lady come?",0.0,-0.97581,-0.01226
king-lear,King Lear,main,2,4,9,536,speech,LEAR,LEAR,"This is a slave whose easy borrowed pride
Dwells in the fickle grace of her he follows.—
Out, varlet, from my sight!",-0.807,-0.99758,-0.49785
king-lear,King Lear,main,2,4,9,537,speech,CORNWALL,CORNWALL,What means your grace?,0.4215,-0.99185,-0.0104
king-lear,King Lear,main,2,4,9,538,stage_direction,,,Enter GONERIL,0.0,0.97529,0.0365
king-lear,King Lear,main,2,4,9,539,speech,LEAR,LEAR,"Who stocked my servant? Regan, I have good hope
Thou didst not know on ’t.—Who comes here? O heavens,
If you do love old men, if your sweet sway
Allow obedience, if yourselves are old,
Make it your cause. Send down, and take my part!
[to GONERIL ] Art not ashamed to look upon this beard?—
O Regan, wilt thou take her by the hand?",0.8133,-0.99675,-0.64305
king-lear,King Lear,main,2,4,9,540,speech,GONERIL,GONERIL,"Why not by th' hand, sir? How have I offended?
All’s not offense that indiscretion finds
And dotage terms so.",-0.4329,-0.99551,-0.66918
king-lear,King Lear,main,2,4,9,541,speech,LEAR,LEAR,"O sides, you are too tough.
Will you yet hold?—How came my man i' th' stocks?",0.3485,-0.99154,-0.28701
king-lear,King Lear,main,2,4,9,542,speech,CORNWALL,CORNWALL,"I set him there, sir, but his own disorders
Deserved much less advancement.",-0.8573,-0.99895,-0.58023
king-lear,King Lear,main,2,4,9,543,speech,LEAR,LEAR,You! Did you?,0.0,-0.99797,0.04804
king-lear,King Lear,main,2,4,9,544,speech,REGAN,REGAN,"I pray you, father, being weak, seem so.
If till the expiration of your month,
You will return and sojourn with my sister,
Dismissing half your train, come then to me.
I am now from home, and out of that provision
Which shall be needful for your entertainment.",0.2263,-0.99884,-0.62779
king-lear,King Lear,main,2,4,9,545,speech,LEAR,LEAR,"Return to her, and fifty men dismissed?
No, rather I abjure all roofs, and choose
To be a comrade with the wolf and owl—
To wage against the enmity o' th' air—
Necessity’s sharp pinch! Return with her?
Why, the hot-blooded France that dowerless took
Our youngest born— I could as well be brought
To knee his throne, and, squirelike, pension beg
To keep base life afoot. Return with her?
Persuade me rather to be slave and sumpter
To this detested groom. [indicates OSWALD ]",-0.3451,-0.99754,-0.68213
king-lear,King Lear,main,2,4,9,546,speech,GONERIL,GONERIL,"At your choice, sir.",0.0772,0.89738,-0.04976
king-lear,King Lear,main,2,4,9,547,speech,LEAR,LEAR,"Now, I prithee, daughter, do not make me mad.
I will not trouble thee, my child. Farewell.
We’ll no more meet, no more see one another.
But yet thou art my flesh, my blood, my daughter—
Or rather a disease that’s in my flesh,
Which I must needs call mine. Thou art a boil,
A plague-sore or embossèd carbuncle
In my corrupted blood. But I’ll not chide thee.
Let shame come when it will. I do not call it.
I do not bid the thunder-bearer shoot,
Nor tell tales of thee to high-judging Jove.
Mend when thou canst. Be better at thy leisure.
I can be patient. I can stay with Regan,
I and my hundred knights.",-0.4639,0.95195,-0.45797
king-lear,King Lear,main,2,4,9,548,speech,REGAN,REGAN,"Not altogether so, sir.
I looked not for you yet, nor am provided
For your fit welcome. Give ear, sir, to my sister.
For those that mingle reason with your passion
Must be content to think you old, and so—
But she knows what she does.",0.1015,0.98285,-0.56592
king-lear,King Lear,main,2,4,9,549,speech,LEAR,LEAR,Is this well spoken now?,0.0,-0.99891,-0.27416
king-lear,King Lear,main,2,4,9,550,speech,REGAN,REGAN,"I dare avouch it, sir. What, fifty followers?
Is it not well? What should you need of more—
Yea, or so many— sith that both charge and danger
Speak 'gainst so great a number? How, in one house,
Should many people under two commands
Hold amity? 'Tis hard; almost impossible.",0.5661,-0.99586,-0.81921
king-lear,King Lear,main,2,4,9,551,speech,GONERIL,GONERIL,"Why might not you, my lord, receive attendance
From those that she calls servants, or from mine?",0.0,-0.99887,-0.01794
king-lear,King Lear,main,2,4,9,552,speech,REGAN,REGAN,"Why not, my lord? If then they chanced to slack you,
We could control them. If you will come to me—
For now I spy a danger— I entreat you
To bring but five and twenty. To no more
Will I give place or notice.",-0.4939,-0.99611,-0.73094
king-lear,King Lear,main,2,4,9,553,speech,LEAR,LEAR,I gave you all—,0.0,-0.96725,0.65855
king-lear,King Lear,main,2,4,9,554,speech,REGAN,REGAN,And in good time you gave it.,0.34,0.99763,0.14458
king-lear,King Lear,main,2,4,9,555,speech,LEAR,LEAR,"Made you my guardians, my depositaries,
But kept a reservation to be followed
With such a number. What, must I come to you
With five and twenty, Regan? Said you so?",0.168,-0.99588,0.18296
king-lear,King Lear,main,2,4,9,556,speech,REGAN,REGAN,"And speak ’t again, my lord. No more with me.",0.4767,0.9892,0.63385
king-lear,King Lear,main,2,4,9,557,speech,LEAR,LEAR,"Those wicked creatures yet do look well favored
When others are more wicked. Not being the worst
Stands in some rank of praise.
[to GONERIL] I’ll go with thee.
Thy fifty yet doth double five and twenty,
And thou art twice her love.",0.7828,-0.99604,0.06553
king-lear,King Lear,main,2,4,9,558,speech,GONERIL,GONERIL,"Hear me, my lord.
What need you five and twenty, ten, or five
To follow in a house where twice so many
Have a command to tend you?",0.4939,-0.99888,-0.08449
king-lear,King Lear,main,2,4,9,559,speech,REGAN,REGAN,What need one?,0.0,-0.99873,-0.04317
king-lear,King Lear,main,2,4,9,560,speech,LEAR,LEAR,"O, reason not the need! Our basest beggars
Are in the poorest thing superfluous.
Allow not nature more than nature needs,
Man’s life’s as cheap as beast’s. Thou art a lady.
If only to go warm were gorgeous,
Why, nature needs not what thou gorgeous wear’st,
Which scarcely keeps thee warm. But, for true need—
You heavens, give me that patience, patience I need.
You see me here, you gods, a poor old man,
As full of grief as age, wretched in both.
If it be you that stir these daughters' hearts
Against their father, fool me not so much
To bear it tamely. Touch me with noble anger.
And let not women’s weapons, water drops,
Stain my man’s cheeks! No, you unnatural hags,
I will have such revenges on you both
That all the world shall— I will do such things—
What they are yet I know not, but they shall be
The terrors of the earth. You think I’ll weep?
No, I’ll not weep.",-0.982,-0.98328,-0.32851
king-lear,King Lear,main,2,4,9,561,stage_direction,,,"Exeunt LEAR, GENTLEMAN, FOOL, and GLOUCESTER",-0.5622,-0.98298,0.05069
king-lear,King Lear,main,2,4,9,562,speech,CORNWALL,CORNWALL,Let us withdraw. 'Twill be a storm.,0.0,0.997,0.03026
king-lear,King Lear,main,2,4,9,563,speech,REGAN,REGAN,"This house is little. The old man and his people
Cannot be well bestowed.",0.0,-0.99889,-0.46861
king-lear,King Lear,main,2,4,9,564,speech,GONERIL,GONERIL,"'Tis his own blame. Hath put himself from rest,
And must needs taste his folly.",-0.8225,-0.99872,-0.78818
king-lear,King Lear,main,2,4,9,565,speech,REGAN,REGAN,"For his particular I’ll receive him gladly,
But not one follower.",0.3291,-0.99754,-0.46495
king-lear,King Lear,main,2,4,9,566,speech,GONERIL,GONERIL,"So am I purposed.
Where is my lord of Gloucester?",0.0,0.98404,-0.035
king-lear,King Lear,main,2,4,9,567,speech,CORNWALL,CORNWALL,Followed the old man forth. He is returned.,0.0,-0.38597,0.29428
king-lear,King Lear,main,2,4,9,568,stage_direction,,,Enter GLOUCESTER,0.0,0.97746,0.01585
king-lear,King Lear,main,2,4,9,569,speech,GLOUCESTER,GLOUCESTER,The king is in high rage.,-0.4019,-0.9908,-0.14883
king-lear,King Lear,main,2,4,9,570,speech,CORNWALL,CORNWALL,Whither is he going?,0.0,-0.99809,-0.01167
king-lear,King Lear,main,2,4,9,571,speech,GLOUCESTER,GLOUCESTER,"He calls to horse, but will I know not whither.",0.0,-0.99821,-0.40707
king-lear,King Lear,main,2,4,9,572,speech,CORNWALL,CORNWALL,'Tis best to give him way. He leads himself.,0.7269,-0.99481,-0.50619
king-lear,King Lear,main,2,4,9,573,speech,GONERIL,GONERIL,"[to GLOUCESTER] My lord, entreat him by no means to
stay.",-0.1877,-0.99676,-0.64218
king-lear,King Lear,main,2,4,9,574,speech,GLOUCESTER,GLOUCESTER,"Alack, the night comes on, and the high winds
Do sorely ruffle. For many miles about
There’s scarce a bush.",-0.6705,-0.9975,-0.81364
king-lear,King Lear,main,2,4,9,575,speech,REGAN,REGAN,"O sir, to wilful men,
The injuries that they themselves procure
Must be their schoolmasters. Shut up your doors.
He is attended with a desperate train.
And what they may incense him to, being apt
To have his ear abused, wisdom bids fear.",-0.4911,-0.99575,-0.8878
king-lear,King Lear,main,2,4,9,576,speech,CORNWALL,CORNWALL,"Shut up your doors, my lord. 'Tis a wild night.
My Regan counsels well. Come out o' th' storm.",0.4404,0.99555,0.5391
king-lear,King Lear,main,2,4,9,577,stage_direction,,,Exeunt,0.0,-0.99354,-0.27456
king-lear,King Lear,main,3,1,10,578,stage_direction,,,"Storm still. Enter KENT disguised and GENTLEMAN, severally",-0.25,-0.98322,0.00516
king-lear,King Lear,main,3,1,10,579,speech,KENT,KENT,"Who’s there, besides foul weather?",-0.5423,-0.99875,0.0027
king-lear,King Lear,main,3,1,10,580,speech,GENTLEMAN,GENTLEMAN,"One minded like the weather, most unquietly.",-0.128,-0.99644,-0.49001
king-lear,King Lear,main,3,1,10,581,speech,KENT,KENT,I know you. Where’s the king?,0.0,-0.94336,0.02859
king-lear,King Lear,main,3,1,10,582,speech,GENTLEMAN,GENTLEMAN,"Contending with the fretful elements.
Bids the winds blow the earth into the sea
Or swell the curlèd water 'bove the main,
That things might change or cease. Tears his white
hair,
Which the impetuous blasts, with eyeless rage,
Catch in their fury and make nothing of.
Strives in his little world of man to outscorn
The to-and-fro–conflicting wind and rain.
This night—wherein the cub-drawn bear would couch,
The lion and the belly-pinchèd wolf
Keep their fur dry—unbonneted he runs,
And bids what will take all.",-0.8641,0.98577,-0.70338
king-lear,King Lear,main,3,1,10,583,speech,KENT,KENT,But who is with him?,0.0,-0.97519,-0.03945
king-lear,King Lear,main,3,1,10,584,speech,GENTLEMAN,GENTLEMAN,"None but the fool, who labors to outjest
His heart-struck injuries.",0.6908,-0.98554,-0.50187
king-lear,King Lear,main,3,1,10,585,speech,KENT,KENT,"Sir, I do know you,
And dare upon the warrant of my note
Commend a dear thing to you. There is division,
Although as yet the face of it be covered
With mutual cunning, ’twixt Albany and Cornwall,
Who have—as who have not that their great stars
Throned and set high?—servants, who seem no less,
Which are to France the spies and speculations
Intelligent of our state. What hath been seen,
Either in snuffs and packings of the dukes,
Or the hard rein which both of them hath borne
Against the old kind king, or something deeper,
Whereof perchance these are but furnishings—
But true it is. From France there comes a power
Into this scattered kingdom, who already,
Wise in our negligence, have secret feet
In some of our best ports and are at point
To show their open banner. Now to you.
If on my credit you dare build so far
To make your speed to Dover, you shall find
Some that will thank you, making just report
Of how unnatural and bemadding sorrow
The king hath cause to plain.
I am a gentleman of blood and breeding,
And from some knowledge and assurance offer
This office to you.",0.9322,0.99127,0.27811
king-lear,King Lear,main,3,1,10,586,speech,GENTLEMAN,GENTLEMAN,I will talk further with you.,0.0,-0.99314,-0.05153
king-lear,King Lear,main,3,1,10,587,speech,KENT,KENT,"[giving GENTLEMAN a purse and a ring]
No, do not.
For confirmation that I am much more
Than my outwall, open this purse and take
What it contains. If you shall see Cordelia—
As fear not but you shall—show her this ring.
And she will tell you who that fellow is
That yet you do not know. Fie on this storm!
I will go seek the king.",-0.0915,0.96179,0.30664
king-lear,King Lear,main,3,1,10,588,speech,GENTLEMAN,GENTLEMAN,Give me your hand. Have you no more to say?,0.3612,0.97661,0.03967
king-lear,King Lear,main,3,1,10,589,speech,KENT,KENT,"Few words, but to effect more than all yet:
That when we have found the king— in which your pain
That way; I’ll this—he that first lights on him
Holla the other.",0.3898,0.9903,0.00094
king-lear,King Lear,main,3,1,10,590,stage_direction,,,Exeunt severally,0.0,-0.99739,-0.00057
king-lear,King Lear,main,3,2,11,591,stage_direction,,,Storm still. Enter LEAR and FOOL,-0.5622,-0.99575,0.01726
king-lear,King Lear,main,3,2,11,592,speech,LEAR,LEAR,"Blow, winds, and crack your cheeks! Rage, blow!
You cataracts and hurricanoes, spout
Till you have drenched our steeples, drowned the cocks!
You sulfurous and thought-executing fires,
Vaunt-couriers of oak-cleaving thunderbolts,
Singe my white head! And thou, all-shaking thunder,
Smite flat the thick rotundity o' th' world,
Crack nature’s molds, all germens spill at once
That make ingrateful man!",-0.9227,0.98404,0.54246
king-lear,King Lear,main,3,2,11,593,speech,FOOL,FOOL,"O nuncle, court holy water in a dry house is better
than this rainwater out o' door. Good nuncle, in, and
ask thy daughters blessing. Here’s a night pities
neither wise man nor fool.",0.8976,-0.98907,-0.72167
king-lear,King Lear,main,3,2,11,594,speech,LEAR,LEAR,"Rumble thy bellyful! Spit, fire! Spout, rain!
Nor rain, wind, thunder, fire are my daughters.
I tax not you, you elements, with unkindness.
I never gave you kingdom, called you children.
You owe me no subscription. Why then, let fall
Your horrible pleasure. Here I stand, your slave—
A poor, infirm, weak, and despised old man.
But yet I call you servile ministers,
That will with two pernicious daughters joined
Your high engendered battles 'gainst a head
So old and white as this. Oh, ho! 'Tis foul.",-0.9198,-0.98255,-0.84592
king-lear,King Lear,main,3,2,11,595,speech,FOOL,FOOL,"He that has a house to put ’s head in has a good
headpiece.
The codpiece that will house
Before the head has any—
The head and he shall louse.
So beggars marry many.
The man that makes his toe
What he his heart should make
Shall of a corn cry woe,
And turn his sleep to wake.
For there was never yet fair woman but she made mouths
in a glass.",-0.2044,-0.96043,-0.24593
king-lear,King Lear,main,3,2,11,596,stage_direction,,,Enter KENT disguised,-0.25,-0.96778,0.00265
king-lear,King Lear,main,3,2,11,597,speech,LEAR,LEAR,"No, I will be the pattern of all patience.
I will say nothing.",0.3612,-0.99486,-0.4488
king-lear,King Lear,main,3,2,11,598,speech,KENT,KENT,Who’s there?,0.0,-0.98017,-0.01695
king-lear,King Lear,main,3,2,11,599,speech,FOOL,FOOL,"Marry, here’s grace and a codpiece—that’s a wise man
and a fool.",0.3182,0.98525,0.7356
king-lear,King Lear,main,3,2,11,600,speech,KENT,KENT,"[to LEAR] Alas, sir, are you here? Things that love
night
Love not such nights as these. The wrathful skies
Gallow the very wanderers of the dark
And make them keep their caves. Since I was man,
Such sheets of fire, such bursts of horrid thunder,
Such groans of roaring wind and rain I never
Remember to have heard. Man’s nature cannot carry
Th' affliction nor the fear.",-0.9618,-0.99399,-0.84423
king-lear,King Lear,main,3,2,11,601,speech,LEAR,LEAR,"Let the great gods
That keep this dreadful pudder o'er our heads
Find out their enemies now. Tremble, thou wretch
That hast within thee undivulgèd crimes
Unwhipped of justice. Hide thee, thou bloody hand,
Thou perjured, and thou simular man of virtue
That art incestuous. Caitiff, to pieces shake,
That under covert and convenient seeming
Hast practiced on man’s life. Close pent-up guilts,
Rive your concealing continents and cry
These dreadful summoners grace. I am a man
More sinned against than sinning.",-0.9531,-0.9743,-0.80154
king-lear,King Lear,main,3,2,11,602,speech,KENT,KENT,"Alack, bareheaded?
Gracious my lord, hard by here is a hovel.
Some friendship will it lend you 'gainst the tempest.
Repose you there, while I to this hard house—
More harder than the stones whereof ’tis raised,
Which even but now, demanding after you,
Denied me to come in—return, and force
Their scanted courtesy.",0.5724,-0.99682,-0.36942
king-lear,King Lear,main,3,2,11,603,speech,LEAR,LEAR,"My wits begin to turn.—
[to FOOL] Come on, my boy. How dost, my boy? Art cold?I
am cold myself.
[to KENT] Where is this straw, my fellow?
The art of our necessities is strange
That can make vile things precious. Come, your hovel.
Poor fool and knave, I have one part in my heart
That’s sorry yet for thee.",-0.7409,0.99184,-0.35086
king-lear,King Lear,main,3,2,11,604,speech,FOOL,FOOL,"[sings]
He that has and a little tiny wit—
With heigh-ho, the wind and the rain—
Must make content with his fortunes fit,
For the rain it raineth every day.",0.0,-0.66841,0.55581
king-lear,King Lear,main,3,2,11,605,speech,LEAR,LEAR,"True, my good boy.—Come, bring us to this hovel.",0.6908,0.99003,0.69333
king-lear,King Lear,main,3,2,11,606,stage_direction,,,Exeunt LEAR and KENT,0.0,-0.97858,0.01445
king-lear,King Lear,main,3,2,11,607,speech,FOOL,FOOL,"This is a brave night to cool a courtesan.
I’ll speak a prophecy ere I go.
When priests are more in word than matter,
When brewers mar their malt with water,
When nobles are their tailors' tutors,
No heretics burned but wenches' suitors,
When every case in law is right,
No squire in debt nor no poor knight,
When slanders do not live in tongues,
Nor cutpurses come not to throngs,
When usurers tell their gold i' th' field,
And bawds and whores do churches build—
Then shall the realm of Albion
Come to great confusion.
Then comes the time, who lives to see ’t,
That going shall be used with feet.
This prophecy Merlin shall make, for I live before his
time.",-0.6862,0.99359,-0.75007
king-lear,King Lear,main,3,2,11,608,stage_direction,,,Exit,0.0,-0.99615,0.01202
king-lear,King Lear,main,3,3,12,609,stage_direction,,,"Enter GLOUCESTER and EDMUND the bastard, with lights",0.0,0.98823,0.04258
king-lear,King Lear,main,3,3,12,610,speech,GLOUCESTER,GLOUCESTER,"Alack, alack, Edmund, I like not this unnatural
dealing. When I desire their leave that I might pity
him, they took from me the use of mine own house,
charged me on pain of their perpetual displeasure
neither to speak of him, entreat for him, nor any way
sustain him.",-0.9029,-0.99805,-0.81858
king-lear,King Lear,main,3,3,12,611,speech,EDMUND,EDMUND,Most savage and unnatural!,-0.5093,-0.9949,0.03617
king-lear,King Lear,main,3,3,12,612,speech,GLOUCESTER,GLOUCESTER,"Go to, say you nothing. There’s a division betwixt the
dukes. And a worse matter than that: I have received a
letter this night. 'Tis dangerous to be spoken. I have
locked the letter in my closet. These injuries the king
now bears will be revenged home. There’s part of a power
already footed. We must incline to the king. I will
look him and privily relieve him. Go you and maintain
talk with the duke, that my charity be not of him
perceived. If he ask for me, I am ill and gone to bed.
Though I die for it—as no less is threatened me—the king
my old master must be relieved. There is some strange
thing toward, Edmund. Pray you, be careful.",-0.4767,-0.99293,-0.81993
king-lear,King Lear,main,3,3,12,613,stage_direction,,,Exit GLOUCESTER,0.0,-0.99532,0.0091
king-lear,King Lear,main,3,3,12,614,speech,EDMUND,EDMUND,"This courtesy, forbid thee, shall the duke
Instantly know, and of that letter too.
This seems a fair deserving, and must draw me
That which my father loses—no less than all.
The younger rises when the old doth fall.",0.5789,-0.94364,0.65238
king-lear,King Lear,main,3,3,12,615,stage_direction,,,Exit,0.0,-0.99615,0.01202
king-lear,King Lear,main,3,4,13,616,stage_direction,,,"Enter LEAR, KENT disguised, and FOOL",-0.6841,-0.98977,0.05045
king-lear,King Lear,main,3,4,13,617,speech,KENT,KENT,"Here is the place, my lord. Good my lord, enter.
The tyranny of the open night’s too rough
For nature to endure.",0.3182,0.98586,-0.06831
king-lear,King Lear,main,3,4,13,618,speech,LEAR,LEAR,Let me alone.,-0.296,-0.98307,-0.38729
king-lear,King Lear,main,3,4,13,619,stage_direction,,,"Good my lord, enter here.",0.6369,0.97615,0.5466
king-lear,King Lear,main,3,4,13,620,speech,LEAR,LEAR,Wilt break my heart?,0.6705,-0.99311,-0.05245
king-lear,King Lear,main,3,4,13,621,speech,KENT,KENT,"I had rather break mine own. Good my lord, enter.",0.6369,-0.94075,0.37679
king-lear,King Lear,main,3,4,13,622,speech,LEAR,LEAR,"Thou think’st ’tis much that this contentious storm
Invades us to the skin. So ’tis to thee.
But where the greater malady is fixed
The lesser is scarce felt. Thou’dst shun a bear,
But if thy flight lay toward the raging sea
Thou’dst meet the bear i' th' mouth. When the mind’s
free,
The body’s delicate. The tempest in my mind
Doth from my senses take all feeling else
Save what beats there—filial ingratitude.
Is it not as this mouth should tear this hand
For lifting food to ’t? But I will punish home.
No, I will weep no more. In such a night
To shut me out! Pour on, I will endure.
In such a night as this! O Regan, Goneril,
Your old kind father, whose frank heart gave all—
Oh, that way madness lies. Let me shun that.
No more of that.",-0.9559,-0.9783,-0.75816
king-lear,King Lear,main,3,4,13,623,speech,KENT,KENT,"Good my lord, enter here.",0.6369,0.99394,0.60763
king-lear,King Lear,main,3,4,13,624,speech,LEAR,LEAR,"Prithee, go in thyself. Seek thine own ease.
This tempest will not give me leave to ponder
On things would hurt me more. But I’ll go in.
[to FOOL] In, boy. Go first. You houseless poverty—
Nay, get thee in. I’ll pray, and then I’ll sleep.",-0.7875,0.99482,0.58049
king-lear,King Lear,main,3,4,13,625,stage_direction,,,Exit FOOL,-0.5622,-0.99637,0.03236
king-lear,King Lear,main,3,4,13,626,speech,LEAR,LEAR,"Poor naked wretches, whereso'er you are,
That bide the pelting of this pitiless storm,
How shall your houseless heads and unfed sides,
Your looped and windowed raggedness, defend you
From seasons such as these? Oh, I have ta'en
Too little care of this! Take physic, pomp.
Expose thyself to feel what wretches feel,
That thou mayst shake the superflux to them
And show the heavens more just.",-0.9215,0.99242,-0.61012
king-lear,King Lear,main,3,4,13,627,speech,EDGAR,EDGAR,"[within] Fathom and half, fathom and half! Poor Tom!",-0.5696,-0.99418,0.62338
king-lear,King Lear,main,3,4,13,628,stage_direction,,,Enter FOOL,-0.5622,-0.9955,0.02124
king-lear,King Lear,main,3,4,13,629,speech,FOOL,FOOL,"Come not in here, nuncle. Here’s a spirit. Help me,
help me!",0.5255,-0.9978,-0.51652
king-lear,King Lear,main,3,4,13,630,speech,KENT,KENT,Give me thy hand. Who’s there?,0.4939,-0.98921,0.35712
king-lear,King Lear,main,3,4,13,631,speech,FOOL,FOOL,"A spirit, a spirit. He says his name’s Poor Tom.",-0.7717,-0.98843,-0.84366
king-lear,King Lear,main,3,4,13,632,speech,KENT,KENT,"What art thou that dost grumble there i' th' straw?
Come forth.",0.0,-0.99877,0.00225
king-lear,King Lear,main,3,4,13,633,stage_direction,,,Enter EDGAR disguised,-0.25,-0.97579,0.00333
king-lear,King Lear,main,3,4,13,634,speech,EDGAR,EDGAR,"Away! The foul fiend follows me! Through the sharp
hawthorn blows the cold wind. Hum! Go to thy cold bed
and warm thee.",-0.6571,0.97126,0.76338
king-lear,King Lear,main,3,4,13,635,speech,LEAR,LEAR,"Didst thou give all to thy two daughters, and art thou
come to this?",0.3612,-0.99881,-0.11215
