play_id,play_title,section,act,scene,scene_index_in_play,unit_index_in_play,type,speaker_original,speaker_normalized,original_text,vader_score,dl_score,dl2_score
measure-for-measure,Measure for Measure,main,3,1,9,492,speech,ISABELLA,ISABELLA,What says my brother?,0.0,-0.99773,-0.05914
measure-for-measure,Measure for Measure,main,3,1,9,493,speech,CLAUDIO,CLAUDIO,Death is a fearful thing.,-0.7964,-0.97191,-0.55509
measure-for-measure,Measure for Measure,main,3,1,9,494,speech,ISABELLA,ISABELLA,And shamed life a hateful.,-0.743,-0.98069,-0.76929
measure-for-measure,Measure for Measure,main,3,1,9,495,speech,CLAUDIO,CLAUDIO,"Ay, but to die, and go we know not where;
To lie in cold obstruction and to rot;
This sensible warm motion to become
A kneaded clod; and the delighted spirit
To bathe in fiery floods, or to reside
In thrilling region of thick-ribbed ice;
To be imprison'd in the viewless winds,
And blown with restless violence round about
The pendent world; or to be worse than worst
Of those that lawless and incertain thought
Imagine howling: 'tis too horrible!
The weariest and most loathed worldly life
That age, ache, penury and imprisonment
Can lay on nature is a paradise
To what we fear of death.",-0.9953,-0.9805,-0.87789
measure-for-measure,Measure for Measure,main,3,1,9,496,speech,ISABELLA,ISABELLA,"Alas, alas!",0.0,-0.99381,0.45732
measure-for-measure,Measure for Measure,main,3,1,9,497,speech,CLAUDIO,CLAUDIO,"Sweet sister, let me live:
What sin you do to save a brother's life,
Nature dispenses with the deed so far
That it becomes a virtue.",0.7745,0.99137,0.7519
measure-for-measure,Measure for Measure,main,3,1,9,498,speech,ISABELLA,ISABELLA,"O you beast!
O faithless coward! O dishonest wretch!
Wilt thou be made a man out of my vice?
Is't not a kind of incest, to take life
From thine own sister's shame? What should I think?
Heaven shield my mother play'd my father fair!
For such a warped slip of wilderness
Ne'er issued from his blood. Take my defiance!
Die, perish! Might but my bending down
Reprieve thee from thy fate, it should proceed:
I'll pray a thousand prayers for thy death,
No word to save thee.",-0.6617,-0.99892,-0.7812
measure-for-measure,Measure for Measure,main,3,1,9,499,speech,CLAUDIO,CLAUDIO,"Nay, hear me, Isabel.",0.0,-0.98815,-0.44954
measure-for-measure,Measure for Measure,main,3,1,9,500,speech,ISABELLA,ISABELLA,"O, fie, fie, fie!
Thy sin's not accidental, but a trade.
Mercy to thee would prove itself a bawd:
'Tis best thou diest quickly.",-0.1943,-0.99749,0.7394
measure-for-measure,Measure for Measure,main,3,1,9,501,speech,CLAUDIO,CLAUDIO,"O hear me, Isabella!",0.0,-0.99303,0.72034
measure-for-measure,Measure for Measure,main,3,1,9,502,stage_direction,,,Re-enter DUKE VINCENTIO,0.0,0.97689,0.03061
measure-for-measure,Measure for Measure,main,3,1,9,503,speech,DUKE VINCENTIO,DUKE VINCENTIO,"Vouchsafe a word, young sister, but one word.",0.0,-0.974,0.26404
measure-for-measure,Measure for Measure,main,3,1,9,504,speech,ISABELLA,ISABELLA,What is your will?,0.0772,-0.93924,-0.0192
measure-for-measure,Measure for Measure,main,3,1,9,505,speech,DUKE VINCENTIO,DUKE VINCENTIO,"Might you dispense with your leisure, I would by and
by have some speech with you: the satisfaction I
would require is likewise your own benefit.",0.7943,0.99336,-0.0052
measure-for-measure,Measure for Measure,main,3,1,9,506,speech,ISABELLA,ISABELLA,"I have no superfluous leisure; my stay must be
stolen out of other affairs; but I will attend you
awhile.",0.2846,0.98701,-0.45147
measure-for-measure,Measure for Measure,main,3,1,9,507,speech,DUKE VINCENTIO,DUKE VINCENTIO,"Son, I have overheard what hath passed between you
and your sister. Angelo had never the purpose to
corrupt her; only he hath made an essay of her
virtue to practise his judgment with the disposition
of natures: she, having the truth of honour in her,
hath made him that gracious denial which he is most
glad to receive. I am confessor to Angelo, and I
know this to be true; therefore prepare yourself to
death: do not satisfy your resolution with hopes
that are fallible: tomorrow you must die; go to
your knees and make ready.",0.8133,0.98838,-0.6329
measure-for-measure,Measure for Measure,main,3,1,9,508,speech,CLAUDIO,CLAUDIO,"Let me ask my sister pardon. I am so out of love
with life that I will sue to be rid of it.",-0.7579,0.94078,-0.74862
measure-for-measure,Measure for Measure,main,3,1,9,509,speech,DUKE VINCENTIO,DUKE VINCENTIO,Hold you there: farewell.,0.0,-0.97576,0.29167
measure-for-measure,Measure for Measure,main,3,1,9,510,stage_direction,,,Exit CLAUDIO,0.0,-0.99512,-0.00447
measure-for-measure,Measure for Measure,main,3,1,9,511,speech,DUKE VINCENTIO,DUKE VINCENTIO,"Provost, a word with you!",0.0,0.93639,0.66231
measure-for-measure,Measure for Measure,main,3,1,9,512,stage_direction,,,Re-enter Provost,0.0,-0.64942,0.01352
measure-for-measure,Measure for Measure,main,3,1,9,513,speech,PROVOST,PROVOST,"What's your will, father?",0.0772,-0.9762,-0.03865
measure-for-measure,Measure for Measure,main,3,1,9,514,speech,DUKE VINCENTIO,DUKE VINCENTIO,"That now you are come, you will be gone. Leave me
awhile with the maid: my mind promises with my
habit no loss shall touch her by my company.",-0.0258,-0.98702,0.26031
measure-for-measure,Measure for Measure,main,3,1,9,515,speech,PROVOST,PROVOST,In good time.,0.0,0.98431,0.19381
measure-for-measure,Measure for Measure,main,3,1,9,516,stage_direction,,,Exit Provost. ISABELLA comes forward,0.0,0.97516,0.03882
measure-for-measure,Measure for Measure,main,3,1,9,517,speech,DUKE VINCENTIO,DUKE VINCENTIO,"The hand that hath made you fair hath made you good:
the goodness that is cheap in beauty makes beauty
brief in goodness; but grace, being the soul of
your complexion, shall keep the body of it ever
fair. The assault that Angelo hath made to you,
fortune hath conveyed to my understanding; and, but
that frailty hath examples for his falling, I should
wonder at Angelo. How will you do to content this
substitute, and to save your brother?",0.9722,0.99477,0.57942
measure-for-measure,Measure for Measure,main,3,1,9,518,speech,ISABELLA,ISABELLA,"I am now going to resolve him: I had rather my
brother die by the law than my son should be
unlawfully born. But, O, how much is the good duke
deceived in Angelo! I f ever he return and I can
speak to him, I will open my lips in vain, or
discover his government.",-0.8414,-0.98215,-0.615
measure-for-measure,Measure for Measure,main,3,1,9,519,speech,DUKE VINCENTIO,DUKE VINCENTIO,"That shall not be much amiss: Yet, as the matter
now stands, he will avoid your accusation; he made
trial of you only. Therefore fasten your ear on my
advisings: to the love I have in doing good a
remedy presents itself. I do make myself believe
that you may most uprighteously do a poor wronged
lady a merited benefit; redeem your brother from
the angry law; do no stain to your own gracious
person; and much please the absent duke, if
peradventure he shall ever return to have hearing of
this business.",0.6489,0.88936,-0.14011
measure-for-measure,Measure for Measure,main,3,1,9,520,speech,ISABELLA,ISABELLA,"Let me hear you speak farther. I have spirit to do
anything that appears not foul in the truth of my
spirit.",0.5932,0.96776,-0.02284
measure-for-measure,Measure for Measure,main,3,1,9,521,speech,DUKE VINCENTIO,DUKE VINCENTIO,"Virtue is bold, and goodness never fearful. Have
you not heard speak of Mariana, the sister of
Frederick the great soldier who miscarried at sea?",0.8316,0.99249,0.63761
measure-for-measure,Measure for Measure,main,3,1,9,522,speech,ISABELLA,ISABELLA,"I have heard of the lady, and good words went with her
name.",0.4404,0.9882,0.44923
measure-for-measure,Measure for Measure,main,3,1,9,523,speech,DUKE VINCENTIO,DUKE VINCENTIO,"She should this Angelo have married; was affianced
to her by oath, and the nuptial appointed: between
which time of the contract and limit of the
solemnity, her brother Frederick was wrecked at sea,
having in that perished vessel the dowry of his
sister. But mark how heavily this befell to the
poor gentlewoman: there she lost a noble and
renowned brother, in his love toward her ever most
kind and natural; with him, the portion and sinew of
her fortune, her marriage-dowry; with both, her
combinate husband, this well-seeming Angelo.",0.7935,-0.99759,-0.716
measure-for-measure,Measure for Measure,main,3,1,9,524,speech,ISABELLA,ISABELLA,Can this be so? did Angelo so leave her?,0.6662,-0.99333,-0.31993
measure-for-measure,Measure for Measure,main,3,1,9,525,speech,DUKE VINCENTIO,DUKE VINCENTIO,"Left her in her tears, and dried not one of them
with his comfort; swallowed his vows whole,
pretending in her discoveries of dishonour: in few,
bestowed her on her own lamentation, which she yet
wears for his sake; and he, a marble to her tears,
is washed with them, but relents not.",-0.6142,-0.99894,-0.48044
measure-for-measure,Measure for Measure,main,3,1,9,526,speech,ISABELLA,ISABELLA,"What a merit were it in death to take this poor maid
from the world! What corruption in this life, that
it will let this man live! But how out of this can she
avail?",-0.7224,-0.99642,-0.59401
measure-for-measure,Measure for Measure,main,3,1,9,527,speech,DUKE VINCENTIO,DUKE VINCENTIO,"It is a rupture that you may easily heal: and the
cure of it not only saves your brother, but keeps
you from dishonour in doing it.",0.1779,0.99675,0.42575
measure-for-measure,Measure for Measure,main,3,1,9,528,speech,ISABELLA,ISABELLA,"Show me how, good father.",0.4404,0.99177,0.55446
measure-for-measure,Measure for Measure,main,3,1,9,529,speech,DUKE VINCENTIO,DUKE VINCENTIO,"This forenamed maid hath yet in her the continuance
of her first affection: his unjust unkindness, that
in all reason should have quenched her love, hath,
like an impediment in the current, made it more
violent and unruly. Go you to Angelo; answer his
requiring with a plausible obedience; agree with
his demands to the point; only refer yourself to
this advantage, first, that your stay with him may
not be long; that the time may have all shadow and
silence in it; and the place answer to convenience.
This being granted in course,—and now follows
all,—we shall advise this wronged maid to stead up
your appointment, go in your place; if the encounter
acknowledge itself hereafter, it may compel him to
her recompense: and here, by this, is your brother
saved, your honour untainted, the poor Mariana
advantaged, and the corrupt deputy scaled. The maid
will I frame and make fit for his attempt. If you
think well to carry this as you may, the doubleness
of the benefit defends the deceit from reproof.
What think you of it?",0.9524,0.99593,-0.74268
measure-for-measure,Measure for Measure,main,3,1,9,530,speech,ISABELLA,ISABELLA,"The image of it gives me content already; and I
trust it will grow to a most prosperous perfection.",0.6478,0.99764,-0.11079
measure-for-measure,Measure for Measure,main,3,1,9,531,speech,DUKE VINCENTIO,DUKE VINCENTIO,"It lies much in your holding up. Haste you speedily
to Angelo: if for this night he entreat you to his
bed, give him promise of satisfaction. I will
presently to Saint Luke's: there, at the moated
grange, resides this dejected Mariana. At that
place call upon me; and dispatch with Angelo, that
it may be quickly.",0.34,0.9935,0.4257
measure-for-measure,Measure for Measure,main,3,1,9,532,speech,ISABELLA,ISABELLA,"I thank you for this comfort. Fare you well, good
father.",0.8834,0.99754,0.45809
measure-for-measure,Measure for Measure,main,3,1,9,533,stage_direction,,,Exeunt severally,0.0,-0.99538,0.00199
measure-for-measure,Measure for Measure,main,3,2,10,534,stage_direction,,,"Enter, on one side, DUKE VINCENTIO disguised as before; on the other, ELBOW, and Officers with POMPEY",-0.2732,-0.98502,0.00697
measure-for-measure,Measure for Measure,main,3,2,10,535,speech,ELBOW,ELBOW,"Nay, if there be no remedy for it, but that you will
needs buy and sell men and women like beasts, we
shall have all the world drink brown and white bastard.",0.5574,-0.99536,-0.4559
measure-for-measure,Measure for Measure,main,3,2,10,536,speech,DUKE VINCENTIO,DUKE VINCENTIO,O heavens! what stuff is here?,0.4574,-0.9988,0.79858
measure-for-measure,Measure for Measure,main,3,2,10,537,speech,POMPEY,POMPEY,"'Twas never merry world since, of two usuries, the
merriest was put down, and the worser allowed by
order of law a furred gown to keep him warm; and
furred with fox and lamb-skins too, to signify, that
craft, being richer than innocency, stands for the
facing.",0.2003,-0.98603,-0.69365
measure-for-measure,Measure for Measure,main,3,2,10,538,speech,ELBOW,ELBOW,"Come your way, sir. 'Bless you, good father friar.",0.6908,0.99556,0.60216
measure-for-measure,Measure for Measure,main,3,2,10,539,speech,DUKE VINCENTIO,DUKE VINCENTIO,"And you, good brother father. What offence hath
this man made you, sir?",0.128,-0.99229,0.3168
measure-for-measure,Measure for Measure,main,3,2,10,540,speech,ELBOW,ELBOW,"Marry, sir, he hath offended the law: and, sir, we
take him to be a thief too, sir; for we have found
upon him, sir, a strange picklock, which we have
sent to the deputy.",-0.6597,-0.99866,-0.67772
measure-for-measure,Measure for Measure,main,3,2,10,541,speech,DUKE VINCENTIO,DUKE VINCENTIO,"Fie, sirrah! a bawd, a wicked bawd!
The evil that thou causest to be done,
That is thy means to live. Do thou but think
What 'tis to cram a maw or clothe a back
From such a filthy vice: say to thyself,
From their abominable and beastly touches
I drink, I eat, array myself, and live.
Canst thou believe thy living is a life,
So stinkingly depending? Go mend, go mend.",-0.9688,-0.9979,-0.47898
measure-for-measure,Measure for Measure,main,3,2,10,542,speech,POMPEY,POMPEY,"Indeed, it does stink in some sort, sir; but yet,
sir, I would prove—",0.0129,-0.82694,-0.12568
measure-for-measure,Measure for Measure,main,3,2,10,543,speech,DUKE VINCENTIO,DUKE VINCENTIO,"Nay, if the devil have given thee proofs for sin,
Thou wilt prove his. Take him to prison, officer:
Correction and instruction must both work
Ere this rude beast will profit.",-0.9169,-0.99677,-0.16655
measure-for-measure,Measure for Measure,main,3,2,10,544,speech,ELBOW,ELBOW,"He must before the deputy, sir; he has given him
warning: the deputy cannot abide a whoremaster: if
he be a whoremonger, and comes before him, he were
as good go a mile on his errand.",0.128,-0.99879,-0.14262
measure-for-measure,Measure for Measure,main,3,2,10,545,speech,DUKE VINCENTIO,DUKE VINCENTIO,"That we were all, as some would seem to be,
From our faults, as faults from seeming, free!",0.126,-0.97093,-0.44744
measure-for-measure,Measure for Measure,main,3,2,10,546,speech,ELBOW,ELBOW,"His neck will come to your waist,—a cord, sir.",0.3612,-0.99467,-0.17791
measure-for-measure,Measure for Measure,main,3,2,10,547,speech,POMPEY,POMPEY,"I spy comfort; I cry bail. Here's a gentleman and a
friend of mine.",0.75,0.95823,0.49044
measure-for-measure,Measure for Measure,main,3,2,10,548,stage_direction,,,Enter LUCIO,0.0,0.97821,0.01067
measure-for-measure,Measure for Measure,main,3,2,10,549,speech,LUCIO,LUCIO,"How now, noble Pompey! What, at the wheels of
Caesar? art thou led in triumph? What, is there
none of Pygmalion's images, newly made woman, to be
had now, for putting the hand in the pocket and
extracting it clutch'd? What reply, ha? What
sayest thou to this tune, matter and method? Is't
not drowned i' the last rain, ha? What sayest
thou, Trot? Is the world as it was, man? Which is
the way? Is it sad, and few words? or how? The
trick of it?",-0.8577,-0.99576,-0.4679
measure-for-measure,Measure for Measure,main,3,2,10,550,speech,DUKE VINCENTIO,DUKE VINCENTIO,"Still thus, and thus; still worse!",-0.7574,-0.99896,0.45158
measure-for-measure,Measure for Measure,main,3,2,10,551,speech,LUCIO,LUCIO,"How doth my dear morsel, thy mistress? Procures she
still, ha?",0.5514,-0.98096,-0.21467
measure-for-measure,Measure for Measure,main,3,2,10,552,speech,POMPEY,POMPEY,"Troth, sir, she hath eaten up all her beef, and she
is herself in the tub.",0.3182,-0.99798,0.057
measure-for-measure,Measure for Measure,main,3,2,10,553,speech,LUCIO,LUCIO,"Why, 'tis good; it is the right of it; it must be
so: ever your fresh whore and your powdered bawd:
an unshunned consequence; it must be so. Art going
to prison, Pompey?",0.0,-0.97872,0.49664
measure-for-measure,Measure for Measure,main,3,2,10,554,speech,POMPEY,POMPEY,"Yes, faith, sir.",0.4019,0.99206,0.55602
measure-for-measure,Measure for Measure,main,3,2,10,555,speech,LUCIO,LUCIO,"Why, 'tis not amiss, Pompey. Farewell: go, say I
sent thee thither. For debt, Pompey? or how?",0.3641,-0.95282,0.40828
measure-for-measure,Measure for Measure,main,3,2,10,556,speech,ELBOW,ELBOW,"For being a bawd, for being a bawd.",0.0,-0.97816,-0.4588
measure-for-measure,Measure for Measure,main,3,2,10,557,speech,LUCIO,LUCIO,"Well, then, imprison him: if imprisonment be the
due of a bawd, why, 'tis his right: bawd is he
doubtless, and of antiquity too; bawd-born.
Farewell, good Pompey. Commend me to the prison,
Pompey: you will turn good husband now, Pompey; you
will keep the house.",0.088,0.95731,-0.24377
measure-for-measure,Measure for Measure,main,3,2,10,558,speech,POMPEY,POMPEY,"I hope, sir, your good worship will be my bail.",0.743,-0.97145,0.17517
measure-for-measure,Measure for Measure,main,3,2,10,559,speech,LUCIO,LUCIO,"No, indeed, will I not, Pompey; it is not the wear.
I will pray, Pompey, to increase your bondage: If
you take it not patiently, why, your mettle is the
more. Adieu, trusty Pompey. 'Bless you, friar.",-0.6266,-0.9963,-0.70193
measure-for-measure,Measure for Measure,main,3,2,10,560,speech,DUKE VINCENTIO,DUKE VINCENTIO,And you.,0.0,0.99454,0.3068
measure-for-measure,Measure for Measure,main,3,2,10,561,speech,LUCIO,LUCIO,"Does Bridget paint still, Pompey, ha?",0.0,-0.99873,-0.2729
measure-for-measure,Measure for Measure,main,3,2,10,562,speech,ELBOW,ELBOW,"Come your ways, sir; come.",0.0,0.96661,0.48542
measure-for-measure,Measure for Measure,main,3,2,10,563,speech,POMPEY,POMPEY,"You will not bail me, then, sir?",0.0,-0.99888,-0.19586
measure-for-measure,Measure for Measure,main,3,2,10,564,speech,LUCIO,LUCIO,"Then, Pompey, nor now. What news abroad, friar?
what news?",0.0,-0.98296,-0.13901
measure-for-measure,Measure for Measure,main,3,2,10,565,speech,ELBOW,ELBOW,"Come your ways, sir; come.",0.0,0.96661,0.48542
measure-for-measure,Measure for Measure,main,3,2,10,566,speech,LUCIO,LUCIO,"Go to kennel, Pompey; go.",0.0,-0.96534,0.3582
measure-for-measure,Measure for Measure,main,3,2,10,567,stage_direction,,,"Exeunt ELBOW, POMPEY and Officers",0.0,-0.9906,0.01352
measure-for-measure,Measure for Measure,main,3,2,10,568,speech,LUCIO,LUCIO,"What news, friar, of the duke?",0.0,0.91867,-0.05599
measure-for-measure,Measure for Measure,main,3,2,10,569,speech,DUKE VINCENTIO,DUKE VINCENTIO,I know none. Can you tell me of any?,0.0,-0.99898,-0.34184
measure-for-measure,Measure for Measure,main,3,2,10,570,speech,LUCIO,LUCIO,"Some say he is with the Emperor of Russia; other
some, he is in Rome: but where is he, think you?",0.0,-0.99604,-0.00936
measure-for-measure,Measure for Measure,main,3,2,10,571,speech,DUKE VINCENTIO,DUKE VINCENTIO,"I know not where; but wheresoever, I wish him well.",0.7351,0.99744,-0.34263
measure-for-measure,Measure for Measure,main,3,2,10,572,speech,LUCIO,LUCIO,"It was a mad fantastical trick of him to steal from
the state, and usurp the beggary he was never born
to. Lord Angelo dukes it well in his absence; he
puts transgression to 't.",0.7645,0.99092,0.35827
measure-for-measure,Measure for Measure,main,3,2,10,573,speech,DUKE VINCENTIO,DUKE VINCENTIO,He does well in 't.,0.2732,0.99771,0.4432
measure-for-measure,Measure for Measure,main,3,2,10,574,speech,LUCIO,LUCIO,"A little more lenity to lechery would do no harm in
him: something too crabbed that way, friar.",-0.7024,-0.99616,-0.46998
measure-for-measure,Measure for Measure,main,3,2,10,575,speech,DUKE VINCENTIO,DUKE VINCENTIO,"It is too general a vice, and severity must cure it.",-0.6808,-0.97071,-0.47363
measure-for-measure,Measure for Measure,main,3,2,10,576,speech,LUCIO,LUCIO,"Yes, in good sooth, the vice is of a great kindred;
it is well allied: but it is impossible to extirp
it quite, friar, till eating and drinking be put
down. They say this Angelo was not made by man and
woman after this downright way of creation: is it
true, think you?",0.8674,-0.96773,-0.81073
measure-for-measure,Measure for Measure,main,3,2,10,577,speech,DUKE VINCENTIO,DUKE VINCENTIO,"How should he be made, then?",0.0,-0.98719,-0.00543
measure-for-measure,Measure for Measure,main,3,2,10,578,speech,LUCIO,LUCIO,"Some report a sea-maid spawned him; some, that he
was begot between two stock-fishes. But it is
certain that when he makes water his urine is
congealed ice; that I know to be true: and he is a
motion generative; that's infallible.",0.7147,-0.96737,-0.21142
measure-for-measure,Measure for Measure,main,3,2,10,579,speech,DUKE VINCENTIO,DUKE VINCENTIO,"You are pleasant, sir, and speak apace.",0.4404,0.99727,0.47797
measure-for-measure,Measure for Measure,main,3,2,10,580,speech,LUCIO,LUCIO,"Why, what a ruthless thing is this in him, for the
rebellion of a codpiece to take away the life of a
man! Would the duke that is absent have done this?
Ere he would have hanged a man for the getting a
hundred bastards, he would have paid for the nursing
a thousand: he had some feeling of the sport: he
knew the service, and that instructed him to mercy.",-0.9,-0.97798,0.50678
measure-for-measure,Measure for Measure,main,3,2,10,581,speech,DUKE VINCENTIO,DUKE VINCENTIO,"I never heard the absent duke much detected for
women; he was not inclined that way.",0.0,-0.99572,-0.50218
measure-for-measure,Measure for Measure,main,3,2,10,582,speech,LUCIO,LUCIO,"O, sir, you are deceived.",-0.4767,-0.9936,-0.48217
measure-for-measure,Measure for Measure,main,3,2,10,583,speech,DUKE VINCENTIO,DUKE VINCENTIO,'Tis not possible.,0.0,-0.99869,-0.47214
measure-for-measure,Measure for Measure,main,3,2,10,584,speech,LUCIO,LUCIO,"Who, not the duke? yes, your beggar of fifty; and
his use was to put a ducat in her clack-dish: the
duke had crotchets in him. He would be drunk too;
that let me inform you.",-0.34,0.97731,-0.32216
measure-for-measure,Measure for Measure,main,3,2,10,585,speech,DUKE VINCENTIO,DUKE VINCENTIO,"You do him wrong, surely.",0.3182,-0.9988,-0.48249
measure-for-measure,Measure for Measure,main,3,2,10,586,speech,LUCIO,LUCIO,"Sir, I was an inward of his. A shy fellow was the
duke: and I believe I know the cause of his
withdrawing.",0.6249,0.98511,0.48021
measure-for-measure,Measure for Measure,main,3,2,10,587,speech,DUKE VINCENTIO,DUKE VINCENTIO,"What, I prithee, might be the cause?",0.3182,-0.99253,-0.02522
measure-for-measure,Measure for Measure,main,3,2,10,588,speech,LUCIO,LUCIO,"No, pardon; 'tis a secret must be locked within the
teeth and the lips: but this I can let you
understand, the greater file of the subject held the
duke to be wise.",0.6124,-0.90288,0.39505
measure-for-measure,Measure for Measure,main,3,2,10,589,speech,DUKE VINCENTIO,DUKE VINCENTIO,"Wise! why, no question but he was.",0.4588,0.99688,0.19249
measure-for-measure,Measure for Measure,main,3,2,10,590,speech,LUCIO,LUCIO,"A very superficial, ignorant, unweighing fellow.",-0.3353,-0.99824,-0.72605
measure-for-measure,Measure for Measure,main,3,2,10,591,speech,DUKE VINCENTIO,DUKE VINCENTIO,"Either this is the envy in you, folly, or mistaking:
the very stream of his life and the business he hath
helmed must upon a warranted need give him a better
proclamation. Let him be but testimonied in his own
bringings-forth, and he shall appear to the
envious a scholar, a statesman and a soldier.
Therefore you speak unskilfully: or if your
knowledge be more it is much darkened in your malice.",-0.9325,-0.97714,0.29733
measure-for-measure,Measure for Measure,main,3,2,10,592,speech,LUCIO,LUCIO,"Sir, I know him, and I love him.",0.6369,0.9972,0.56784
measure-for-measure,Measure for Measure,main,3,2,10,593,speech,DUKE VINCENTIO,DUKE VINCENTIO,"Love talks with better knowledge, and knowledge with
dearer love.",0.9117,-0.82946,-0.4671
measure-for-measure,Measure for Measure,main,3,2,10,594,speech,LUCIO,LUCIO,"Come, sir, I know what I know.",0.0,-0.99553,0.46772
measure-for-measure,Measure for Measure,main,3,2,10,595,speech,DUKE VINCENTIO,DUKE VINCENTIO,"I can hardly believe that, since you know not what
you speak. But, if ever the duke return, as our
prayers are he may, let me desire you to make your
answer before him. If it be honest you have spoke,
you have courage to maintain it: I am bound to call
upon you; and, I pray you, your name?",0.7783,-0.99894,-0.19108
measure-for-measure,Measure for Measure,main,3,2,10,596,speech,LUCIO,LUCIO,"Sir, my name is Lucio; well known to the duke.",0.0,0.98543,0.45281
measure-for-measure,Measure for Measure,main,3,2,10,597,speech,DUKE VINCENTIO,DUKE VINCENTIO,"He shall know you better, sir, if I may live to
report you.",0.4404,-0.98892,0.25706
measure-for-measure,Measure for Measure,main,3,2,10,598,speech,LUCIO,LUCIO,I fear you not.,0.0,0.99367,-0.2816
measure-for-measure,Measure for Measure,main,3,2,10,599,speech,DUKE VINCENTIO,DUKE VINCENTIO,"O, you hope the duke will return no more; or you
imagine me too unhurtful an opposite. But indeed I
can do you little harm; you'll forswear this again.",0.9017,-0.99544,-0.39202
measure-for-measure,Measure for Measure,main,3,2,10,600,speech,LUCIO,LUCIO,"I'll be hanged first: thou art deceived in me,
friar. But no more of this. Canst thou tell if
Claudio die to-morrow or no?",-0.8126,-0.99352,0.07127
measure-for-measure,Measure for Measure,main,3,2,10,601,speech,DUKE VINCENTIO,DUKE VINCENTIO,"Why should he die, sir?",-0.5994,-0.89839,-0.04995
