play_id,play_title,section,act,scene,scene_index_in_play,unit_index_in_play,type,speaker_original,speaker_normalized,original_text,vader_score,dl_score,dl2_score
measure-for-measure,Measure for Measure,main,4,2,12,726,speech,DUKE VINCENTIO,DUKE VINCENTIO,"[aside] This is his pardon, purchased by such sin
For which the pardoner himself is in.
Hence hath offence his quick celerity,
When it is born in high authority:
When vice makes mercy, mercy's so extended,
That for the fault's love is the offender friended.
Now, sir, what news?",-0.6124,0.99186,-0.2366
measure-for-measure,Measure for Measure,main,4,2,12,727,speech,PROVOST,PROVOST,"I told you. Lord Angelo, belike thinking me remiss
in mine office, awakens me with this unwonted
putting-on; methinks strangely, for he hath not used it
before.",-0.5303,-0.99666,-0.51609
measure-for-measure,Measure for Measure,main,4,2,12,728,speech,DUKE VINCENTIO,DUKE VINCENTIO,"Pray you, let's hear.",0.0,0.99545,0.01061
measure-for-measure,Measure for Measure,main,4,2,12,729,speech,PROVOST,PROVOST,"[Reads]
'Whatsoever you may hear to the contrary, let
Claudio be executed by four of the clock; and in the
afternoon Barnardine: for my better satisfaction,
let me have Claudio's head sent me by five. Let
this be duly performed; with a thought that more
depends on it than we must yet deliver. Thus fail
not to do your office, as you will answer it at your
peril.'
What say you to this, sir?",0.6542,0.98719,0.02878
measure-for-measure,Measure for Measure,main,4,2,12,730,speech,DUKE VINCENTIO,DUKE VINCENTIO,"What is that Barnardine who is to be executed in the
afternoon?",0.0,-0.99695,-0.35712
measure-for-measure,Measure for Measure,main,4,2,12,731,speech,PROVOST,PROVOST,"A Bohemian born, but here nursed un and bred; one
that is a prisoner nine years old.",-0.6956,-0.99176,-0.41115
measure-for-measure,Measure for Measure,main,4,2,12,732,speech,DUKE VINCENTIO,DUKE VINCENTIO,"How came it that the absent duke had not either
delivered him to his liberty or executed him? I
have heard it was ever his manner to do so.",0.5106,-0.99657,-0.01943
measure-for-measure,Measure for Measure,main,4,2,12,733,speech,PROVOST,PROVOST,"His friends still wrought reprieves for him: and,
indeed, his fact, till now in the government of Lord
Angelo, came not to an undoubtful proof.",0.6249,0.97621,-0.40838
measure-for-measure,Measure for Measure,main,4,2,12,734,speech,DUKE VINCENTIO,DUKE VINCENTIO,It is now apparent?,0.0,0.99418,-0.00841
measure-for-measure,Measure for Measure,main,4,2,12,735,speech,PROVOST,PROVOST,"Most manifest, and not denied by himself.",0.5975,-0.96812,-0.44415
measure-for-measure,Measure for Measure,main,4,2,12,736,speech,DUKE VINCENTIO,DUKE VINCENTIO,"Hath he born himself penitently in prison? how
seems he to be touched?",-0.8105,-0.97775,-0.40936
measure-for-measure,Measure for Measure,main,4,2,12,737,speech,PROVOST,PROVOST,"A man that apprehends death no more dreadfully but
as a drunken sleep; careless, reckless, and fearless
of what's past, present, or to come; insensible of
mortality, and desperately mortal.",-0.8329,0.99496,-0.85288
measure-for-measure,Measure for Measure,main,4,2,12,738,speech,DUKE VINCENTIO,DUKE VINCENTIO,He wants advice.,0.0,-0.99,-0.32693
measure-for-measure,Measure for Measure,main,4,2,12,739,speech,PROVOST,PROVOST,"He will hear none: he hath evermore had the liberty
of the prison; give him leave to escape hence, he
would not: drunk many times a day, if not many days
entirely drunk. We have very oft awaked him, as if
to carry him to execution, and showed him a seeming
warrant for it: it hath not moved him at all.",0.0021,-0.99752,-0.74182
measure-for-measure,Measure for Measure,main,4,2,12,740,speech,DUKE VINCENTIO,DUKE VINCENTIO,"More of him anon. There is written in your brow,
provost, honesty and constancy: if I read it not
truly, my ancient skill beguiles me; but, in the
boldness of my cunning, I will lay myself in hazard.
Claudio, whom here you have warrant to execute, is
no greater forfeit to the law than Angelo who hath
sentenced him. To make you understand this in a
manifested effect, I crave but four days' respite;
for the which you are to do me both a present and a
dangerous courtesy.",0.1993,0.99562,-0.62391
measure-for-measure,Measure for Measure,main,4,2,12,741,speech,PROVOST,PROVOST,"Pray, sir, in what?",0.0,-0.98133,-0.09515
measure-for-measure,Measure for Measure,main,4,2,12,742,speech,DUKE VINCENTIO,DUKE VINCENTIO,In the delaying death.,-0.7351,0.97916,-0.01557
measure-for-measure,Measure for Measure,main,4,2,12,743,speech,PROVOST,PROVOST,"A lack, how may I do it, having the hour limited,
and an express command, under penalty, to deliver
his head in the view of Angelo? I may make my case
as Claudio's, to cross this in the smallest.",-0.7777,0.9751,0.13775
measure-for-measure,Measure for Measure,main,4,2,12,744,speech,DUKE VINCENTIO,DUKE VINCENTIO,"By the vow of mine order I warrant you, if my
instructions may be your guide. Let this Barnardine
be this morning executed, and his head born to Angelo.",0.4019,-0.97905,0.21337
measure-for-measure,Measure for Measure,main,4,2,12,745,speech,PROVOST,PROVOST,"Angelo hath seen them both, and will discover the
favour.",0.0,0.98685,0.22
measure-for-measure,Measure for Measure,main,4,2,12,746,speech,DUKE VINCENTIO,DUKE VINCENTIO,"O, death's a great disguiser; and you may add to it.
Shave the head, and tie the beard; and say it was
the desire of the penitent to be so bared before his
death: you know the course is common. If any thing
fall to you upon this, more than thanks and good
fortune, by the saint whom I profess, I will plead
against it with my life.",-0.9423,-0.9641,0.40965
measure-for-measure,Measure for Measure,main,4,2,12,747,speech,PROVOST,PROVOST,"Pardon me, good father; it is against my oath.",0.6652,-0.99726,-0.64811
measure-for-measure,Measure for Measure,main,4,2,12,748,speech,DUKE VINCENTIO,DUKE VINCENTIO,"Were you sworn to the duke, or to the deputy?",-0.0516,-0.96643,-0.00876
measure-for-measure,Measure for Measure,main,4,2,12,749,speech,PROVOST,PROVOST,"To him, and to his substitutes.",0.0,-0.98102,0.04279
measure-for-measure,Measure for Measure,main,4,2,12,750,speech,DUKE VINCENTIO,DUKE VINCENTIO,"You will think you have made no offence, if the duke
avouch the justice of your dealing?",0.3724,-0.98017,-0.03902
measure-for-measure,Measure for Measure,main,4,2,12,751,speech,PROVOST,PROVOST,But what likelihood is in that?,0.3612,-0.97026,-0.12026
measure-for-measure,Measure for Measure,main,4,2,12,752,speech,DUKE VINCENTIO,DUKE VINCENTIO,"Not a resemblance, but a certainty. Yet since I see
you fearful, that neither my coat, integrity, nor
persuasion can with ease attempt you, I will go
further than I meant, to pluck all fears out of you.
Look you, sir, here is the hand and seal of the
duke: you know the character, I doubt not; and the
signet is not strange to you.",0.6994,0.97416,0.03864
measure-for-measure,Measure for Measure,main,4,2,12,753,speech,PROVOST,PROVOST,I know them both.,0.0,0.99544,0.05961
measure-for-measure,Measure for Measure,main,4,2,12,754,speech,DUKE VINCENTIO,DUKE VINCENTIO,"The contents of this is the return of the duke: you
shall anon over-read it at your pleasure; where you
shall find, within these two days he will be here.
This is a thing that Angelo knows not; for he this
very day receives letters of strange tenor;
perchance of the duke's death; perchance entering
into some monastery; but, by chance, nothing of what
is writ. Look, the unfolding star calls up the
shepherd. Put not yourself into amazement how these
things should be: all difficulties are but easy
when they are known. Call your executioner, and off
with Barnardine's head: I will give him a present
shrift and advise him for a better place. Yet you
are amazed; but this shall absolutely resolve you.
Come away; it is almost clear dawn.",0.25,0.98428,-0.23864
measure-for-measure,Measure for Measure,main,4,2,12,755,stage_direction,,,Exeunt,0.0,-0.98874,-0.13698
measure-for-measure,Measure for Measure,main,4,3,13,756,stage_direction,,,Enter POMPEY,0.0,0.97792,0.0085
measure-for-measure,Measure for Measure,main,4,3,13,757,speech,POMPEY,POMPEY,"I am as well acquainted here as I was in our house
of profession: one would think it were Mistress
Overdone's own house, for here be many of her old
customers. First, here's young Master Rash; he's in
for a commodity of brown paper and old ginger,
ninescore and seventeen pounds; of which he made
five marks, ready money: marry, then ginger was not
much in request, for the old women were all dead.
Then is there here one Master Caper, at the suit of
Master Three-pile the mercer, for some four suits of
peach-coloured satin, which now peaches him a
beggar. Then have we here young Dizy, and young
Master Deep-vow, and Master Copperspur, and Master
Starve-lackey the rapier and dagger man, and young
Drop-heir that killed lusty Pudding, and Master
Forthlight the tilter, and brave Master Shooty the
great traveller, and wild Half-can that stabbed
Pots, and, I think, forty more; all great doers in
our trade, and are now ""for the Lord's sake.""",-0.9545,0.99567,-0.36586
measure-for-measure,Measure for Measure,main,4,3,13,758,stage_direction,,,Enter ABHORSON,0.0,0.97681,0.01275
measure-for-measure,Measure for Measure,main,4,3,13,759,speech,ABHORSON,ABHORSON,"Sirrah, bring Barnardine hither.",0.0,0.0134,0.31446
measure-for-measure,Measure for Measure,main,4,3,13,760,speech,POMPEY,POMPEY,"Master Barnardine! you must rise and be hanged.
Master Barnardine!",0.0,-0.99135,0.83328
measure-for-measure,Measure for Measure,main,4,3,13,761,speech,ABHORSON,ABHORSON,"What, ho, Barnardine!",0.0,0.99576,0.7513
measure-for-measure,Measure for Measure,main,4,3,13,762,speech,BARNARDINE,BARNARDINE,"[Within] A pox o' your throats! Who makes that
noise there? What are you?",-0.6312,-0.99814,-0.40443
measure-for-measure,Measure for Measure,main,4,3,13,763,speech,POMPEY,POMPEY,"Your friends, sir; the hangman. You must be so
good, sir, to rise and be put to death.",0.2263,-0.99572,-0.52715
measure-for-measure,Measure for Measure,main,4,3,13,764,speech,BARNARDINE,BARNARDINE,"[Within] Away, you rogue, away! I am sleepy.",0.0,-0.99654,0.58382
measure-for-measure,Measure for Measure,main,4,3,13,765,speech,ABHORSON,ABHORSON,"Tell him he must awake, and that quickly too.",0.0,0.97848,0.30592
measure-for-measure,Measure for Measure,main,4,3,13,766,speech,POMPEY,POMPEY,"Pray, Master Barnardine, awake till you are
executed, and sleep afterwards.",0.3182,0.96568,0.34992
measure-for-measure,Measure for Measure,main,4,3,13,767,speech,ABHORSON,ABHORSON,"Go in to him, and fetch him out.",0.0,-0.97621,-0.06109
measure-for-measure,Measure for Measure,main,4,3,13,768,speech,POMPEY,POMPEY,"He is coming, sir, he is coming; I hear his straw
rustle.",0.0,0.97896,0.52387
measure-for-measure,Measure for Measure,main,4,3,13,769,speech,ABHORSON,ABHORSON,"Is the axe upon the block, sirrah?",-0.4404,-0.98535,-0.01051
measure-for-measure,Measure for Measure,main,4,3,13,770,speech,POMPEY,POMPEY,"Very ready, sir.",0.3612,0.99043,0.46007
measure-for-measure,Measure for Measure,main,4,3,13,771,stage_direction,,,Enter BARNARDINE,0.0,0.9761,0.01115
measure-for-measure,Measure for Measure,main,4,3,13,772,speech,BARNARDINE,BARNARDINE,"How now, Abhorson? what's the news with you?",0.0,0.98778,-0.0109
measure-for-measure,Measure for Measure,main,4,3,13,773,speech,ABHORSON,ABHORSON,"Truly, sir, I would desire you to clap into your
prayers; for, look you, the warrant's come.",0.0,-0.98921,0.28082
measure-for-measure,Measure for Measure,main,4,3,13,774,speech,BARNARDINE,BARNARDINE,"You rogue, I have been drinking all night; I am not
fitted for 't.",-0.2755,-0.99837,-0.58281
measure-for-measure,Measure for Measure,main,4,3,13,775,speech,POMPEY,POMPEY,"O, the better, sir; for he that drinks all night,
and is hanged betimes in the morning, may sleep the
sounder all the next day.",0.7003,0.97897,0.06644
measure-for-measure,Measure for Measure,main,4,3,13,776,stage_direction,,,Enter DUKE VINCENTIO disguised as before,-0.2732,-0.98443,-0.00075
measure-for-measure,Measure for Measure,main,4,3,13,777,speech,ABHORSON,ABHORSON,"Look you, sir; here comes your ghostly father: do
we jest now, think you?",0.2263,-0.99023,0.60147
measure-for-measure,Measure for Measure,main,4,3,13,778,speech,DUKE VINCENTIO,DUKE VINCENTIO,"Sir, induced by my charity, and hearing how hastily
you are to depart, I am come to advise you, comfort
you and pray with you.",0.3818,0.99645,0.62214
measure-for-measure,Measure for Measure,main,4,3,13,779,speech,BARNARDINE,BARNARDINE,"Friar, not I. I have been drinking hard all night,
and I will have more time to prepare me, or they
shall beat out my brains with billets: I will not
consent to die this day, that's certain.",0.6636,-0.99707,-0.54283
measure-for-measure,Measure for Measure,main,4,3,13,780,speech,DUKE VINCENTIO,DUKE VINCENTIO,"O, sir, you must: and therefore I beseech you
Look forward on the journey you shall go.",0.0,-0.99402,0.3315
measure-for-measure,Measure for Measure,main,4,3,13,781,speech,BARNARDINE,BARNARDINE,"I swear I will not die to-day for any man's
persuasion.",0.4352,0.97576,-0.44475
measure-for-measure,Measure for Measure,main,4,3,13,782,speech,DUKE VINCENTIO,DUKE VINCENTIO,But hear you.,0.0,0.75024,-0.1095
measure-for-measure,Measure for Measure,main,4,3,13,783,speech,BARNARDINE,BARNARDINE,"Not a word: if you have any thing to say to me,
come to my ward; for thence will not I to-day.",0.0,-0.99826,-0.58184
measure-for-measure,Measure for Measure,main,4,3,13,784,stage_direction,,,Exit,0.0,-0.99615,0.01202
measure-for-measure,Measure for Measure,main,4,3,13,785,speech,DUKE VINCENTIO,DUKE VINCENTIO,"Unfit to live or die: O gravel heart!
After him, fellows; bring him to the block.",-0.1007,0.99166,-0.76933
measure-for-measure,Measure for Measure,main,4,3,13,786,stage_direction,,,Exeunt ABHORSON and POMPEY. Re-enter Provost.,0.0,0.94994,0.01958
measure-for-measure,Measure for Measure,main,4,3,13,787,speech,PROVOST,PROVOST,"Now, sir, how do you find the prisoner?",-0.5423,-0.82249,0.02992
measure-for-measure,Measure for Measure,main,4,3,13,788,speech,DUKE VINCENTIO,DUKE VINCENTIO,"A creature unprepared, unmeet for death;
And to transport him in the mind he is
Were damnable.",-0.918,-0.99881,-0.4779
measure-for-measure,Measure for Measure,main,4,3,13,789,speech,PROVOST,PROVOST,"Here in the prison, father,
There died this morning of a cruel fever
One Ragozine, a most notorious pirate,
A man of Claudio's years; his beard and head
Just of his colour. What if we do omit
This reprobate till he were well inclined;
And satisfy the deputy with the visage
Of Ragozine, more like to Claudio?",-0.7584,-0.97712,-0.69029
measure-for-measure,Measure for Measure,main,4,3,13,790,speech,DUKE VINCENTIO,DUKE VINCENTIO,"O , 'tis an accident that heaven provides!
Dispatch it presently; the hour draws on
Prefix'd by Angelo: see this be done,
And sent according to command; whiles I
Persuade this rude wretch willingly to die.",-0.7712,0.98225,0.39522
measure-for-measure,Measure for Measure,main,4,3,13,791,speech,PROVOST,PROVOST,"This shall be done, good father, presently.
But Barnardine must die this afternoon:
And how shall we continue Claudio,
To save me from the danger that might come
If he were known alive?",-0.765,-0.93757,-0.12422
measure-for-measure,Measure for Measure,main,4,3,13,792,speech,DUKE VINCENTIO,DUKE VINCENTIO,"Let this be done.
Put them in secret holds, both Barnardine and Claudio:
Ere twice the sun hath made his journal greeting
To the under generation, you shall find
Your safety manifested.",0.4927,0.98754,0.08772
measure-for-measure,Measure for Measure,main,4,3,13,793,speech,PROVOST,PROVOST,I am your free dependant.,0.0,0.99251,0.42627
measure-for-measure,Measure for Measure,main,4,3,13,794,speech,DUKE VINCENTIO,DUKE VINCENTIO,"Quick, dispatch, and send the head to Angelo.",0.0,0.98943,0.45536
measure-for-measure,Measure for Measure,main,4,3,13,795,stage_direction,,,Exit PROVOST,0.0,-0.99213,0.01375
measure-for-measure,Measure for Measure,main,4,3,13,796,speech,DUKE VINCENTIO,DUKE VINCENTIO,"Now will I write letters to Angelo,—
The provost, he shall bear them, whose contents
Shall witness to him I am near at home,
And that, by great injunctions, I am bound
To enter publicly: him I'll desire
To meet me at the consecrated fount
A league below the city; and from thence,
By cold gradation and well-balanced form,
We shall proceed with Angelo.",0.128,0.99288,0.53602
measure-for-measure,Measure for Measure,main,4,3,13,797,stage_direction,,,Re-enter Provost,0.0,-0.9826,0.03484
measure-for-measure,Measure for Measure,main,4,3,13,798,speech,PROVOST,PROVOST,Here is the head; I'll carry it myself.,0.0,-0.98189,0.35131
measure-for-measure,Measure for Measure,main,4,3,13,799,speech,DUKE VINCENTIO,DUKE VINCENTIO,"Convenient is it. Make a swift return;
For I would commune with you of such things
That want no ear but yours.",0.0772,0.99379,0.45894
measure-for-measure,Measure for Measure,main,4,3,13,800,speech,PROVOST,PROVOST,I'll make all speed.,0.0,0.99259,0.08084
measure-for-measure,Measure for Measure,main,4,3,13,801,stage_direction,,,Exit,0.0,-0.99615,0.01202
measure-for-measure,Measure for Measure,main,4,3,13,802,speech,ISABELLA,ISABELLA,"[Within] Peace, ho, be here!",0.6229,0.99687,0.76516
measure-for-measure,Measure for Measure,main,4,3,13,803,speech,DUKE VINCENTIO,DUKE VINCENTIO,"The tongue of Isabel. She's come to know
If yet her brother's pardon be come hither:
But I will keep her ignorant of her good,
To make her heavenly comforts of despair,
When it is least expected.",0.3818,-0.97677,0.23134
measure-for-measure,Measure for Measure,main,4,3,13,804,stage_direction,,,Enter ISABELLA,0.0,0.97466,0.00958
measure-for-measure,Measure for Measure,main,4,3,13,805,speech,ISABELLA,ISABELLA,"Ho, by your leave!",0.0,0.99102,0.0985
measure-for-measure,Measure for Measure,main,4,3,13,806,speech,DUKE VINCENTIO,DUKE VINCENTIO,"Good morning to you, fair and gracious daughter.",0.886,0.99768,0.44877
measure-for-measure,Measure for Measure,main,4,3,13,807,speech,ISABELLA,ISABELLA,"The better, given me by so holy a man.
Hath yet the deputy sent my brother's pardon?",0.6597,0.99377,-0.55746
measure-for-measure,Measure for Measure,main,4,3,13,808,speech,DUKE VINCENTIO,DUKE VINCENTIO,"He hath released him, Isabel, from the world:
His head is off and sent to Angelo.",-0.2732,0.92509,0.21407
measure-for-measure,Measure for Measure,main,4,3,13,809,speech,ISABELLA,ISABELLA,"Nay, but it is not so.",0.0,-0.98761,-0.3583
measure-for-measure,Measure for Measure,main,4,3,13,810,speech,DUKE VINCENTIO,DUKE VINCENTIO,"It is no other: show your wisdom, daughter,
In your close patience.",0.7351,0.99558,0.62141
measure-for-measure,Measure for Measure,main,4,3,13,811,speech,ISABELLA,ISABELLA,"O, I will to him and pluck out his eyes!",0.0,-0.99754,0.43085
measure-for-measure,Measure for Measure,main,4,3,13,812,speech,DUKE VINCENTIO,DUKE VINCENTIO,You shall not be admitted to his sight.,0.0,-0.99896,-0.39956
measure-for-measure,Measure for Measure,main,4,3,13,813,speech,ISABELLA,ISABELLA,"Unhappy Claudio! wretched Isabel!
Injurious world! most damned Angelo!",-0.9282,-0.99027,0.57768
measure-for-measure,Measure for Measure,main,4,3,13,814,speech,DUKE VINCENTIO,DUKE VINCENTIO,"This nor hurts him nor profits you a jot;
Forbear it therefore; give your cause to heaven.
Mark what I say, which you shall find
By every syllable a faithful verity:
The duke comes home to-morrow; nay, dry your eyes;
One of our convent, and his confessor,
Gives me this instance: already he hath carried
Notice to Escalus and Angelo,
Who do prepare to meet him at the gates,
There to give up their power. If you can, pace your
wisdom
In that good path that I would wish it go,
And you shall have your bosom on this wretch,
Grace of the duke, revenges to your heart,
And general honour.",0.417,-0.98733,-0.1206
measure-for-measure,Measure for Measure,main,4,3,13,815,speech,ISABELLA,ISABELLA,I am directed by you.,0.0,-0.98481,0.10743
measure-for-measure,Measure for Measure,main,4,3,13,816,speech,DUKE VINCENTIO,DUKE VINCENTIO,"This letter, then, to Friar Peter give;
'Tis that he sent me of the duke's return:
Say, by this token, I desire his company
At Mariana's house to-night. Her cause and yours
I'll perfect him withal, and he shall bring you
Before the duke, and to the head of Angelo
Accuse him home and home. For my poor self,
I am combined by a sacred vow
And shall be absent. Wend you with this letter:
Command these fretting waters from your eyes
With a light heart; trust not my holy order,
If I pervert your course. Who's here?",-0.6242,0.97648,0.67464
measure-for-measure,Measure for Measure,main,4,3,13,817,stage_direction,,,Enter LUCIO,0.0,0.97821,0.01067
measure-for-measure,Measure for Measure,main,4,3,13,818,speech,LUCIO,LUCIO,"Good even. Friar, where's the provost?",0.4404,0.99532,0.0595
measure-for-measure,Measure for Measure,main,4,3,13,819,speech,DUKE VINCENTIO,DUKE VINCENTIO,"Not within, sir.",0.0,-0.999,-0.48616
measure-for-measure,Measure for Measure,main,4,3,13,820,speech,LUCIO,LUCIO,"O pretty Isabella, I am pale at mine heart to see
thine eyes so red: thou must be patient. I am fain
to dine and sup with water and bran; I dare not for
my head fill my belly; one fruitful meal would set
me to 't. But they say the duke will be here
to-morrow. By my troth, Isabel, I loved thy brother:
if the old fantastical duke of dark corners had been
at home, he had lived.",0.8185,-0.99512,0.34507
measure-for-measure,Measure for Measure,main,4,3,13,821,stage_direction,,,Exit ISABELLA,0.0,-0.99529,0.0045
measure-for-measure,Measure for Measure,main,4,3,13,822,speech,DUKE VINCENTIO,DUKE VINCENTIO,"Sir, the duke is marvellous little beholding to your
reports; but the best is, he lives not in them.",0.4497,-0.99064,-0.53653
measure-for-measure,Measure for Measure,main,4,3,13,823,speech,LUCIO,LUCIO,"Friar, thou knowest not the duke so well as I do:
he's a better woodman than thou takest him for.",0.2732,0.93062,-0.39876
measure-for-measure,Measure for Measure,main,4,3,13,824,speech,DUKE VINCENTIO,DUKE VINCENTIO,"Well, you'll answer this one day. Fare ye well.",0.6486,0.99079,0.23218
measure-for-measure,Measure for Measure,main,4,3,13,825,speech,LUCIO,LUCIO,"Nay, tarry; I'll go along with thee
I can tell thee pretty tales of the duke.",0.4404,0.93991,0.31444
measure-for-measure,Measure for Measure,main,4,3,13,826,speech,DUKE VINCENTIO,DUKE VINCENTIO,"You have told me too many of him already, sir, if
they be true; if not true, none were enough.",0.12,-0.99895,-0.59994
measure-for-measure,Measure for Measure,main,4,3,13,827,speech,LUCIO,LUCIO,I was once before him for getting a wench with child.,0.0,-0.99793,-0.02396
measure-for-measure,Measure for Measure,main,4,3,13,828,speech,DUKE VINCENTIO,DUKE VINCENTIO,Did you such a thing?,0.0,-0.9985,-0.1083
measure-for-measure,Measure for Measure,main,4,3,13,829,speech,LUCIO,LUCIO,"Yes, marry, did I but I was fain to forswear it;
they would else have married me to the rotten medlar.",-0.5647,-0.99549,-0.41975
measure-for-measure,Measure for Measure,main,4,3,13,830,speech,DUKE VINCENTIO,DUKE VINCENTIO,"Sir, your company is fairer than honest. Rest you well.",0.7269,-0.98456,0.48313
measure-for-measure,Measure for Measure,main,4,3,13,831,speech,LUCIO,LUCIO,"By my troth, I'll go with thee to the lane's end:
if bawdy talk offend you, we'll have very little of
it. Nay, friar, I am a kind of burr; I shall stick.",-0.3818,0.99017,-0.41846
measure-for-measure,Measure for Measure,main,4,3,13,832,stage_direction,,,Exeunt,0.0,-0.98874,-0.13698
measure-for-measure,Measure for Measure,main,4,4,14,833,stage_direction,,,Enter ANGELO and ESCALUS,0.0,0.9881,0.10948
measure-for-measure,Measure for Measure,main,4,4,14,834,speech,ESCALUS,ESCALUS,Every letter he hath writ hath disvouched other.,-0.3182,-0.99898,-0.15112
measure-for-measure,Measure for Measure,main,4,4,14,835,speech,ANGELO,ANGELO,"In most uneven and distracted manner. His actions
show much like to madness: pray heaven his wisdom be
not tainted! And why meet him at the gates, and
redeliver our authorities there?",0.5966,-0.99893,-0.58099
measure-for-measure,Measure for Measure,main,4,4,14,836,speech,ESCALUS,ESCALUS,I guess not.,-0.296,-0.99891,-0.56214
measure-for-measure,Measure for Measure,main,4,4,14,837,speech,ANGELO,ANGELO,"And why should we proclaim it in an hour before his
entering, that if any crave redress of injustice,
they should exhibit their petitions in the street?",0.0,-0.999,-0.21802
measure-for-measure,Measure for Measure,main,4,4,14,838,speech,ESCALUS,ESCALUS,"He shows his reason for that: to have a dispatch of
complaints, and to deliver us from devices
hereafter, which shall then have no power to stand
against us.",-0.169,-0.95613,0.32321
measure-for-measure,Measure for Measure,main,4,4,14,839,speech,ANGELO,ANGELO,"Well, I beseech you, let it be proclaimed betimes
i' the morn; I 'll call you at your house: give
notice to such men of sort and suit as are to meet
him.",0.5574,0.98904,0.13248
measure-for-measure,Measure for Measure,main,4,4,14,840,speech,ESCALUS,ESCALUS,"I shall, sir. Fare you well.",0.0,-0.97605,0.71032
measure-for-measure,Measure for Measure,main,4,4,14,841,speech,ANGELO,ANGELO,Good night.,0.4404,0.99754,0.27984
measure-for-measure,Measure for Measure,main,4,4,14,842,stage_direction,,,Exit ESCALUS,0.0,-0.99417,0.01782
