play_id,play_title,section,act,scene,scene_index_in_play,unit_index_in_play,type,speaker_original,speaker_normalized,original_text,vader_score,dl_score,dl2_score
richard-ii,Richard II,main,1,1,1,1,stage_direction,,,"Enter KING RICHARD II, JOHN OF GAUNT, with other Nobles and Attendants",0.0,0.98767,0.15536
richard-ii,Richard II,main,1,1,1,2,speech,KING RICHARD II,KING RICHARD II,"Old John of Gaunt, time-honour'd Lancaster,
Hast thou, according to thy oath and band,
Brought hither Henry Hereford thy bold son,
Here to make good the boisterous late appeal,
Which then our leisure would not let us hear,
Against the Duke of Norfolk, Thomas Mowbray?",0.3182,-0.9801,0.08091
richard-ii,Richard II,main,1,1,1,3,speech,JOHN OF GAUNT,JOHN OF GAUNT,"I have, my liege.",0.0,0.98432,-0.31817
richard-ii,Richard II,main,1,1,1,4,speech,KING RICHARD II,KING RICHARD II,"Tell me, moreover, hast thou sounded him,
If he appeal the duke on ancient malice;
Or worthily, as a good subject should,
On some known ground of treachery in him?",-0.1779,-0.99334,-0.43571
richard-ii,Richard II,main,1,1,1,5,speech,JOHN OF GAUNT,JOHN OF GAUNT,"As near as I could sift him on that argument,
On some apparent danger seen in him
Aim'd at your highness, no inveterate malice.",-0.7003,-0.96476,-0.58979
richard-ii,Richard II,main,1,1,1,6,speech,KING RICHARD II,KING RICHARD II,"Then call them to our presence; face to face,
And frowning brow to brow, ourselves will hear
The accuser and the accused freely speak :
High-stomach'd are they both, and full of ire,
In rage deaf as the sea, hasty as fire.",-0.8126,0.99258,0.06702
richard-ii,Richard II,main,1,1,1,7,stage_direction,,,Enter HENRY BOLINGBROKE and THOMAS MOWBRAY,0.0,0.97234,0.26598
richard-ii,Richard II,main,1,1,1,8,speech,HENRY BOLINGBROKE,HENRY BOLINGBROKE,"Many years of happy days befal
My gracious sovereign, my most loving liege!",0.9133,0.99743,0.88318
richard-ii,Richard II,main,1,1,1,9,speech,THOMAS MOWBRAY,THOMAS MOWBRAY,"Each day still better other's happiness ;
Until the heavens, envying earth's good hap,
Add an immortal title to your crown!",0.5719,0.99495,0.64946
richard-ii,Richard II,main,1,1,1,10,speech,KING RICHARD II,KING RICHARD II,"We thank you both: yet one but flatters us,
As well appeareth by the cause you come;
Namely to appeal each other of high treason.
Cousin of Hereford, what dost thou object
Against the Duke of Norfolk, Thomas Mowbray?",-0.3818,-0.99294,-0.71831
richard-ii,Richard II,main,1,1,1,11,speech,HENRY BOLINGBROKE,HENRY BOLINGBROKE,"First, heaven be the record to my speech!
In the devotion of a subject's love,
Tendering the precious safety of my prince,
And free from other misbegotten hate,
Come I appellant to this princely presence.
Now, Thomas Mowbray, do I turn to thee,
And mark my greeting well; for what I speak
My body shall make good upon this earth,
Or my divine soul answer it in heaven.
Thou art a traitor and a miscreant,
Too good to be so and too bad to live,
Since the more fair and crystal is the sky,
The uglier seem the clouds that in it fly.
Once more, the more to aggravate the note,
With a foul traitor's name stuff I thy throat;
And wish, so please my sovereign, ere I move,
What my tongue speaks my right drawn sword may prove.",0.9483,0.9723,0.63584
richard-ii,Richard II,main,1,1,1,12,speech,THOMAS MOWBRAY,THOMAS MOWBRAY,"Let not my cold words here accuse my zeal:
'Tis not the trial of a woman's war,
The bitter clamour of two eager tongues,
Can arbitrate this cause betwixt us twain;
The blood is hot that must be cool'd for this:
Yet can I not of such tame patience boast
As to be hush'd and nought at all to say:
First, the fair reverence of your highness curbs me
From giving reins and spurs to my free speech;
Which else would post until it had return'd
These terms of treason doubled down his throat.
Setting aside his high blood's royalty,
And let him be no kinsman to my liege,
I do defy him, and I spit at him;
Call him a slanderous coward and a villain:
Which to maintain I would allow him odds,
And meet him, were I tied to run afoot
Even to the frozen ridges of the Alps,
Or any other ground inhabitable,
Where ever Englishman durst set his foot.
Mean time let this defend my loyalty,
By all my hopes, most falsely doth he lie.",-0.9474,-0.9893,-0.43509
richard-ii,Richard II,main,1,1,1,13,speech,HENRY BOLINGBROKE,HENRY BOLINGBROKE,"Pale trembling coward, there I throw my gage,
Disclaiming here the kindred of the king,
And lay aside my high blood's royalty,
Which fear, not reverence, makes thee to except.
If guilty dread have left thee so much strength
As to take up mine honour's pawn, then stoop:
By that and all the rites of knighthood else,
Will I make good against thee, arm to arm,
What I have spoke, or thou canst worse devise.",-0.974,-0.99363,-0.0892
richard-ii,Richard II,main,1,1,1,14,speech,THOMAS MOWBRAY,THOMAS MOWBRAY,"I take it up; and by that sword I swear
Which gently laid my knighthood on my shoulder,
I'll answer thee in any fair degree,
Or chivalrous design of knightly trial:
And when I mount, alive may I not light,
If I be traitor or unjustly fight!",-0.1511,0.99349,0.64378
richard-ii,Richard II,main,1,1,1,15,speech,KING RICHARD II,KING RICHARD II,"What doth our cousin lay to Mowbray's charge?
It must be great that can inherit us
So much as of a thought of ill in him.",-0.8977,-0.97766,-0.68614
richard-ii,Richard II,main,1,1,1,16,speech,HENRY BOLINGBROKE,HENRY BOLINGBROKE,"Look, what I speak, my life shall prove it true;
That Mowbray hath received eight thousand nobles
In name of lendings for your highness' soldiers,
The which he hath detain'd for lewd employments,
Like a false traitor and injurious villain.
Besides I say and will in battle prove,
Or here or elsewhere to the furthest verge
That ever was survey'd by English eye,
That all the treasons for these eighteen years
Complotted and contrived in this land
Fetch from false Mowbray their first head and spring.
Further I say and further will maintain
Upon his bad life to make all this good,
That he did plot the Duke of Gloucester's death,
Suggest his soon-believing adversaries,
And consequently, like a traitor coward,
Sluiced out his innocent soul through streams of blood:
Which blood, like sacrificing Abel's, cries,
Even from the tongueless caverns of the earth,
To me for justice and rough chastisement;
And, by the glorious worth of my descent,
This arm shall do it, or this life be spent.",-0.9136,0.93189,-0.25498
richard-ii,Richard II,main,1,1,1,17,speech,KING RICHARD II,KING RICHARD II,"How high a pitch his resolution soars!
Thomas of Norfolk, what say'st thou to this?",0.4574,0.99665,0.66924
richard-ii,Richard II,main,1,1,1,18,speech,THOMAS MOWBRAY,THOMAS MOWBRAY,"O, let my sovereign turn away his face
And bid his ears a little while be deaf,
Till I have told this slander of his blood,
How God and good men hate so foul a liar.",-0.4854,-0.99648,-0.80283
richard-ii,Richard II,main,1,1,1,19,speech,KING RICHARD II,KING RICHARD II,"Mowbray, impartial are our eyes and ears:
Were he my brother, nay, my kingdom's heir,
As he is but my father's brother's son,
Now, by my sceptre's awe, I make a vow,
Such neighbour nearness to our sacred blood
Should nothing privilege him, nor partialize
The unstooping firmness of my upright soul:
He is our subject, Mowbray; so art thou:
Free speech and fearless I to thee allow.",0.8818,0.99592,0.60393
richard-ii,Richard II,main,1,1,1,20,speech,THOMAS MOWBRAY,THOMAS MOWBRAY,"Then, Bolingbroke, as low as to thy heart,
Through the false passage of thy throat, thou liest.
Three parts of that receipt I had for Calais
Disbursed I duly to his highness' soldiers;
The other part reserved I by consent,
For that my sovereign liege was in my debt
Upon remainder of a dear account,
Since last I went to France to fetch his queen:
Now swallow down that lie. For Gloucester's death,
I slew him not; but to my own disgrace
Neglected my sworn duty in that case.
For you, my noble Lord of Lancaster,
The honourable father to my foe
Once did I lay an ambush for your life,
A trespass that doth vex my grieved soul
But ere I last received the sacrament
I did confess it, and exactly begg'd
Your grace's pardon, and I hope I had it.
This is my fault: as for the rest appeall'd,
It issues from the rancour of a villain,
A recreant and most degenerate traitor
Which in myself I boldly will defend;
And interchangeably hurl down my gage
Upon this overweening traitor's foot,
To prove myself a loyal gentleman
Even in the best blood chamber'd in his bosom.
In haste whereof, most heartily I pray
Your highness to assign our trial day.",0.9213,0.96989,0.56663
richard-ii,Richard II,main,1,1,1,21,speech,KING RICHARD II,KING RICHARD II,"Wrath-kindled gentlemen, be ruled by me;
Let's purge this choler without letting blood:
This we prescribe, though no physician;
Deep malice makes too deep incision;
Forget, forgive; conclude and be agreed;
Our doctors say this is no month to bleed.
Good uncle, let this end where it begun;
We'll calm the Duke of Norfolk, you your son.",-0.8776,0.9937,-0.30796
richard-ii,Richard II,main,1,1,1,22,speech,JOHN OF GAUNT,JOHN OF GAUNT,"To be a make-peace shall become my age:
Throw down, my son, the Duke of Norfolk's gage.",0.4588,0.99131,0.4094
richard-ii,Richard II,main,1,1,1,23,speech,KING RICHARD II,KING RICHARD II,"And, Norfolk, throw down his.",0.0,-0.99726,-0.21999
richard-ii,Richard II,main,1,1,1,24,speech,JOHN OF GAUNT,JOHN OF GAUNT,"When, Harry, when?
Obedience bids I should not bid again.",0.0,-0.98235,-0.34148
richard-ii,Richard II,main,1,1,1,25,speech,KING RICHARD II,KING RICHARD II,"Norfolk, throw down, we bid; there is no boot.",0.015,-0.98934,-0.0761
richard-ii,Richard II,main,1,1,1,26,speech,THOMAS MOWBRAY,THOMAS MOWBRAY,"Myself I throw, dread sovereign, at thy foot.
My life thou shalt command, but not my shame:
The one my duty owes; but my fair name,
Despite of death that lives upon my grave,
To dark dishonour's use thou shalt not have.
I am disgraced, impeach'd and baffled here,
Pierced to the soul with slander's venom'd spear,
The which no balm can cure but his heart-blood
Which breathed this poison.",-0.9781,-0.996,-0.81885
richard-ii,Richard II,main,1,1,1,27,speech,KING RICHARD II,KING RICHARD II,"Rage must be withstood:
Give me his gage: lions make leopards tame.",-0.5574,-0.95238,0.2489
richard-ii,Richard II,main,1,1,1,28,speech,THOMAS MOWBRAY,THOMAS MOWBRAY,"Yea, but not change his spots: take but my shame.
And I resign my gage. My dear dear lord,
The purest treasure mortal times afford
Is spotless reputation: that away,
Men are but gilded loam or painted clay.
A jewel in a ten-times-barr'd-up chest
Is a bold spirit in a loyal breast.
Mine honour is my life; both grow in one:
Take honour from me, and my life is done:
Then, dear my liege, mine honour let me try;
In that I live and for that will I die.",0.9936,0.98095,0.69783
richard-ii,Richard II,main,1,1,1,29,speech,KING RICHARD II,KING RICHARD II,"Cousin, throw up your gage; do you begin.",0.0,-0.99831,-0.56278
richard-ii,Richard II,main,1,1,1,30,speech,HENRY BOLINGBROKE,HENRY BOLINGBROKE,"O, God defend my soul from such deep sin!
Shall I seem crest-fall'n in my father's sight?
Or with pale beggar-fear impeach my height
Before this out-dared dastard? Ere my tongue
Shall wound my honour with such feeble wrong,
Or sound so base a parle, my teeth shall tear
The slavish motive of recanting fear,
And spit it bleeding in his high disgrace,
Where shame doth harbour, even in Mowbray's face.",-0.9224,-0.99887,-0.39382
richard-ii,Richard II,main,1,1,1,31,stage_direction,,,Exit JOHN OF GAUNT,0.0,-0.9928,0.0068
richard-ii,Richard II,main,1,1,1,32,speech,KING RICHARD II,KING RICHARD II,"We were not born to sue, but to command;
Which since we cannot do to make you friends,
Be ready, as your lives shall answer it,
At Coventry, upon Saint Lambert's day:
There shall your swords and lances arbitrate
The swelling difference of your settled hate:
Since we can not atone you, we shall see
Justice design the victor's chivalry.
Lord marshal, command our officers at arms
Be ready to direct these home alarms.",-0.7985,-0.97389,-0.32023
richard-ii,Richard II,main,1,1,1,33,stage_direction,,,Exeunt,0.0,-0.98674,0.07284
richard-ii,Richard II,main,1,2,2,34,stage_direction,,,Enter JOHN OF GAUNT with DUCHESS,0.0,0.75826,0.01458
richard-ii,Richard II,main,1,2,2,35,speech,JOHN OF GAUNT,JOHN OF GAUNT,"Alas, the part I had in Woodstock's blood
Doth more solicit me than your exclaims,
To stir against the butchers of his life!
But since correction lieth in those hands
Which made the fault that we cannot correct,
Put we our quarrel to the will of heaven;
Who, when they see the hours ripe on earth,
Will rain hot vengeance on offenders' heads.",-0.8374,-0.78208,0.83026
richard-ii,Richard II,main,1,2,2,36,speech,DUCHESS,DUCHESS,"Finds brotherhood in thee no sharper spur?
Hath love in thy old blood no living fire?
Edward's seven sons, whereof thyself art one,
Were as seven vials of his sacred blood,
Or seven fair branches springing from one root:
Some of those seven are dried by nature's course,
Some of those branches by the Destinies cut;
But Thomas, my dear lord, my life, my Gloucester,
One vial full of Edward's sacred blood,
One flourishing branch of his most royal root,
Is crack'd, and all the precious liquor spilt,
Is hack'd down, and his summer leaves all faded,
By envy's hand and murder's bloody axe.
Ah, Gaunt, his blood was thine! that bed, that womb,
That metal, that self-mould, that fashion'd thee
Made him a man ; and though thou livest and breathest,
Yet art thou slain in him: thou dost consent
In some large measure to thy father's death,
In that thou seest thy wretched brother die,
Who was the model of thy father's life.
Call it not patience, Gaunt; it is despair:
In suffering thus thy brother to be slaughter'd,
Thou showest the naked pathway to thy life,
Teaching stern murder how to butcher thee:
That which in mean men we intitle patience
Is pale cold cowardice in noble breasts.
What shall I say? to safeguard thine own life,
The best way is to venge my Gloucester's death.",-0.9886,-0.98539,-0.8705
richard-ii,Richard II,main,1,2,2,37,speech,JOHN OF GAUNT,JOHN OF GAUNT,"God's is the quarrel; for God's substitute,
His deputy anointed in His sight,
Hath caused his death: the which if wrongfully,
Let heaven revenge; for I may never lift
An angry arm against His minister.",-0.7905,0.95389,-0.88849
richard-ii,Richard II,main,1,2,2,38,speech,DUCHESS,DUCHESS,"Where then, alas, may I complain myself?",0.4019,-0.98638,-0.05119
richard-ii,Richard II,main,1,2,2,39,speech,JOHN OF GAUNT,JOHN OF GAUNT,"To God, the widow's champion and defence.",0.7506,0.99205,0.69963
richard-ii,Richard II,main,1,2,2,40,speech,DUCHESS,DUCHESS,"Why, then, I will. Farewell, old Gaunt.
Thou goest to Coventry, there to behold
Our cousin Hereford and fell Mowbray fight:
O, sit my husband's wrongs on Hereford's spear,
That it may enter butcher Mowbray's breast!
Or, if misfortune miss the first career,
Be Mowbray's sins so heavy in his bosom,
They may break his foaming courser's back,
And throw the rider headlong in the lists,
A caitiff recreant to my cousin Hereford!
Farewell, old Gaunt: thy sometimes brother's wife
With her companion grief must end her life.",-0.9412,-0.98482,0.04675
richard-ii,Richard II,main,1,2,2,41,speech,JOHN OF GAUNT,JOHN OF GAUNT,"Sister, farewell; I must to Coventry:
As much good stay with thee as go with me!",0.7088,0.99707,0.78202
richard-ii,Richard II,main,1,2,2,42,speech,DUCHESS,DUCHESS,"Yet one word more: grief boundeth where it falls,
Not with the empty hollowness, but weight:
I take my leave before I have begun,
For sorrow ends not when it seemeth done.
Commend me to thy brother, Edmund York.
Lo, this is all:—nay, yet depart not so;
Though this be all, do not so quickly go;
I shall remember more. Bid him—ah, what?—
With all good speed at Plashy visit me.
Alack, and what shall good old York there see
But empty lodgings and unfurnish'd walls,
Unpeopled offices, untrodden stones?
And what hear there for welcome but my groans?
Therefore commend me; let him not come there,
To seek out sorrow that dwells every where.
Desolate, desolate, will I hence and die:
The last leave of thee takes my weeping eye.",-0.9726,-0.99297,-0.87477
richard-ii,Richard II,main,1,2,2,43,stage_direction,,,Exeunt,0.0,-0.98674,0.07284
richard-ii,Richard II,main,1,3,3,44,stage_direction,,,Enter the Lord Marshal and the DUKE OF AUMERLE,0.0,-0.96864,0.20166
richard-ii,Richard II,main,1,3,3,45,speech,LORD MARSHAL,LORD MARSHAL,"My Lord Aumerle, is Harry Hereford arm'd?",-0.0258,0.98908,0.40291
richard-ii,Richard II,main,1,3,3,46,speech,DUKE OF AUMERLE,DUKE OF AUMERLE,"Yea, at all points; and longs to enter in.",0.4364,0.99702,-0.11437
richard-ii,Richard II,main,1,3,3,47,speech,LORD MARSHAL,LORD MARSHAL,"The Duke of Norfolk, sprightfully and bold,
Stays but the summons of the appellant's trumpet.",-0.7351,0.98189,-0.18677
richard-ii,Richard II,main,1,3,3,48,speech,DUKE OF AUMERLE,DUKE OF AUMERLE,"Why, then, the champions are prepared, and stay
For nothing but his majesty's approach.",0.6486,-0.93151,-0.1155
richard-ii,Richard II,main,1,3,3,49,stage_direction,,,"The trumpets sound, and KING RICHARD enters with his nobles, JOHN OF GAUNT, BUSHY, BAGOT, GREEN, and others. When they are set, enter THOMAS MOWBRAY in arms, defendant, with a Herald",0.0,-0.00747,0.05326
richard-ii,Richard II,main,1,3,3,50,speech,KING RICHARD II,KING RICHARD II,"Marshal, demand of yonder champion
The cause of his arrival here in arms:
Ask him his name and orderly proceed
To swear him in the justice of his cause.",0.5719,-0.99735,-0.20082
richard-ii,Richard II,main,1,3,3,51,speech,LORD MARSHAL,LORD MARSHAL,"In God's name and the king's, say who thou art
And why thou comest thus knightly clad in arms,
Against what man thou comest, and what thy quarrel:
Speak truly, on thy knighthood and thy oath;
As so defend thee heaven and thy valour!",0.9565,0.99609,0.77798
richard-ii,Richard II,main,1,3,3,52,speech,THOMAS MOWBRAY,THOMAS MOWBRAY,"My name is Thomas Mowbray, Duke of Norfolk;
Who hither come engaged by my oath—
Which God defend a knight should violate!—
Both to defend my loyalty and truth
To God, my king and my succeeding issue,
Against the Duke of Hereford that appeals me
And, by the grace of God and this mine arm,
To prove him, in defending of myself,
A traitor to my God, my king, and me:
And as I truly fight, defend me heaven!",0.9632,0.99359,0.82979
richard-ii,Richard II,main,1,3,3,53,stage_direction,,,"The trumpets sound. Enter HENRY BOLINGBROKE, appellant, in armour, with a Herald",0.0,-0.91398,0.04753
richard-ii,Richard II,main,1,3,3,54,speech,KING RICHARD II,KING RICHARD II,"Marshal, ask yonder knight in arms,
Both who he is and why he cometh hither
Thus plated in habiliments of war,
And formally, according to our law,
Depose him in the justice of his cause.",-0.2263,-0.99322,-0.07247
richard-ii,Richard II,main,1,3,3,55,speech,LORD MARSHAL,LORD MARSHAL,"What is thy name? and wherefore comest thou hither,
Before King Richard in his royal lists?
Against whom comest thou? and what's thy quarrel?
Speak like a true knight, so defend thee heaven!",0.8559,-0.97901,0.72265
richard-ii,Richard II,main,1,3,3,56,speech,HENRY BOLINGBROKE,HENRY BOLINGBROKE,"Harry of Hereford, Lancaster and Derby
Am I; who ready here do stand in arms,
To prove, by God's grace and my body's valour,
In lists, on Thomas Mowbray, Duke of Norfolk,
That he is a traitor, foul and dangerous,
To God of heaven, King Richard and to me;
And as I truly fight, defend me heaven!",0.9117,0.98961,0.76796
richard-ii,Richard II,main,1,3,3,57,speech,LORD MARSHAL,LORD MARSHAL,"On pain of death, no person be so bold
Or daring-hardy as to touch the lists,
Except the marshal and such officers
Appointed to direct these fair designs.",-0.7213,-0.97814,-0.04059
richard-ii,Richard II,main,1,3,3,58,speech,HENRY BOLINGBROKE,HENRY BOLINGBROKE,"Lord marshal, let me kiss my sovereign's hand,
And bow my knee before his majesty:
For Mowbray and myself are like two men
That vow a long and weary pilgrimage;
Then let us take a ceremonious leave
And loving farewell of our several friends.",0.9382,0.99343,0.67112
richard-ii,Richard II,main,1,3,3,59,speech,LORD MARSHAL,LORD MARSHAL,"The appellant in all duty greets your highness,
And craves to kiss your hand and take his leave.",0.9217,0.9952,0.66341
richard-ii,Richard II,main,1,3,3,60,speech,KING RICHARD II,KING RICHARD II,"We will descend and fold him in our arms.
Cousin of Hereford, as thy cause is right,
So be thy fortune in this royal fight!
Farewell, my blood; which if to-day thou shed,
Lament we may, but not revenge thee dead.",0.4226,0.99504,0.72305
richard-ii,Richard II,main,1,3,3,61,speech,HENRY BOLINGBROKE,HENRY BOLINGBROKE,"O let no noble eye profane a tear
For me, if I be gored with Mowbray's spear:
As confident as is the falcon's flight
Against a bird, do I with Mowbray fight.
My loving lord, I take my leave of you;
Of you, my noble cousin, Lord Aumerle;
Not sick, although I have to do with death,
But lusty, young, and cheerly drawing breath.
Lo, as at English feasts, so I regret
The daintiest last, to make the end most sweet:
O thou, the earthly author of my blood,
Whose youthful spirit, in me regenerate,
Doth with a twofold vigour lift me up
To reach at victory above my head,
Add proof unto mine armour with thy prayers;
And with thy blessings steel my lance's point,
That it may enter Mowbray's waxen coat,
And furnish new the name of John a Gaunt,
Even in the lusty havior of his son.",0.9809,0.99592,0.78615
richard-ii,Richard II,main,1,3,3,62,speech,JOHN OF GAUNT,JOHN OF GAUNT,"God in thy good cause make thee prosperous!
Be swift like lightning in the execution;
And let thy blows, doubly redoubled,
Fall like amazing thunder on the casque
Of thy adverse pernicious enemy:
Rouse up thy youthful blood, be valiant and live.",0.8908,0.99644,0.65958
richard-ii,Richard II,main,1,3,3,63,speech,HENRY BOLINGBROKE,HENRY BOLINGBROKE,Mine innocency and Saint George to thrive!,0.7712,0.99632,0.65575
richard-ii,Richard II,main,1,3,3,64,speech,THOMAS MOWBRAY,THOMAS MOWBRAY,"However God or fortune cast my lot,
There lives or dies, true to King Richard's throne,
A loyal, just and upright gentleman:
Never did captive with a freer heart
Cast off his chains of bondage and embrace
His golden uncontroll'd enfranchisement,
More than my dancing soul doth celebrate
This feast of battle with mine adversary.
Most mighty liege, and my companion peers,
Take from my mouth the wish of happy years:
As gentle and as jocund as to jest
Go I to fight: truth hath a quiet breast.",0.9851,0.99729,0.8092
richard-ii,Richard II,main,1,3,3,65,speech,KING RICHARD II,KING RICHARD II,"Farewell, my lord: securely I espy
Virtue with valour couched in thine eye.
Order the trial, marshal, and begin.",0.5267,0.98767,0.69241
richard-ii,Richard II,main,1,3,3,66,speech,LORD MARSHAL,LORD MARSHAL,"Harry of Hereford, Lancaster and Derby,
Receive thy lance; and God defend the right!",0.5848,0.986,0.67818
richard-ii,Richard II,main,1,3,3,67,speech,HENRY BOLINGBROKE,HENRY BOLINGBROKE,"Strong as a tower in hope, I cry amen.",0.4588,0.99692,0.6448
richard-ii,Richard II,main,1,3,3,68,speech,LORD MARSHAL,LORD MARSHAL,"Go bear this lance to Thomas, Duke of Norfolk.",0.0,0.9878,0.06928
richard-ii,Richard II,main,1,3,3,69,speech,FIRST HERALD,FIRST HERALD,"Harry of Hereford, Lancaster and Derby,
Stands here for God, his sovereign and himself,
On pain to be found false and recreant,
To prove the Duke of Norfolk, Thomas Mowbray,
A traitor to his God, his king and him;
And dares him to set forward to the fight.",-0.34,0.98844,0.07833
richard-ii,Richard II,main,1,3,3,70,speech,SECOND HERALD,SECOND HERALD,"Here standeth Thomas Mowbray, Duke of Norfolk,
On pain to be found false and recreant,
Both to defend himself and to approve
Henry of Hereford, Lancaster, and Derby,
To God, his sovereign and to him disloyal;
Courageously and with a free desire
Attending but the signal to begin.",0.5719,0.99196,0.18249
richard-ii,Richard II,main,1,3,3,71,stage_direction,,,"Sound, trumpets; and set forward, combatants.",0.0,0.98846,0.24671
richard-ii,Richard II,main,1,3,3,72,stage_direction,,,A charge sounded,0.0,0.98621,0.04798
richard-ii,Richard II,main,1,3,3,73,speech,LORD MARSHAL,LORD MARSHAL,"Stay, the king hath thrown his warder down.",-0.3595,-0.99349,-0.56293
richard-ii,Richard II,main,1,3,3,74,speech,KING RICHARD II,KING RICHARD II,"Let them lay by their helmets and their spears,
And both return back to their chairs again:
Withdraw with us: and let the trumpets sound
While we return these dukes what we decree.",0.0,0.99442,0.01639
richard-ii,Richard II,main,1,3,3,75,stage_direction,,,A long flourish,0.0,0.98307,0.04621
richard-ii,Richard II,main,1,3,3,76,speech,KING RICHARD II,KING RICHARD II,"Draw near,
And list what with our council we have done.
For that our kingdom's earth should not be soil'd
With that dear blood which it hath fostered;
And for our eyes do hate the dire aspect
Of civil wounds plough'd up with neighbours' sword;
And for we think the eagle-winged pride
Of sky-aspiring and ambitious thoughts,
With rival-hating envy, set on you
To wake our peace, which in our country's cradle
Draws the sweet infant breath of gentle sleep;
Which so roused up with boisterous untuned drums,
With harsh resounding trumpets' dreadful bray,
And grating shock of wrathful iron arms,
Might from our quiet confines fright fair peace
And make us wade even in our kindred's blood,
Therefore, we banish you our territories:
You, cousin Hereford, upon pain of life,
Till twice five summers have enrich'd our fields
Shall not regreet our fair dominions,
But tread the stranger paths of banishment.",-0.936,-0.95415,-0.64397
