play_id,play_title,section,act,scene,scene_index_in_play,unit_index_in_play,type,speaker_original,speaker_normalized,original_text,vader_score,dl_score,dl2_score
richard-ii,Richard II,main,4,1,13,438,speech,BISHOP OF CARLISLE,BISHOP OF CARLISLE,"That honourable day shall ne'er be seen.
Many a time hath banish'd Norfolk fought
For Jesu Christ in glorious Christian field,
Streaming the ensign of the Christian cross
Against black pagans, Turks, and Saracens:
And toil'd with works of war, retired himself
To Italy; and there at Venice gave
His body to that pleasant country's earth,
And his pure soul unto his captain Christ,
Under whose colours he had fought so long.",-0.5994,0.99447,0.39096
richard-ii,Richard II,main,4,1,13,439,speech,HENRY BOLINGBROKE,HENRY BOLINGBROKE,"Why, bishop, is Norfolk dead?",-0.6486,-0.99496,-0.57544
richard-ii,Richard II,main,4,1,13,440,speech,BISHOP OF CARLISLE,BISHOP OF CARLISLE,"As surely as I live, my lord.",-0.4019,-0.99029,-0.76264
richard-ii,Richard II,main,4,1,13,441,speech,HENRY BOLINGBROKE,HENRY BOLINGBROKE,"Sweet peace conduct his sweet soul to the bosom
Of good old Abraham! Lords appellants,
Your differences shall all rest under gage
Till we assign you to your days of trial.",0.8832,0.99431,0.79022
richard-ii,Richard II,main,4,1,13,442,stage_direction,,,"Enter DUKE OF YORK, attended",0.0,0.98756,0.03937
richard-ii,Richard II,main,4,1,13,443,speech,DUKE OF YORK,DUKE OF YORK,"Great Duke of Lancaster, I come to thee
From plume-pluck'd Richard; who with willing soul
Adopts thee heir, and his high sceptre yields
To the possession of thy royal hand:
Ascend his throne, descending now from him;
And long live Henry, fourth of that name!",0.6588,0.99585,0.85379
richard-ii,Richard II,main,4,1,13,444,speech,HENRY BOLINGBROKE,HENRY BOLINGBROKE,"In God's name, I'll ascend the regal throne.",0.0,0.98883,0.3922
richard-ii,Richard II,main,4,1,13,445,speech,BISHOP OF CARLISLE,BISHOP OF CARLISLE,"Marry. God forbid!
Worst in this royal presence may I speak,
Yet best beseeming me to speak the truth.
Would God that any in this noble presence
Were enough noble to be upright judge
Of noble Richard! then true noblesse would
Learn him forbearance from so foul a wrong.
What subject can give sentence on his king?
And who sits here that is not Richard's subject?
Thieves are not judged but they are by to hear,
Although apparent guilt be seen in them;
And shall the figure of God's majesty,
His captain, steward, deputy-elect,
Anointed, crowned, planted many years,
Be judged by subject and inferior breath,
And he himself not present? O, forfend it, God,
That in a Christian climate souls refined
Should show so heinous, black, obscene a deed!
I speak to subjects, and a subject speaks,
Stirr'd up by God, thus boldly for his king:
My Lord of Hereford here, whom you call king,
Is a foul traitor to proud Hereford's king:
And if you crown him, let me prophesy:
The blood of English shall manure the ground,
And future ages groan for this foul act;
Peace shall go sleep with Turks and infidels,
And in this seat of peace tumultuous wars
Shall kin with kin and kind with kind confound;
Disorder, horror, fear and mutiny
Shall here inhabit, and this land be call'd
The field of Golgotha and dead men's skulls.
O, if you raise this house against this house,
It will the woefullest division prove
That ever fell upon this cursed earth.
Prevent it, resist it, let it not be so,
Lest child, child's children, cry against you woe!",-0.9952,-0.98073,-0.61107
richard-ii,Richard II,main,4,1,13,446,speech,NORTHUMBERLAND,NORTHUMBERLAND,"Well have you argued, sir; and, for your pains,
Of capital treason we arrest you here.
My Lord of Westminster, be it your charge
To keep him safely till his day of trial.
May it please you, lords, to grant the commons' suit.",-0.2263,-0.97368,-0.13487
richard-ii,Richard II,main,4,1,13,447,speech,HENRY BOLINGBROKE,HENRY BOLINGBROKE,"Fetch hither Richard, that in common view
He may surrender; so we shall proceed
Without suspicion.",0.1326,-0.97614,0.11776
richard-ii,Richard II,main,4,1,13,448,speech,DUKE OF YORK,DUKE OF YORK,I will be his conduct.,0.0,-0.78194,0.35993
richard-ii,Richard II,main,4,1,13,449,stage_direction,,,Exit,0.0,-0.99277,0.00658
richard-ii,Richard II,main,4,1,13,450,speech,HENRY BOLINGBROKE,HENRY BOLINGBROKE,"Lords, you that here are under our arrest,
Procure your sureties for your days of answer.
Little are we beholding to your love,
And little look'd for at your helping hands.",-0.471,-0.99689,-0.54759
richard-ii,Richard II,main,4,1,13,451,stage_direction,,,"Re-enter DUKE OF YORK, with KING RICHARD II, and Officers bearing the regalia",0.0,0.98782,0.32225
richard-ii,Richard II,main,4,1,13,452,speech,KING RICHARD II,KING RICHARD II,"Alack, why am I sent for to a king,
Before I have shook off the regal thoughts
Wherewith I reign'd? I hardly yet have learn'd
To insinuate, flatter, bow, and bend my limbs:
Give sorrow leave awhile to tutor me
To this submission. Yet I well remember
The favours of these men: were they not mine?
Did they not sometime cry, 'all hail!' to me?
So Judas did to Christ: but he, in twelve,
Found truth in all but one: I, in twelve thousand,
none.
God save the king! Will no man say amen?
Am I both priest and clerk? well then, amen.
God save the king! although I be not he;
And yet, amen, if heaven do think him me.
To do what service am I sent for hither?",0.9896,-0.87904,0.37964
richard-ii,Richard II,main,4,1,13,453,speech,DUKE OF YORK,DUKE OF YORK,"To do that office of thine own good will
Which tired majesty did make thee offer,
The resignation of thy state and crown
To Henry Bolingbroke.",-0.1027,-0.99624,-0.20165
richard-ii,Richard II,main,4,1,13,454,speech,KING RICHARD II,KING RICHARD II,"Give me the crown. Here, cousin, seize the crown;
Here cousin:
On this side my hand, and on that side yours.
Now is this golden crown like a deep well
That owes two buckets, filling one another,
The emptier ever dancing in the air,
The other down, unseen and full of water:
That bucket down and full of tears am I,
Drinking my griefs, whilst you mount up on high.",0.8338,-0.97361,-0.01436
richard-ii,Richard II,main,4,1,13,455,speech,HENRY BOLINGBROKE,HENRY BOLINGBROKE,I thought you had been willing to resign.,-0.34,-0.99626,-0.31424
richard-ii,Richard II,main,4,1,13,456,speech,KING RICHARD II,KING RICHARD II,"My crown I am; but still my griefs are mine:
You may my glories and my state depose,
But not my griefs; still am I king of those.",-0.3487,0.97796,-0.39409
richard-ii,Richard II,main,4,1,13,457,speech,HENRY BOLINGBROKE,HENRY BOLINGBROKE,Part of your cares you give me with your crown.,0.6124,-0.88494,-0.0593
richard-ii,Richard II,main,4,1,13,458,speech,KING RICHARD II,KING RICHARD II,"Your cares set up do not pluck my cares down.
My care is loss of care, by old care done;
Your care is gain of care, by new care won:
The cares I give I have, though given away;
They tend the crown, yet still with me they stay.",0.4933,0.96373,-0.71435
richard-ii,Richard II,main,4,1,13,459,speech,HENRY BOLINGBROKE,HENRY BOLINGBROKE,Are you contented to resign the crown?,0.4404,0.99045,-0.20032
richard-ii,Richard II,main,4,1,13,460,speech,KING RICHARD II,KING RICHARD II,"Ay, no; no, ay; for I must nothing be;
Therefore no no, for I resign to thee.
Now mark me, how I will undo myself;
I give this heavy weight from off my head
And this unwieldy sceptre from my hand,
The pride of kingly sway from out my heart;
With mine own tears I wash away my balm,
With mine own hands I give away my crown,
With mine own tongue deny my sacred state,
With mine own breath release all duty's rites:
All pomp and majesty I do forswear;
My manors, rents, revenues I forego;
My acts, decrees, and statutes I deny:
God pardon all oaths that are broke to me!
God keep all vows unbroke that swear to thee!
Make me, that nothing have, with nothing grieved,
And thou with all pleased, that hast all achieved!
Long mayst thou live in Richard's seat to sit,
And soon lie Richard in an earthly pit!
God save King Harry, unking'd Richard says,
And send him many years of sunshine days!
What more remains?",0.9783,-0.4202,0.88505
richard-ii,Richard II,main,4,1,13,461,speech,NORTHUMBERLAND,NORTHUMBERLAND,"No more, but that you read
These accusations and these grievous crimes
Committed by your person and your followers
Against the state and profit of this land;
That, by confessing them, the souls of men
May deem that you are worthily deposed.",0.1531,-0.99049,-0.65544
richard-ii,Richard II,main,4,1,13,462,speech,KING RICHARD II,KING RICHARD II,"Must I do so? and must I ravel out
My weaved-up folly? Gentle Northumberland,
If thy offences were upon record,
Would it not shame thee in so fair a troop
To read a lecture of them? If thou wouldst,
There shouldst thou find one heinous article,
Containing the deposing of a king
And cracking the strong warrant of an oath,
Mark'd with a blot, damn'd in the book of heaven:
Nay, all of you that stand and look upon,
Whilst that my wretchedness doth bait myself,
Though some of you with Pilate wash your hands
Showing an outward pity; yet you Pilates
Have here deliver'd me to my sour cross,
And water cannot wash away your sin .",-0.9568,-0.99685,0.10759
richard-ii,Richard II,main,4,1,13,463,speech,NORTHUMBERLAND,NORTHUMBERLAND,"My lord, dispatch; read o'er these articles.",0.0,-0.98189,0.45608
richard-ii,Richard II,main,4,1,13,464,speech,KING RICHARD II,KING RICHARD II,"Mine eyes are full of tears, I cannot see:
And yet salt water blinds them not so much
But they can see a sort of traitors here.
Nay, if I turn mine eyes upon myself,
I find myself a traitor with the rest;
For I have given here my soul's consent
To undeck the pompous body of a king;
Made glory base and sovereignty a slave,
Proud majesty a subject, state a peasant.",0.8885,-0.97186,0.61508
richard-ii,Richard II,main,4,1,13,465,speech,NORTHUMBERLAND,NORTHUMBERLAND,"My lord,—",0.0,0.96598,0.44336
richard-ii,Richard II,main,4,1,13,466,speech,KING RICHARD II,KING RICHARD II,"No lord of thine, thou haught insulting man,
Nor no man's lord; I have no name, no title,
No, not that name was given me at the font,
But 'tis usurp'd: alack the heavy day,
That I have worn so many winters out,
And know not now what name to call myself!
O that I were a mockery king of snow,
Standing before the sun of Bolingbroke,
To melt myself away in water-drops!
Good king, great king, and yet not greatly good,
An if my word be sterling yet in England,
Let it command a mirror hither straight,
That it may show me what a face I have,
Since it is bankrupt of his majesty.",0.3544,-0.99041,-0.14197
richard-ii,Richard II,main,4,1,13,467,speech,HENRY BOLINGBROKE,HENRY BOLINGBROKE,Go some of you and fetch a looking-glass.,0.0,-0.98834,0.29933
richard-ii,Richard II,main,4,1,13,468,stage_direction,,,Exit an attendant,0.0,-0.9918,-0.03455
richard-ii,Richard II,main,4,1,13,469,speech,NORTHUMBERLAND,NORTHUMBERLAND,Read o'er this paper while the glass doth come.,0.0,0.99226,-0.01072
richard-ii,Richard II,main,4,1,13,470,speech,KING RICHARD II,KING RICHARD II,"Fiend, thou torment'st me ere I come to hell!",-0.9359,-0.99225,-0.58692
richard-ii,Richard II,main,4,1,13,471,speech,HENRY BOLINGBROKE,HENRY BOLINGBROKE,"Urge it no more, my Lord Northumberland.",0.0,0.90609,-0.56979
richard-ii,Richard II,main,4,1,13,472,speech,NORTHUMBERLAND,NORTHUMBERLAND,The commons will not then be satisfied.,-0.3252,-0.97425,-0.42785
richard-ii,Richard II,main,4,1,13,473,speech,KING RICHARD II,KING RICHARD II,"They shall be satisfied: I'll read enough,
When I do see the very book indeed
Where all my sins are writ, and that's myself.",-0.0516,-0.90927,0.4136
richard-ii,Richard II,main,4,1,13,474,stage_direction,,,"Re-enter Attendant, with a glass",0.0,-0.92888,0.04089
richard-ii,Richard II,main,4,1,13,475,speech,KING RICHARD II,KING RICHARD II,"Give me the glass, and therein will I read.
No deeper wrinkles yet? hath sorrow struck
So many blows upon this face of mine,
And made no deeper wounds? O flattering glass,
Like to my followers in prosperity,
Thou dost beguile me! Was this face the face
That every day under his household roof
Did keep ten thousand men? was this the face
That, like the sun, did make beholders wink?
Was this the face that faced so many follies,
And was at last out-faced by Bolingbroke?
A brittle glory shineth in this face:
As brittle as the glory is the face;",-0.4857,-0.99646,-0.81573
richard-ii,Richard II,main,4,1,13,476,speech,KING RICHARD II,KING RICHARD II,"For there it is, crack'd in a hundred shivers.
Mark, silent king, the moral of this sport,
How soon my sorrow hath destroy'd my face.",-0.765,-0.998,-0.50666
richard-ii,Richard II,main,4,1,13,477,speech,HENRY BOLINGBROKE,HENRY BOLINGBROKE,"The shadow of your sorrow hath destroy'd
The shadow of your face.",-0.765,-0.9949,-0.69663
richard-ii,Richard II,main,4,1,13,478,speech,KING RICHARD II,KING RICHARD II,"Say that again.
The shadow of my sorrow! ha! let's see:
'Tis very true, my grief lies all within;
And these external manners of laments
Are merely shadows to the unseen grief
That swells with silence in the tortured soul;
There lies the substance: and I thank thee, king,
For thy great bounty, that not only givest
Me cause to wail but teachest me the way
How to lament the cause. I'll beg one boon,
And then be gone and trouble you no more.
Shall I obtain it?",-0.9138,0.99345,0.62237
richard-ii,Richard II,main,4,1,13,479,speech,HENRY BOLINGBROKE,HENRY BOLINGBROKE,"Name it, fair cousin.",0.3182,0.99035,0.44217
richard-ii,Richard II,main,4,1,13,480,speech,KING RICHARD II,KING RICHARD II,"'Fair cousin'? I am greater than a king:
For when I was a king, my flatterers
Were then but subjects; being now a subject,
I have a king here to my flatterer.
Being so great, I have no need to beg.",0.8427,0.95609,0.25925
richard-ii,Richard II,main,4,1,13,481,speech,HENRY BOLINGBROKE,HENRY BOLINGBROKE,Yet ask.,0.0,0.98884,-0.08264
richard-ii,Richard II,main,4,1,13,482,speech,KING RICHARD II,KING RICHARD II,And shall I have?,0.0,-0.9815,-0.0096
richard-ii,Richard II,main,4,1,13,483,speech,HENRY BOLINGBROKE,HENRY BOLINGBROKE,You shall.,0.0,0.97609,0.14187
richard-ii,Richard II,main,4,1,13,484,speech,KING RICHARD II,KING RICHARD II,Then give me leave to go.,0.0,0.99613,-0.03842
richard-ii,Richard II,main,4,1,13,485,speech,HENRY BOLINGBROKE,HENRY BOLINGBROKE,Whither?,0.0,-0.95774,-0.10612
richard-ii,Richard II,main,4,1,13,486,speech,KING RICHARD II,KING RICHARD II,"Whither you will, so I were from your sights.",0.0772,0.83898,-0.48841
richard-ii,Richard II,main,4,1,13,487,speech,HENRY BOLINGBROKE,HENRY BOLINGBROKE,"Go, some of you convey him to the Tower.",0.0,-0.97994,0.44524
richard-ii,Richard II,main,4,1,13,488,speech,KING RICHARD II,KING RICHARD II,"O, good! convey? conveyers are you all,
That rise thus nimbly by a true king's fall.",0.7901,-0.98589,0.07143
richard-ii,Richard II,main,4,1,13,489,stage_direction,,,"Exeunt KING RICHARD II, some Lords, and a Guard",0.0,-0.92609,0.26582
richard-ii,Richard II,main,4,1,13,490,speech,HENRY BOLINGBROKE,HENRY BOLINGBROKE,"On Wednesday next we solemnly set down
Our coronation: lords, prepare yourselves.",0.0,0.9942,0.37396
richard-ii,Richard II,main,4,1,13,491,stage_direction,,,"Exeunt all except the BISHOP OF CARLISLE, the Abbot of Westminster, and DUKE OF AUMERLE",0.0,-0.99054,-0.08885
richard-ii,Richard II,main,4,1,13,492,speech,ABBOT,ABBOT,A woeful pageant have we here beheld.,-0.4767,-0.99826,-0.47257
richard-ii,Richard II,main,4,1,13,493,speech,BISHOP OF CARLISLE,BISHOP OF CARLISLE,"The woe's to come; the children yet unborn.
Shall feel this day as sharp to them as thorn.",-0.7684,-0.99377,-0.75147
richard-ii,Richard II,main,4,1,13,494,speech,DUKE OF AUMERLE,DUKE OF AUMERLE,"You holy clergymen, is there no plot
To rid the realm of this pernicious blot?",0.0,-0.9838,-0.08516
richard-ii,Richard II,main,4,1,13,495,speech,ABBOT,ABBOT,"My lord,
Before I freely speak my mind herein,
You shall not only take the sacrament
To bury mine intents, but also to effect
Whatever I shall happen to devise.
I see your brows are full of discontent,
Your hearts of sorrow and your eyes of tears:
Come home with me to supper; and I'll lay
A plot shall show us all a merry day.",0.6187,0.98203,-0.65225
richard-ii,Richard II,main,4,1,13,496,stage_direction,,,Exeunt,0.0,-0.99139,-0.09471
richard-ii,Richard II,main,5,1,14,497,stage_direction,,,Enter QUEEN and Ladies,0.0,0.98172,0.19514
richard-ii,Richard II,main,5,1,14,498,speech,QUEEN,QUEEN,"This way the king will come; this is the way
To Julius Caesar's ill-erected tower,
To whose flint bosom my condemned lord
Is doom'd a prisoner by proud Bolingbroke:
Here let us rest, if this rebellious earth
Have any resting for her true king's queen.",-0.4588,0.08415,-0.50471
richard-ii,Richard II,main,5,1,14,499,stage_direction,,,Enter KING RICHARD II and Guard,0.0,0.98661,0.07218
richard-ii,Richard II,main,5,1,14,500,speech,QUEEN,QUEEN,"But soft, but see, or rather do not see,
My fair rose wither: yet look up, behold,
That you in pity may dissolve to dew,
And wash him fresh again with true-love tears.
Ah, thou, the model where old Troy did stand,
Thou map of honour, thou King Richard's tomb,
And not King Richard; thou most beauteous inn,
Why should hard-favour'd grief be lodged in thee,
When triumph is become an alehouse guest?",0.9252,0.95745,0.57606
richard-ii,Richard II,main,5,1,14,501,speech,KING RICHARD II,KING RICHARD II,"Join not with grief, fair woman, do not so,
To make my end too sudden: learn, good soul,
To think our former state a happy dream;
From which awaked, the truth of what we are
Shows us but this: I am sworn brother, sweet,
To grim Necessity, and he and I
Will keep a league till death. Hie thee to France
And cloister thee in some religious house:
Our holy lives must win a new world's crown,
Which our profane hours here have stricken down.",0.8316,-0.96224,0.81688
richard-ii,Richard II,main,5,1,14,502,speech,QUEEN,QUEEN,"What, is my Richard both in shape and mind
Transform'd and weaken'd? hath Bolingbroke deposed
Thine intellect? hath he been in thy heart?
The lion dying thrusteth forth his paw,
And wounds the earth, if nothing else, with rage
To be o'erpower'd; and wilt thou, pupil-like,
Take thy correction mildly, kiss the rod,
And fawn on rage with base humility,
Which art a lion and a king of beasts?",-0.2869,-0.99151,-0.09531
richard-ii,Richard II,main,5,1,14,503,speech,KING RICHARD II,KING RICHARD II,"A king of beasts, indeed; if aught but beasts,
I had been still a happy king of men.
Good sometime queen, prepare thee hence for France:
Think I am dead and that even here thou takest,
As from my death-bed, thy last living leave.
In winter's tedious nights sit by the fire
With good old folks and let them tell thee tales
Of woeful ages long ago betid;
And ere thou bid good night, to quit their griefs,
Tell thou the lamentable tale of me
And send the hearers weeping to their beds :
For why, the senseless brands will sympathize
The heavy accent of thy moving tongue
And in compassion weep the fire out;
And some will mourn in ashes, some coal-black,
For the deposing of a rightful king.",-0.9721,-0.96529,0.24586
richard-ii,Richard II,main,5,1,14,504,stage_direction,,,Enter NORTHUMBERLAND and others,0.0,0.98069,0.085
richard-ii,Richard II,main,5,1,14,505,speech,NORTHUMBERLAND,NORTHUMBERLAND,"My lord, the mind of Bolingbroke is changed:
You must to Pomfret, not unto the Tower.
And, madam, there is order ta'en for you;
With all swift speed you must away to France.",0.0,0.96472,0.70249
richard-ii,Richard II,main,5,1,14,506,speech,KING RICHARD II,KING RICHARD II,"Northumberland, thou ladder wherewithal
The mounting Bolingbroke ascends my throne,
The time shall not be many hours of age
More than it is ere foul sin gathering head
Shalt break into corruption: thou shalt think,
Though he divide the realm and give thee half,
It is too little, helping him to all;
And he shall think that thou, which know'st the way
To plant unrightful kings, wilt know again,
Being ne'er so little urged, another way
To pluck him headlong from the usurped throne.
The love of wicked men converts to fear;
That fear to hate, and hate turns one or both
To worthy danger and deserved death.",-0.9808,-0.96448,-0.69727
richard-ii,Richard II,main,5,1,14,507,speech,NORTHUMBERLAND,NORTHUMBERLAND,"My guilt be on my head, and there an end.
Take leave and part; for you must part forthwith.",0.2732,-0.985,0.62765
richard-ii,Richard II,main,5,1,14,508,speech,KING RICHARD II,KING RICHARD II,"Doubly divorced! Bad men, you violate
A twofold marriage, 'twixt my crown and me,
And then betwixt me and my married wife.
Let me unkiss the oath 'twixt thee and me;
And yet not so, for with a kiss 'twas made.
Part us, Northumberland; I toward the north,
Where shivering cold and sickness pines the clime;
My wife to France: from whence, set forth in pomp,
She came adorned hither like sweet May,
Sent back like Hallowmas or short'st of day.",0.6588,-0.99652,0.2223
richard-ii,Richard II,main,5,1,14,509,speech,QUEEN,QUEEN,And must we be divided? must we part?,-0.1431,-0.96228,-0.021
richard-ii,Richard II,main,5,1,14,510,speech,KING RICHARD II,KING RICHARD II,"Ay, hand from hand, my love, and heart from heart.",0.9709,0.99606,0.70871
richard-ii,Richard II,main,5,1,14,511,speech,QUEEN,QUEEN,Banish us both and send the king with me.,-0.4404,-0.99033,0.04341
richard-ii,Richard II,main,5,1,14,512,speech,NORTHUMBERLAND,NORTHUMBERLAND,That were some love but little policy.,0.2263,-0.99884,-0.45265
richard-ii,Richard II,main,5,1,14,513,speech,QUEEN,QUEEN,"Then whither he goes, thither let me go.",0.0,0.99303,-0.00292
richard-ii,Richard II,main,5,1,14,514,speech,KING RICHARD II,KING RICHARD II,"So two, together weeping, make one woe.
Weep thou for me in France, I for thee here;
Better far off than near, be ne'er the near.
Go, count thy way with sighs; I mine with groans.",-0.7506,-0.99022,0.42588
richard-ii,Richard II,main,5,1,14,515,speech,QUEEN,QUEEN,So longest way shall have the longest moans.,-0.5859,0.94831,-0.67126
richard-ii,Richard II,main,5,1,14,516,speech,KING RICHARD II,KING RICHARD II,"Twice for one step I'll groan, the way being short,
And piece the way out with a heavy heart.
Come, come, in wooing sorrow let's be brief,
Since, wedding it, there is such length in grief;
One kiss shall stop our mouths, and dumbly part;
Thus give I mine, and thus take I thy heart.",0.8591,-0.9699,-0.48331
richard-ii,Richard II,main,5,1,14,517,speech,QUEEN,QUEEN,"Give me mine own again; 'twere no good part
To take on me to keep and kill thy heart.
So, now I have mine own again, be gone,
That I might strive to kill it with a groan.",0.7003,-0.78722,-0.0107
richard-ii,Richard II,main,5,1,14,518,speech,KING RICHARD II,KING RICHARD II,"We make woe wanton with this fond delay:
Once more, adieu; the rest let sorrow say.",-0.8739,-0.99693,-0.5703
richard-ii,Richard II,main,5,1,14,519,stage_direction,,,Exeunt,0.0,-0.98496,0.12206
richard-ii,Richard II,main,5,2,15,520,stage_direction,,,Enter DUKE OF YORK and DUCHESS OF YORK,0.0,0.97634,0.03178
richard-ii,Richard II,main,5,2,15,521,speech,DUCHESS OF YORK,DUCHESS OF YORK,"My lord, you told me you would tell the rest,
When weeping made you break the story off,
of our two cousins coming into London.",-0.6486,-0.88857,0.03006
richard-ii,Richard II,main,5,2,15,522,speech,DUKE OF YORK,DUKE OF YORK,Where did I leave?,0.0,-0.98529,-0.01937
richard-ii,Richard II,main,5,2,15,523,speech,DUCHESS OF YORK,DUCHESS OF YORK,"At that sad stop, my lord,
Where rude misgovern'd hands from windows' tops
Threw dust and rubbish on King Richard's head.",-0.4767,-0.98778,-0.80355
richard-ii,Richard II,main,5,2,15,524,speech,DUKE OF YORK,DUKE OF YORK,"Then, as I said, the duke, great Bolingbroke,
Mounted upon a hot and fiery steed
Which his aspiring rider seem'd to know,
With slow but stately pace kept on his course,
Whilst all tongues cried 'God save thee,
Bolingbroke!'
You would have thought the very windows spake,
So many greedy looks of young and old
Through casements darted their desiring eyes
Upon his visage, and that all the walls
With painted imagery had said at once
'Jesu preserve thee! welcome, Bolingbroke!'
Whilst he, from the one side to the other turning,
Bareheaded, lower than his proud steed's neck,
Bespake them thus: 'I thank you, countrymen:'
And thus still doing, thus he pass'd along.",0.7488,0.99151,0.51543
richard-ii,Richard II,main,5,2,15,525,speech,DUCHESS OF YORK,DUCHESS OF YORK,"Alack, poor Richard! where rode he the whilst?",-0.5255,-0.99814,-0.82484
richard-ii,Richard II,main,5,2,15,526,speech,DUKE OF YORK,DUKE OF YORK,"As in a theatre, the eyes of men,
After a well-graced actor leaves the stage,
Are idly bent on him that enters next,
Thinking his prattle to be tedious;
Even so, or with much more contempt, men's eyes
Did scowl on gentle Richard; no man cried 'God save
him!'
No joyful tongue gave him his welcome home:
But dust was thrown upon his sacred head:
Which with such gentle sorrow he shook off,
His face still combating with tears and smiles,
The badges of his grief and patience,
That had not God, for some strong purpose, steel'd
The hearts of men, they must perforce have melted
And barbarism itself have pitied him.
But heaven hath a hand in these events,
To whose high will we bound our calm contents.
To Bolingbroke are we sworn subjects now,
Whose state and honour I for aye allow.",0.9476,0.99586,-0.13017
richard-ii,Richard II,main,5,2,15,527,speech,DUCHESS OF YORK,DUCHESS OF YORK,Here comes my son Aumerle.,0.0,0.99252,0.4998
richard-ii,Richard II,main,5,2,15,528,speech,DUKE OF YORK,DUKE OF YORK,"Aumerle that was;
But that is lost for being Richard's friend,
And, madam, you must call him Rutland now:
I am in parliament pledge for his truth
And lasting fealty to the new-made king.",0.7964,0.98883,-0.36722
